Project,Folder Name,File Name,Summary
"AbdurRKhalid","AbstractFactory","WindowsOSFactory.java","The `WindowsOSFactory` class, implementing the `GUIFactory` interface, is responsible for creating Windows-specific GUI components, specifically `Button` and `CheckBox` objects. It collaborates with these components to instantiate them. This class plays a role in both the Factory Method and Abstract Factory patterns, facilitating the creation of platform-specific objects. Additionally, it participates in the Memento pattern, suggesting involvement in capturing and restoring the internal state of objects."
"AbdurRKhalid","AbstractFactory","WindowsButton.java","The `WindowsButton` class, implementing the `Button` interface, is responsible for rendering a button specific to the Windows operating system. It collaborates with the `Button` interface to override the `paint()` method, facilitating platform-specific button rendering. This class is part of the Abstract Factory pattern, providing Windows-specific UI components, and is also involved in the Memento pattern, enabling state saving and restoration."
"AbdurRKhalid","AbstractFactory","Button.java","The `Button` interface defines a contract for painting buttons, serving as an abstract product in the Abstract Factory pattern. It collaborates with concrete button implementations, which are created by specific factory classes. The interface's role is central to the Abstract Factory pattern, enabling the creation of UI elements without specifying their concrete classes. Additionally, the Memento pattern is detected in the context, suggesting the interface may also support state-saving functionality."
"AbdurRKhalid","AbstractFactory","Test.java","The `Test` class serves as the entry point for the application, responsible for initiating the program execution. It collaborates with the `Application` class by invoking its `paint` method. No explicit design patterns are identified in this class."
"AbdurRKhalid","AbstractFactory","CheckBox.java","The `CheckBox` interface, part of the `AbstractFactory` pattern, defines a contract for painting a checkbox component. It collaborates with factory classes to create and manage checkbox instances. Additionally, it participates in the `Memento` pattern, suggesting it maintains state that can be saved and restored. Its primary responsibility is to provide a `paint` method for rendering the checkbox."
"AbdurRKhalid","AbstractFactory","MacOSFactory.java","The `MacOSFactory` class, implementing the `GUIFactory` interface, is responsible for creating macOS-specific GUI components. It collaborates with the `Button` and `CheckBox` classes to instantiate platform-specific versions. This class plays the role of a concrete factory in the Abstract Factory design pattern, providing an interface for creating families of related or dependent objects without specifying their concrete classes. Additionally, static analysis suggests the presence of the Memento pattern within the project."
"AbdurRKhalid","AbstractFactory","MacOSButton.java","The MacOSButton class, implementing the Button interface, is responsible for rendering buttons specific to macOS. It collaborates with the Button interface to define its paint method. Within the Abstract Factory pattern, it serves as a product variant, created by the concrete factory for macOS-specific components. Additionally, it participates in the Memento pattern, likely for saving and restoring button states."
"AbdurRKhalid","AbstractFactory","WindowsCheckBox.java","The WindowsCheckBox class, implementing the CheckBox interface, is responsible for rendering a checkbox component in a Windows-specific style. It collaborates with the Abstract Factory pattern to create platform-specific UI components and utilizes the Memento pattern for state management. The class overrides the paint method to provide Windows-specific rendering."
"AbdurRKhalid","AbstractFactory","Application.java","The Application class is responsible for creating and painting GUI components. It collaborates with a GUIFactory to instantiate a Button and a CheckBox. The class is part of a system where the Memento pattern is detected, suggesting it may participate in object state management. It is instantiated and used by the Test class."
"AbdurRKhalid","AbstractFactory","MacOSCheckBox.java","The MacOSCheckBox class, implementing the CheckBox interface, is responsible for rendering checkboxes specific to macOS. It collaborates with the abstract factory and factory method patterns to create platform-specific UI components, and may participate in the memento pattern for state management. Its sole method, paint(), overrides the interface's method to provide macOS-specific painting behavior."
"AbdurRKhalid","AbstractFactory","GUIFactory.java","The `GUIFactory` interface defines a contract for creating GUI components, serving as an abstract factory. It declares methods for creating `Button` and `CheckBox` objects, adhering to the Abstract Factory pattern. This interface enables the Factory Method pattern by delegating instantiation to subclasses. The Memento pattern's detection suggests potential collaboration with objects that manage state snapshots."
"AbdurRKhalid","Adapter","RoundHole.java","The RoundHole class represents a hole with a specific radius, encapsulating the geometric property within its private field. It collaborates with the RoundPeg class to determine if a peg can fit through the hole, as indicated by the fits method. The class does not exhibit any explicit design pattern roles based on the provided structural analysis."
"AbdurRKhalid","Adapter","RoundPeg.java","The `RoundPeg` class represents a peg with a circular shape, encapsulating its radius as a private field. It provides a constructor and a method to access the radius. Within the Adapter design pattern context, `RoundPeg` serves as the adaptee, collaborating with the `SquarePegAdapter` to enable compatibility with round holes."
"AbdurRKhalid","Adapter","SquarePegAdapter.java","The SquarePegAdapter class acts as an adapter in the Adapter design pattern, converting the interface of a SquarePeg to be compatible with a RoundPeg. It collaborates with SquarePeg, holding an instance as a private field. The class extends RoundPeg and overrides the getRadius() method to adapt the square peg's width to a radius, enabling its use in round holes."
"AbdurRKhalid","Adapter","Test.java","The `Test` class serves as the entry point for the AbdurRKhalid_Adapter project, with its sole responsibility being to execute the main method. It does not collaborate with other classes or implement any design patterns, as indicated by the lack of captured design pattern insights in static analysis."
"AbdurRKhalid","Adapter","SquarePeg.java","The SquarePeg class represents a square object with a specified width. It provides methods to retrieve the width and calculate the area of the square. As part of the Adapter pattern, it serves as the adaptee, collaborating with an adapter to enable compatibility with round pegs."
"AbdurRKhalid","Decorator","DataSourceDecorator.java","The `DataSourceDecorator` class serves as a decorator for `DataSource` objects, implementing the same interface. It wraps a `DataSource` instance, delegating calls to it while allowing for potential modifications or additions to the behavior. The class has a single collaborator, the `DataSource` it wraps, and is used in the `Test` class's main method. It does not explicitly implement a design pattern, but it follows the structure of the Decorator pattern."
"AbdurRKhalid","Decorator","EncryptionDecorator.java","The `EncryptionDecorator` class extends `DataSourceDecorator` and implements the Decorator pattern to add encryption functionality to a `DataSource`. It collaborates with a `DataSource` object, which is passed to its constructor. The class overrides `writeData` and `readData` methods to encode and decode data, respectively, utilizing private `encode` and `decode` methods."
"AbdurRKhalid","Decorator","Test.java","The `Test` class serves as the entry point for the application, initiating data operations. It collaborates with `DataSource` and `DataSourceDecorator` to read and write data, demonstrating a decorator pattern where `DataSourceDecorator` extends the functionality of `DataSource`. The class contains a single method, `main`, which orchestrates these interactions."
"AbdurRKhalid","Decorator","CompressionDecorator.java","The CompressionDecorator class extends DataSourceDecorator and implements the Decorator pattern to add compression functionality to a DataSource. It maintains a private compression level field and collaborates with a DataSource instance. Its responsibilities include compressing data before writing and decompressing data after reading. It overrides the writeData and readData methods, utilizing the private compress and decompress methods for data transformation."
"AbdurRKhalid","Decorator","FileDataSource.java","The `FileDataSource` class implements the `DataSource` interface, serving as a concrete component in a decorator pattern structure. It is responsible for managing data operations, specifically reading and writing data, with a focus on file-based data sources. The class maintains a private `name` field to identify the data source and collaborates with the `DataSource` interface to define its core functionality."
"AbdurRKhalid","Decorator","DataSource.java","The `DataSource` interface defines a contract for data manipulation operations, specifically `writeData` and `readData` methods. It serves as an abstraction for data sources, allowing various implementations to be used interchangeably. The interface is utilized by the `Test` class's `main` method, which interacts with it to perform data operations. No explicit design pattern roles are captured in the static analysis."
"AbdurRKhalid","Facade","Codec.java","The `Codec` interface defines a public contract for encoding and decoding operations, serving as a high-level facade in the AbdurRKhalid_Facade project. It collaborates with unspecified implementing classes to provide these functionalities. The interface is involved in the Memento pattern, suggesting its role in capturing and restoring the state of an object."
"AbdurRKhalid","Facade","OggCompressionCodec.java","The `OggCompressionCodec` class implements the `Codec` interface, indicating its responsibility for providing compression and decompression capabilities specific to the OGG format. It collaborates with the `Codec` interface to define its core functionality. The class is associated with the Memento design pattern, suggesting it participates in the process of capturing and restoring internal states."
"AbdurRKhalid","Facade","Test.java","The `Test` class serves as an entry point for the AbdurRKhalid_Facade project, responsible for initiating the video conversion process. It collaborates with the `VideoConversionFacade` class, delegating the conversion task to it via the `convertVideo` method. This class does not exhibit any explicit design pattern roles."
"AbdurRKhalid","Facade","VideoConversionFacade.java","The VideoConversionFacade class serves as a public interface for video conversion operations, handling the conversion of a video file to a specified format. It interacts with CodecFactory to extract necessary codecs, and collaborates with BitrateReader for reading and converting bitrates, and AudioMixer for audio fixes. The class does not explicitly implement any design patterns."
"AbdurRKhalid","Facade","VideoFile.java","The VideoFile class encapsulates video file information, storing the file name and codec type as private fields. It provides public methods to retrieve these values. The class is instantiated by the CodecFactory class, which uses it to extract codec information. No explicit design patterns are employed in this class."
"AbdurRKhalid","Facade","AudioMixer.java","The `AudioMixer` class is responsible for processing audio in a video file, as indicated by its `fix` method that takes a `VideoFile` object and returns a `File`. It collaborates with the `VideoConversionFacade` class, which calls its `fix` method during video conversion. No explicit design pattern roles are captured in the static analysis."
"AbdurRKhalid","Facade","CodecFactory.java","The `CodecFactory` class is responsible for extracting the appropriate codec from a video file. It collaborates with `VideoConversionFacade` to facilitate video conversion and interacts with `VideoFile` to determine the codec type. This class employs the Memento pattern, as indicated by static analysis, suggesting it captures and restores the internal state of the codec extraction process."
"AbdurRKhalid","Facade","MPEG4CompressionCodec.java","The MPEG4CompressionCodec class implements the Codec interface, indicating its responsibility for handling MPEG-4 compression. It collaborates with other classes through the Codec interface. Notably, it participates in the Memento design pattern, suggesting its role in capturing and restoring internal states for undo operations or state management. The class explicitly declares its type as ""mp4""."
"AbdurRKhalid","Facade","BitrateReader.java","The BitrateReader class is responsible for reading and converting video files using specified codecs. It provides two static methods: `read` and `convert`, which operate on VideoFile objects and utilize Codec objects. This class is invoked by the VideoConversionFacade for video conversion tasks, serving as a utility class within the facade pattern context."
"AbdurRKhalid","FactoryMethod","WindowsButton.java","The WindowsButton class, implementing the Button interface, is responsible for rendering and handling click events specific to a Windows operating system environment. It collaborates with itself to manage these actions. Within the Factory Method pattern, it serves as a concrete product, created by a corresponding factory. Additionally, it participates in the Memento pattern, suggesting it maintains or restores internal state."
"AbdurRKhalid","FactoryMethod","Button.java","The `Button` interface defines a contract for button-like components, requiring implementations to provide `render` and `onClick` methods. It serves as a participant in the Memento pattern, suggesting its state can be saved and restored. Collaborators are implied by the pattern, likely including a concrete button class and a memento class for state management."
"AbdurRKhalid","FactoryMethod","Test.java","The `Test` class serves as an entry point for the application, containing a static `main` method. It holds a private static reference to a `Dialog` object, indicating its responsibility to instantiate and manage this dialog. No explicit design patterns are captured in the static analysis, suggesting a straightforward implementation."
"AbdurRKhalid","FactoryMethod","Dialog.java","The `Dialog` class is an abstract class that serves as a creator in the Factory Method pattern, responsible for rendering a window and creating buttons. It collaborates with a concrete subclass to implement the `createButton` method. The class also participates in the Memento pattern, suggesting it maintains internal state that can be saved and restored."
"AbdurRKhalid","FactoryMethod","WindowsDialog.java","The `WindowsDialog` class, extending `Dialog`, is responsible for creating platform-specific buttons in a Windows environment. It collaborates with the `Button` class and overrides the `createButton()` method to instantiate Windows-specific buttons. The class operates within the context of the Memento pattern, suggesting it participates in the saving and restoring of internal states."
"AbdurRKhalid","FactoryMethod","HtmlDialog.java","The `HtmlDialog` class, a public subclass of `Dialog`, is responsible for creating HTML-specific dialog buttons. It overrides the `createButton()` method to tailor button creation for HTML contexts. Collaborating with the `Dialog` superclass, it adheres to the Factory Method pattern, delegating button instantiation to subclasses. Notably, static analysis suggests the presence of the Memento pattern within its design context."
"AbdurRKhalid","FactoryMethod","HtmlButton.java","The `HtmlButton` class, implementing the `Button` interface, is responsible for rendering and handling click events for HTML buttons. It collaborates with itself to perform these actions. Within the Factory Method pattern, it serves as a concrete product, while the Memento pattern suggests it maintains internal state for undo/redo operations."
"AbdurRKhalid","Memento","TextEditor.java","The TextEditor class manages text editing operations, collaborating with a TextWindow to display and manipulate text. It maintains a saved state of the TextWindow to enable undo functionality. The class provides methods to save the current state and revert to the saved state, implementing a basic undo mechanism. No explicit design patterns are captured in the static analysis."
"AbdurRKhalid","Memento","TextWindow.java","The TextWindow class is responsible for managing and manipulating a string of text, represented by the private StringBuilder field currentText. It provides methods to add text, save the current state as a TextWindowState object, and restore a previously saved state. The class collaborates with the TextWindowState class for state management, but no explicit design patterns are captured in the static analysis."
"AbdurRKhalid","Memento","TextWindowState.java","The `TextWindowState` class encapsulates the state of a text window, storing the text content as a private field. It provides a constructor to initialize the text and a getter method to retrieve it. The class does not explicitly collaborate with other classes or participate in any design patterns. Its primary responsibility is to maintain and provide access to the text state."
"AbdurRKhalid","Observer","EmailNotificationListener.java","The `EmailNotificationListener` class, implementing the `EventListener` interface, acts as an observer in the Observer pattern. It is responsible for sending email notifications upon receiving updates. The class collaborates with a `File` object to access relevant data and uses a private `email` field to store the recipient's address. The single constructor initializes the email address, and the `update` method processes event notifications."
"AbdurRKhalid","Observer","EventManager.java","The EventManager class, adhering to the Observer design pattern, manages event listeners for various operations. It maintains a map of event types to lists of EventListener collaborators. Its responsibilities include subscribing and unsubscribing listeners to specific event types, and notifying listeners when an event occurs, passing relevant file data."
"AbdurRKhalid","Observer","EventListener.java","The `EventListener` interface defines a contract for observers in the Observer pattern, requiring implementing classes to provide an `update` method. It collaborates with subjects that notify observers of events, passing a `String` event type and `File` object. This interface enables decoupled event handling, allowing flexible and dynamic observer registration and notification."
"AbdurRKhalid","Observer","Editor.java","The Editor class is responsible for managing file operations, specifically opening and saving files. It collaborates with an EventManager to handle events and maintains a reference to a File object. The class does not explicitly implement any design patterns, as per static analysis."
"AbdurRKhalid","Observer","LogOpenListener.java","The `LogOpenListener` class, implementing the `EventListener` interface, acts as an observer in the Observer pattern, responding to file-related events. It maintains a private `File` reference and is initialized with a file name. The class updates its state based on incoming events, collaborating with the `File` class to manage log file operations."
"AbdurRKhalid","Singleton","Test.java","The `Test` class serves as an entry point for the application, containing a single public static `main` method. It is responsible for initiating the program execution, though its specific collaborators and actions are not discernible from the provided structural facts. No design patterns are explicitly identified within this class."
"AbdurRKhalid","Singleton","Singleton.java","The Singleton class is responsible for managing a single instance of itself, encapsulating a String value. It collaborates with the String class to store its value. The class implements the Singleton design pattern, ensuring only one instance exists, accessed via the static getInstance method. The private constructor prevents external instantiation."
"AbdurRKhalid","Visitor","ComputerPart.java","The `ComputerPart` interface defines a contract for accepting visitors, adhering to the Visitor design pattern. It is utilized by the `Test` class and is extended by the `Computer` class, which also implements the `accept` method. Its primary responsibility is to enable visitation by the `ComputerPartVisitor` interface."
"AbdurRKhalid","Visitor","Monitor.java","The Monitor class, a public subclass of ComputerPart, implements the Visitor pattern by defining an accept method that calls ComputerPartVisitor's visit method. It serves as an element in the Visitor pattern, allowing operations to be performed on it by different visitors."
"AbdurRKhalid","Visitor","Mouse.java","The `Mouse` class, a public subclass of `ComputerPart`, implements the `ComputerPart` interface and participates in the Visitor design pattern. Its primary responsibility is to accept visitors, facilitating operations on the object structure without modifying its classes. It collaborates with `ComputerPartVisitor`, calling its `visit` method to perform specific operations on the `Mouse` instance."
"AbdurRKhalid","Visitor","ComputerPartDisplayVisitor.java","The `ComputerPartDisplayVisitor` class, as a concrete visitor in the Visitor pattern, extends `ComputerPartVisitor` and implements the `ComputerPartVisitor` interface. It is responsible for displaying computer parts by overriding and implementing methods to visit `Computer`, `Mouse`, `Keyboard`, and `Monitor` objects, thereby adhering to the Visitor pattern's structure."
"AbdurRKhalid","Visitor","Test.java","The `Test` class serves as the entry point for the AbdurRKhalid_Visitor project, housing the `main` method to initiate program execution. It interacts with the `ComputerPart` class by invoking its `accept` method, suggesting a role in facilitating visitor pattern operations. No explicit design patterns are captured in static analysis."
"AbdurRKhalid","Visitor","Keyboard.java","The `Keyboard` class, a public subclass of `ComputerPart`, implements the Visitor pattern by accepting a `ComputerPartVisitor` to perform operations on it. Its primary responsibility is to facilitate visitor access, demonstrated by the overridden `accept` method, which delegates to `ComputerPartVisitor.visit`. This design enables flexible operation execution on `Keyboard` instances without modifying its class."
"AbdurRKhalid","Visitor","Computer.java","The `Computer` class, extending and implementing `ComputerPart`, represents a component in a hierarchical structure. It maintains a collection of `ComputerPart` objects and facilitates visitor access via the `accept` method, adhering to the Visitor design pattern. The class collaborates with `ComputerPartVisitor` to enable operation execution on its parts, demonstrating a clear separation of concerns."
"AbdurRKhalid","Visitor","ComputerPartVisitor.java","The `ComputerPartVisitor` interface defines a visitor pattern, specifying methods to visit various computer parts. It collaborates with `Computer`, `Mouse`, `Keyboard`, and `Monitor` classes, which call its `visit` methods. The interface's responsibility is to establish a contract for operations to be performed on computer parts, enabling the visitor pattern's behavior."
"JamesZBL","abstract-factory","YoungSailor.java","The `YoungSailor` class, implementing the `Sailor` interface, represents a young sailor with a static description. It collaborates within a system utilizing multiple design patterns: it is created via the Factory Method and Abstract Factory patterns, participates in the Observer pattern for state changes, and supports the Memento pattern for state saving and restoring."
"JamesZBL","abstract-factory","OldShip.java","The OldShip class, implementing the Ship interface, represents a specific type of ship with a predefined description. It collaborates within an abstract factory pattern context, suggesting it is created by a factory method. Additionally, it participates in observer and memento patterns, indicating it may be observed for state changes and support state restoration. Its primary responsibility is to provide a description of an old ship."
"JamesZBL","abstract-factory","YoungTeamFactory.java","The `YoungTeamFactory` class, implementing the `TeamFactory` interface, is responsible for creating young team members, including ships, captains, and sailors. It collaborates with the `Ship`, `Captain`, and `Sailor` classes to instantiate these objects. This class participates in the Factory Method, Abstract Factory, and Memento design patterns, facilitating the creation and management of team entities."
"JamesZBL","abstract-factory","YoungCaptain.java","The `YoungCaptain` class, implementing the `Captain` interface, is responsible for providing a specific description of a young captain. It collaborates within an abstract factory pattern context, suggesting it is one of several product variants created by a concrete factory. Additionally, it participates in observer and memento patterns, indicating it may be subject to observation and state management."
