Project,Folder Name,File Name,Summary
"spring-framework","AbstractFactory","HierarchicalBeanFactory.java","The HierarchicalBeanFactory interface extends BeanFactory, indicating its responsibility in managing beans within a hierarchical structure. It collaborates with another BeanFactory instance as its parent, facilitating bean inheritance. The interface defines methods to retrieve the parent BeanFactory and check for local bean existence, emphasizing its role in hierarchical bean management. No explicit design patterns are captured in static analysis."
"spring-framework","AbstractFactory","ListableBeanFactory.java","The `ListableBeanFactory` interface extends `BeanFactory` and is responsible for providing methods to enumerate beans, check for bean definitions, and retrieve beans by type. It collaborates with `ObjectProvider` and `ResolvableType` to facilitate bean retrieval and type resolution. No explicit design patterns are captured in static analysis."
"spring-framework","Adapter","IsolationLevelDataSourceAdapter.java","The `IsolationLevelDataSourceAdapter` class extends `UserCredentialsDataSourceAdapter` and manages transaction isolation levels for database connections. It utilizes a static map of constant strings to integer isolation levels and collaborates with `TransactionDefinition` for predefined isolation level values. The class allows setting isolation levels via name or integer value, and retrieves the current isolation level and read-only flag. It overrides the `doGetConnection` method to incorporate isolation level settings. No explicit design patterns are identified."
"spring-framework","Adapter","HttpRequestHandlerAdapter.java","The `HttpRequestHandlerAdapter` class, implementing the `HandlerAdapter` interface, adapts HTTP request handling. It supports and processes requests via the `supports` and `handle` methods, collaborating with `HttpServletRequest` and `HttpServletResponse` objects. No explicit design patterns are captured in static analysis."
"spring-framework","Adapter","SimpleControllerHandlerAdapter.java","The `SimpleControllerHandlerAdapter` class, implementing the `HandlerAdapter` interface, is responsible for adapting controller handlers in the Spring Framework. It collaborates with `HttpServletRequest`, `HttpServletResponse`, and generic handler objects to determine support for a handler and process requests, returning a `ModelAndView` object. No explicit design pattern roles are captured in static analysis."
"spring-framework","Adapter","MethodBeforeAdviceAdapter.java","The MethodBeforeAdviceAdapter class implements the AdvisorAdapter and Serializable interfaces, acting as an adapter for MethodBeforeAdvice. It checks advice support via supportsAdvice and provides a MethodInterceptor through getInterceptor, collaborating with Advisor. No explicit design patterns are identified."
"spring-framework","Decorator","BufferingClientHttpResponseWrapper.java","The `BufferingClientHttpResponseWrapper` class is a final implementation of the `ClientHttpResponse` interface, designed to buffer the response body. It collaborates with a `ClientHttpResponse` instance to delegate operations like getting status code, status text, headers, and closing the response. The class overrides the `getBody()` method to provide a buffered input stream, utilizing a volatile byte field for internal state management. No explicit design pattern roles are identified."
"spring-framework","Decorator","ContentCachingRequestWrapper.java","The ContentCachingRequestWrapper class extends HttpServletRequestWrapper to cache the content of an HTTP request. It collaborates with FastByteArrayOutputStream to store the cached content and manages ServletInputStream and BufferedReader for input handling. The class overrides methods to provide cached content, with a focus on parameter handling and input stream management. It does not explicitly implement a design pattern."
"spring-framework","Decorator","ScopedProxyBeanDefinitionDecorator.java","The ScopedProxyBeanDefinitionDecorator class implements the BeanDefinitionDecorator interface, focusing on decorating bean definitions within the Spring Framework. It utilizes the PROXY_TARGET_CLASS constant and overrides the decorate method to modify bean definitions, collaborating with Node, BeanDefinitionHolder, and ParserContext objects. No explicit design patterns are identified in its structure."
"spring-framework","Decorator","WebSocketHandlerDecorator.java","The `WebSocketHandlerDecorator` class implements the `WebSocketHandler` interface and acts as a decorator, extending the functionality of a wrapped `WebSocketHandler` instance. It maintains a private `delegate` field, which is set via its constructor. The class overrides several methods to provide custom behavior, delegating calls to the `delegate` instance. It also provides methods to access the `delegate` and unwrap nested decorators. No explicit design patterns are captured in static analysis."
"spring-framework","Facade","RestTemplate.java","The `RestTemplate` class is a public facade for performing synchronous client-side HTTP requests within the Spring Framework. It extends `InterceptingHttpAccessor` and implements `RestOperations`, utilizing collaborators like `HttpMessageConverter` for message conversion, `ResponseErrorHandler` for error handling, and `UriTemplateHandler` for URI template handling. It manages a list of message converters and provides methods for setting and getting these converters, as well as handling errors and extracting responses. The class does not explicitly follow a specific design pattern."
"spring-framework","Facade","TransactionTemplate.java","The `TransactionTemplate` class, extending `DefaultTransactionDefinition` and implementing `TransactionOperations` and `InitializingBean`, serves as a template for transactional operations. It collaborates with a `PlatformTransactionManager` to manage transactions, which is set and retrieved via public methods. The class executes transactional actions through the `execute` method, handling rollbacks on exceptions. It overrides methods from its superclass and interfaces, demonstrating a template method pattern."
"spring-framework","Facade","JmsTemplate.java","The `JmsTemplate` class, extending `JmsDestinationAccessor` and implementing `JmsOperations`, serves as a high-level abstraction for JMS operations. It manages default destinations, message conversion, and JMS resource access. Key collaborators include `ConnectionFactory`, `MessageConverter`, and `JmsDestinationAccessor`. It utilizes a `SimpleMessageConverter` for message conversion and a `JmsTemplateResourceFactory` for transactional resource management. No explicit design patterns are identified."
"spring-framework","Facade","JdbcTemplate.java","The `JdbcTemplate` class, extending `JdbcAccessor` and implementing `JdbcOperations`, serves as a core component for database operations in the Spring Framework. It manages JDBC resources and executes SQL queries, with responsibilities including setting query parameters and handling results. It collaborates with various internal methods and external classes like `BatchUpdateStatementCallback` for batch operations. No explicit design patterns are captured in static analysis."
"spring-framework","FactoryMethod","CronTriggerFactoryBean.java","The `CronTriggerFactoryBean` class is responsible for creating and configuring `CronTrigger` instances in the Spring Framework, acting as a `FactoryBean`. It collaborates with `JobDetail`, `JobDataMap`, and other scheduling-related classes. The class implements `BeanNameAware` and `InitializingBean` interfaces, allowing it to be aware of its bean name and perform initialization tasks. It does not explicitly follow any design patterns."
"spring-framework","FactoryMethod","SchedulerFactoryBean.java","The `SchedulerFactoryBean` class is responsible for creating and managing a Quartz Scheduler instance, serving as a FactoryBean. It implements several Spring interfaces, indicating its role in the bean lifecycle and application context awareness. Collaborators include `SchedulerFactory`, `ResourceLoader`, `Executor`, and `DataSource`, accessed via static methods and instance fields. It does not explicitly follow a design pattern."
"spring-framework","FactoryMethod","AdaptableJobFactory.java","The AdaptableJobFactory class, implementing the JobFactory interface, is responsible for creating and adapting job instances. It collaborates with TriggerFiredBundle and Scheduler to produce new jobs. The class overrides the newJob method and provides protected methods createJobInstance and adaptJob to facilitate job creation and adaptation, respectively. No explicit design patterns are captured in the static analysis."
"spring-framework","FactoryMethod","JobDetailFactoryBean.java","The `JobDetailFactoryBean` class is a public factory bean that creates and configures `JobDetail` instances for the Quartz scheduler. It implements several Spring interfaces, including `FactoryBean`, `BeanNameAware`, `ApplicationContextAware`, and `InitializingBean`, indicating its role in Spring's IoC container. It collaborates with `JobDataMap` to store job-specific data and uses a `Class` object to specify the job class. It does not explicitly follow a design pattern."
"spring-framework","FactoryMethod","MethodInvokingJobDetailFactoryBean.java","The `MethodInvokingJobDetailFactoryBean` class is responsible for creating `JobDetail` instances for use with a scheduler, extending `ArgumentConvertingMethodInvoker` and implementing several `Aware` and `FactoryBean` interfaces. It collaborates with a target bean, whose method will be invoked when the job is executed. The class configures job details such as name, group, and concurrency. It adheres to the Factory Method pattern, providing a mechanism to create job instances without specifying the exact class."
"spring-framework","Memento","SimpleApplicationEventMulticaster.java","The `SimpleApplicationEventMulticaster` class is responsible for multicasting application events, extending `AbstractApplicationEventMulticaster`. It collaborates with `Executor` for task execution and `ErrorHandler` for error management. The class utilizes a `Log` for logging purposes. It overrides methods to multicast events, with no explicit design patterns identified."
"spring-framework","Memento","SavepointManager.java","The `SavepointManager` interface defines a contract for managing savepoints in a system, allowing the creation, rollback, and release of savepoints. It collaborates with an unspecified object type to represent savepoints. The interface does not explicitly implement any design patterns, and its methods suggest a responsibility for state management and recovery."
"spring-framework","Memento","AbstractTransactionStatus.java","The `AbstractTransactionStatus` class, implementing the `TransactionStatus` interface, manages transaction state and savepoints. It maintains rollback and completion statuses, and interacts with a savepoint manager to handle savepoints. Key collaborators include the savepoint manager and transaction-related classes. It does not explicitly follow a design pattern."
"spring-framework","Observer","ApplicationEventPublisher.java","The `ApplicationEventPublisher` interface defines a contract for publishing events within the Spring Framework. It declares two methods: `publishEvent` for distributing `ApplicationEvent` objects and another overloaded `publishEvent` for generic `Object` events. This interface facilitates the Observer design pattern by enabling components to notify listeners of state changes."
"spring-framework","Observer","ApplicationListener.java","The `ApplicationListener` interface, part of the Observer pattern, defines a contract for listening to application events in the Spring Framework. It extends `EventListener` and requires implementing classes to handle events via the `onApplicationEvent` method. Collaborators include event objects, with a static factory method `forPayload` enabling creation of listeners for payload events, utilizing a `Consumer` for event handling."
"spring-framework","Observer","AbstractApplicationEventMulticaster.java","The AbstractApplicationEventMulticaster class serves as an abstract base for event multicasting in the Spring framework, implementing ApplicationEventMulticaster, BeanClassLoaderAware, and BeanFactoryAware. It manages event listeners and their retrieval, collaborating with DefaultListenerRetriever and maintaining a cache of listeners. It is aware of its bean class loader and factory, which it uses to manage listeners. No explicit design patterns are captured in static analysis."
"spring-framework","Singleton","SmartInitializingSingleton.java","The `SmartInitializingSingleton` interface defines a contract for objects that require notification after all singleton beans have been instantiated in the Spring framework. It declares a single method, `afterSingletonsInstantiated()`, which implementing classes must provide. This interface serves as a callback mechanism, allowing beans to perform initialization tasks that depend on other singletons being available. It does not explicitly follow a specific design pattern."
"spring-framework","Singleton","DefaultSingletonBeanRegistry.java","The DefaultSingletonBeanRegistry class, extending SimpleAliasRegistry and implementing SingletonBeanRegistry, manages singleton beans in the Spring framework. It utilizes several concurrent maps to store singleton objects, factories, callbacks, and early singletons, with a ReentrantLock for thread safety. The class collaborates with various methods to register, retrieve, and manage singleton beans, without explicitly employing a specific design pattern."
"spring-framework","Singleton","DefaultListableBeanFactory.java","The `DefaultListableBeanFactory` class, extending `AbstractAutowireCapableBeanFactory` and implementing several interfaces, serves as a configurable and serializable bean factory in the Spring framework. It manages bean definitions, allowing registration, removal, and modification, and supports bean instantiation and wiring. Key collaborators include `BeanDefinitionRegistry` and `ConfigurableListableBeanFactory`. The class handles serialization through a unique ID and manages bean definition overriding and eager class loading. No explicit design patterns are captured in static analysis."
"spring-framework","Singleton","SingletonSupplier.java","The SingletonSupplier class is responsible for managing and supplying singleton instances of type T. It implements the Supplier interface and utilizes a ReentrantLock for thread-safe initialization. Key collaborators include the instanceSupplier and defaultSupplier, which are used to create and provide the singleton instance. The class offers static factory methods for creating instances with different configurations, ensuring lazy initialization and thread safety. No explicit design pattern is captured in the static analysis."
"spring-framework","Singleton","SingletonBeanRegistry.java","The SingletonBeanRegistry interface defines a registry for managing singleton objects within a Spring application context. It allows registration, retrieval, and management of singletons, collaborating with String for bean names and Object for singleton instances. It also supports callbacks via Consumer for singleton objects. No explicit design pattern roles are captured in static analysis."
"spring-framework","Visitor","BeanDefinitionVisitor.java","The `BeanDefinitionVisitor` class is responsible for visiting and processing various attributes of a `BeanDefinition`, such as parent name, bean class name, and scope. It collaborates with a `StringValueResolver` to resolve string values and interacts with other methods within the class to handle collections like maps, sets, lists, and arrays. The class does not explicitly implement any design patterns."
"spring-framework","Visitor","BeanFactory.java","The `BeanFactory` interface defines a registry for containing and managing the lifecycle of beans, providing methods to retrieve beans by name or type. It collaborates with `ObjectProvider` for lazy bean retrieval. The interface includes constants for factory bean prefix identification. No explicit design patterns are captured in static analysis."
