Project,Folder Name,File Name,Summary
"JamesZBL","abstract-factory","Captain.java","The `Captain` interface, extending `Member`, serves as a key participant in multiple design patterns. It collaborates within the abstract factory pattern, likely facilitating the creation of related objects. Additionally, it engages in the observer pattern, suggesting it manages or is observed by other objects. The memento pattern involvement indicates it may handle object state capture and restoration."
"JamesZBL","abstract-factory","OldSailor.java","The OldSailor class, implementing the Sailor interface, represents an old sailor with a static description field. It collaborates within a system utilizing the Factory Method, Abstract Factory, Observer, and Memento patterns, suggesting its role in object creation, observation, and state management processes. Its primary responsibility is to provide a description of the old sailor."
"JamesZBL","abstract-factory","NewShip.java","The `NewShip` class, implementing the `Ship` interface, represents a new ship with a static description field. It provides a method to retrieve this description. It participates in the abstract factory, observer, and memento patterns, suggesting it is created by a factory, can be observed, and its state can be saved and restored."
"JamesZBL","abstract-factory","PermanentTeamFactory.java","The `PermanentTeamFactory` class, implementing the `TeamFactory` interface, is responsible for creating permanent team members, including ships, captains, and sailors. It collaborates with the `Ship`, `Captain`, and `Sailor` classes to instantiate these objects. This class plays the role of a concrete factory in the Abstract Factory pattern, providing an interface for creating families of related or dependent objects without specifying their concrete classes. Additionally, it participates in the Memento pattern, suggesting it may also handle the saving and restoring of team states."
"JamesZBL","abstract-factory","OldCaptain.java","The OldCaptain class, implementing the Captain interface, is responsible for providing a specific description of an old captain. It collaborates within an abstract factory pattern context, suggesting it is one of several product variants created by a concrete factory. Additionally, it participates in observer and memento patterns, indicating it may be observed for state changes and support state restoration."
"JamesZBL","abstract-factory","Ship.java","The `Ship` interface, extending `Member`, serves as an abstract blueprint for ship entities within the system. It participates in the abstract factory, observer, and memento patterns, suggesting it is created by a factory, can be observed for state changes, and supports state restoration. Collaborators include factory classes and observer/memento pattern participants."
"JamesZBL","abstract-factory","TeamFactory.java","The `TeamFactory` interface defines a contract for creating teams of ships, captains, and sailors, adhering to the Abstract Factory pattern. It declares methods for creating each team member, suggesting its responsibility is to abstract the instantiation process. The interface collaborates with `Ship`, `Captain`, and `Sailor` classes. Static analysis indicates the presence of Factory Method, Abstract Factory, and Memento patterns, implying that `TeamFactory` may also support object state saving and restoration."
"JamesZBL","abstract-factory","Application.java","The `Application` class is responsible for creating and managing a team consisting of a `Ship`, `Captain`, and `Sailor` using a `TeamFactory`. It collaborates with these components and utilizes the Observer and Memento design patterns, as detected via static analysis, to manage state and notifications within the application context. The class serves as the main entry point, orchestrating team creation and providing access to team members."
"JamesZBL","abstract-factory","Member.java","The `Member` interface defines a contract for objects that can provide a description through the `getDescription()` method. It serves as an abstract blueprint for member entities within the system, without specifying implementation details. No explicit design patterns or collaborators are captured in the static analysis."
"JamesZBL","abstract-factory","Sailor.java","The `Sailor` interface, extending `Member`, defines the abstract behavior for sailor entities within the system. It participates in the abstract factory, observer, and memento patterns, suggesting it is created through a factory, can be observed for state changes, and supports state saving and restoration. Collaborators include the factory producing `Sailor` instances and observers monitoring these instances."
"JamesZBL","adapter","Bus.java","The `Bus` class in the JamesZBL_adapter project is responsible for executing a specific operation, as indicated by its `run()` method. It utilizes a `Logger` instance for logging purposes, collaborating with the `LoggerFactory` to obtain this logger. No explicit design patterns are captured in the static analysis of this class."
"JamesZBL","adapter","Car.java","The `Car` interface defines a contract for driving functionality within the JamesZBL_adapter project. It serves as a component in the Decorator pattern, allowing for the dynamic addition of responsibilities to car objects. The interface's sole method, `drive()`, is intended to be implemented by concrete car classes, which may be wrapped by decorators to extend or alter their behavior."
"JamesZBL","adapter","Driver.java","The `Driver` class, implementing the `Car` interface, is responsible for driving a car. It collaborates with a `Car` instance, which is set via its constructor. The class adheres to the Decorator pattern, allowing for the dynamic addition of responsibilities to a car object."
"JamesZBL","adapter","Application.java","The Application class serves as the entry point for the JamesZBL_adapter project, with its sole responsibility being to execute the main method. It does not collaborate with other classes or employ any discernible design patterns, as indicated by the lack of static analysis insights."
"JamesZBL","adapter","BusAdapter.java","The BusAdapter class, implementing the Car interface, acts as a decorator, adapting a Bus to conform to the Car interface. It encapsulates a Bus instance and overrides the drive method, likely to provide Bus-specific driving behavior. This class adheres to the Decorator design pattern, enhancing or modifying the Bus's functionality without altering its structure."
"JamesZBL","decorator","HammerSmithOperation.java","The `HammerSmithOperation` class, implementing the `Operation` interface, acts as a decorator in the Decorator pattern, enhancing the behavior of other operations. It collaborates with a `previousOperation` to which it delegates tasks. The class uses a logger for tracking and overrides methods to perform actions before and after the delegated operation."
"JamesZBL","decorator","Operation.java","The `Operation` interface defines a contract for operations that can be decorated, as evidenced by its role in the Decorator pattern. It specifies three methods: `checkBefore`, `join`, and `checkAfter`, indicating a sequence of actions to be performed. Collaborators would implement this interface to provide concrete behavior, while decorators would extend functionality without altering the original implementation."
"JamesZBL","decorator","Application.java","The `Application` class serves as the entry point for the JamesZBL_decorator project, with its sole responsibility being to initiate the program execution. It utilizes the `Logger` interface from the `LoggerFactory` for logging purposes, demonstrating a dependency on the SLF4J API. No explicit design patterns are employed within this class."
"JamesZBL","decorator","CarpenterOperation.java","The `CarpenterOperation` class, implementing the `Operation` interface, serves as a concrete component in the Decorator pattern, providing core functionality for carpentry operations. It utilizes a static `Logger` for logging and overrides methods `checkBefore`, `join`, and `chekcAfter` to define its specific behavior. The class collaborates with the `Operation` interface and is designed to be extended or wrapped by decorators to add responsibilities dynamically."
"JamesZBL","facade","CourseFacade.java","The `CourseFacade` class serves as an intermediary, managing course participants through a private list of `CourseParticipator` objects. It provides three public methods: `prepare()`, `proceed()`, and `stop()`, suggesting a lifecycle management role. No explicit design patterns are identified. The class encapsulates course participant interactions, offering a simplified interface for course management."
"JamesZBL","facade","CourseParticipator.java","The `CourseParticipator` class is an abstract public class responsible for defining the basic behavior of course participants, including preparing, proceeding, and stopping a course, as well as navigating between school and home. It utilizes a static `Logger` for logging purposes. The class does not explicitly implement any design patterns, but it serves as a base for other classes to extend and implement the abstract `name()` method."
"JamesZBL","facade","CourseStudent.java","The `CourseStudent` class, a public subclass of `CourseParticipator`, is responsible for representing a student in a course context. It overrides the `name()` method to provide student-specific naming functionality. The class collaborates with its parent class to inherit and potentially extend course participant behaviors. No design patterns are explicitly captured in the static analysis of this class."
"JamesZBL","facade","Application.java","The `Application` class serves as the entry point for the JamesZBL_facade project, with its sole responsibility being to initiate the program execution. It contains a single public static `main` method, which takes a `String` array as an argument, indicating it processes command-line arguments. No design patterns are explicitly identified through static analysis."
"JamesZBL","facade","CourseTeacher.java","The CourseTeacher class, a public subclass of CourseParticipator, is responsible for representing a teacher within a course context. It overrides the name() method to provide teacher-specific naming functionality. Collaborating with other classes through inheritance, it extends the base CourseParticipator functionality without explicitly implementing any design patterns."
"JamesZBL","factory-method","ChineseCook.java","The `ChineseCook` class, implementing the `Cook` interface, is responsible for preparing food based on the specified `FoodType`. It collaborates with the `Food` class to produce the cooked food. This class participates in the factory method and abstract factory patterns, suggesting it creates food objects without specifying the exact class of the object. Additionally, it is involved in the memento pattern, indicating it may save and restore its internal state."
"JamesZBL","factory-method","FoodType.java","The `FoodType` class encapsulates the name of a food type, serving as a simple data holder. It has a single private field, `name`, and provides a constructor and a getter method to access this field. The class does not collaborate with other classes or participate in any design patterns, focusing solely on its role as a basic data structure."
"JamesZBL","factory-method","WesternFood.java","The WesternFood class, implementing the Food interface, represents a type of Western cuisine. It collaborates with the FoodType class to define its specific food type. WesternFood participates in the factory method, abstract factory, and memento patterns, suggesting it is created by a factory, part of a product family, and can save/restore its state. Its responsibilities include providing food type information and string representation."
"JamesZBL","factory-method","Cook.java","The `Cook` interface defines a contract for cooking food, with the `cookFood` method responsible for creating and preparing specific food types. It collaborates with the `FoodType` class to determine the type of food to be cooked. The interface participates in the Factory Method, Abstract Factory, and Memento design patterns, suggesting its role in creating food objects and potentially managing their state."
"JamesZBL","factory-method","ChineseFood.java","The `ChineseFood` class implements the `Food` interface, representing a specific type of Chinese cuisine. It collaborates with the `FoodType` class to determine the type of food. As part of the factory method and abstract factory patterns, it provides a concrete implementation for creating Chinese food instances. Additionally, it participates in the memento pattern, allowing for the saving and restoring of its state. The class overrides methods from the `Food` interface to provide specific functionality."
"JamesZBL","factory-method","Application.java","The `Application` class serves as the entry point for the program, utilizing a `Cook` object to create food. It maintains a private `Cook` instance and a static `Logger` for logging purposes. The class follows a straightforward structure without explicit design patterns, with the `main` method initiating the process and delegating food creation to the `makeFood` method."
"JamesZBL","factory-method","WesternCook.java","The WesternCook class, implementing the Cook interface, is responsible for preparing food based on specified food types. It collaborates with the Food class and leverages the abstract factory pattern to create food items. Additionally, it participates in the memento pattern, suggesting it maintains and restores internal states."
"JamesZBL","factory-method","Food.java","The `Food` interface defines a contract for food items, requiring implementation of the `getFoodType()` method to return a `FoodType`. It participates in the Abstract Factory pattern, suggesting it is part of a system for creating families of related or dependent objects. The detection of the Memento pattern indicates potential involvement in object state management. Collaborators are implied by these patterns, but not explicitly stated."
"JamesZBL","memento","Flower.java","The `Flower` class, extending `Plant`, represents a flower with attributes like type, name, height, and weight. It collaborates with `FlowerMemento` for state management, implementing the Memento pattern. The class participates in the Abstract Factory and Observer patterns, suggesting it is created via a factory and notifies observers of changes. Its responsibilities include managing flower state and growth, with methods for state capture and restoration."
"JamesZBL","memento","Plant.java","The `Plant` interface defines a contract for plant entities, specifying methods to retrieve weight, height, and type. It serves as an abstract factory product, collaborating with concrete implementations to create plant instances. The interface's role is to standardize plant attributes, facilitating consistent plant creation and manipulation within the system."
"JamesZBL","memento","FlowerType.java","The `FlowerType` class encapsulates the name of a flower type, serving as a simple data holder. It collaborates with other classes in the context of the Observer pattern, suggesting it may be a subject or observer, though the exact role is not specified. The class provides a constructor for initialization and a `toString()` method for string representation."
"JamesZBL","memento","Application.java","The `Application` class serves as the entry point for the JamesZBL_memento project, with a single responsibility of initiating the application execution. It utilizes the `Logger` interface from the `LoggerFactory` for logging purposes. The class does not exhibit any explicit design pattern roles based on static analysis."
"JamesZBL","observer","Northern.java","The Northern class, implementing the TimeObserver interface, serves as an observer in the Observer pattern, reacting to time updates. It collaborates with a Logger for recording events and receives time updates through the update method, which it overrides from the TimeObserver interface."
"JamesZBL","observer","TimePoint.java","The `TimePoint` class encapsulates a time-related entity with a name, serving as a simple data holder. It has a single private field, `name`, and a constructor to initialize it. The class overrides the `toString()` method, likely for string representation. It has no explicit collaborators or design-pattern roles."
"JamesZBL","observer","Time.java","The `Time` class, adhering to the Observer pattern, maintains a `TimePoint` and a list of `TimeObserver` instances. It is responsible for managing these observers, allowing their addition and removal, and notifying them of time changes. The class uses a logger for internal tracking. When time passes, it notifies all registered observers, demonstrating the classic observer pattern role of subject."
"JamesZBL","observer","Southern.java","The `Southern` class, implementing the `TimeObserver` interface, serves as an observer in the Observer pattern, reacting to time updates. It collaborates with a `Logger` for logging purposes. Its sole responsibility is to update its state based on the `TimePoint` provided in the `update` method, which it inherits from the `TimeObserver` interface."
"JamesZBL","observer","Application.java","The Application class serves as the entry point for the JamesZBL_observer project. It is a public class with a single main method, which is static and takes a String array as an argument. This class does not exhibit any explicit design pattern roles or collaborations with other classes based on the provided structural facts. Its primary responsibility is to initiate the application's execution."
"JamesZBL","observer","TimeObserver.java","The `TimeObserver` interface defines a contract for observing time updates within the Observer pattern. Its sole responsibility is to declare the `update(TimePoint time)` method, which concrete observers must implement to react to time changes. Collaborators include the `TimePoint` class, which provides the updated time data. This interface serves as the subject in the Observer pattern, enabling decoupled communication between time update publishers and subscribers."
"JamesZBL","singleton","ThreadSafeDoubleCheckLocking.java","The `ThreadSafeDoubleCheckLocking` class implements the Singleton pattern, ensuring a single instance of itself is created and shared. It uses a private constructor and a static volatile field `INSTANCE` to manage the single instance. The class provides a public static `getInstance()` method for accessing this instance, employing double-checked locking for thread safety. Additionally, static analysis suggests the presence of the Memento pattern, though no explicit collaborators or methods are visible."
"JamesZBL","singleton","EnumDirector.java","The `EnumDirector` class is a public class with a single overridden method, `toString()`. It appears to be responsible for providing a string representation of an enum, though its exact purpose is not fully clear from the given information. The class does not explicitly collaborate with other classes, and no design pattern insights were captured in the static analysis."
"JamesZBL","singleton","LazyInitializationDirector.java","The `LazyInitializationDirector` class is a public final singleton that manages its own instance creation and access. It utilizes lazy initialization, creating the instance only when the `getInstance()` method is called. The class collaborates with itself, maintaining a private static final reference to its sole instance. It adheres to the Singleton pattern, ensuring only one instance exists, and is also involved in the Memento pattern, though its specific role in that pattern is not detailed."
"JamesZBL","singleton","Director.java","The `Director` class is a public final class that implements the Singleton pattern, ensuring only one instance exists. It collaborates with the Memento pattern, suggesting it manages or interacts with objects that store and restore internal states. The class provides a static `getInstance()` method to access its sole instance, with the constructor being private to prevent external instantiation."
"JamesZBL","singleton","ThreadSafeLazyLoadDirector.java","The `ThreadSafeLazyLoadDirector` class is a public final implementation of the Singleton pattern, ensuring a single instance is created and accessed in a thread-safe manner. It utilizes lazy loading, with the `INSTANCE` field being volatile for visibility guarantees. The class collaborates with itself to provide the sole instance via the synchronized `getInstance()` method. Additionally, static analysis suggests the presence of the Memento pattern, though no explicit collaborators are evident."
"JamesZBL","singleton","Application.java","The `Application` class serves as the entry point for the JamesZBL_singleton project, housing the `main` method to initiate program execution. It collaborates with a `Logger` instance, obtained through `LoggerFactory`, to facilitate logging operations. No explicit design patterns are identified within this class's static structure."
"JamesZBL","visitor","Boss.java","The Boss class, a public subclass of Unit, represents a unit that can manage other units. It initializes with a variable number of child units and provides methods to be visited by a UnitVisitor and to return a string representation. The class collaborates with Unit and UnitVisitor, adhering to the Visitor design pattern."
"JamesZBL","visitor","Engineer.java","The Engineer class, a public subclass of Unit, represents a unit that can manage other units. It initializes with a variable number of child units. The class overrides methods to support visitor pattern interactions, allowing UnitVisitor instances to visit it, and provides a string representation. Its primary responsibility is to manage child units and facilitate visitor operations."
"JamesZBL","visitor","ManagerVisitor.java","The ManagerVisitor class, implementing the UnitVisitor interface, is responsible for visiting and performing operations on Engineer, Boss, and Manager units. It utilizes a static Logger for logging purposes. The class adheres to the Visitor design pattern, allowing it to apply specific operations to each unit type through its overridden visit methods."
"JamesZBL","visitor","UnitVisitor.java","The UnitVisitor interface defines a visitor pattern for traversing and operating on different unit types within the JamesZBL_visitor project. Its responsibility is to declare visit methods for each concrete unit class: Engineer, Boss, and Manager. It collaborates with these three classes to enable type-specific operations."
"JamesZBL","visitor","BossVisitor.java","The BossVisitor class, implementing the UnitVisitor interface, is responsible for visiting and performing operations on different unit types: Engineer, Boss, and Manager. It utilizes a private static Logger for logging purposes. The class follows the Visitor design pattern, allowing it to apply specific operations to each unit type."
"JamesZBL","visitor","EngineerVisitor.java","The EngineerVisitor class, implementing the UnitVisitor interface, is responsible for visiting and processing Engineer, Boss, and Manager units. It utilizes a private static Logger for logging purposes. This class adheres to the Visitor design pattern, allowing it to operate on elements of an object structure without changing their classes."
"JamesZBL","visitor","Manager.java","The Manager class, a public subclass of Unit, is responsible for managing a collection of Unit objects, which are passed to its constructor. It overrides the beVisited method to facilitate visitor pattern operations, allowing UnitVisitor instances to interact with it. The toString method is also overridden, presumably to provide a string representation of the Manager. No explicit design patterns are captured in static analysis."
"JamesZBL","visitor","Unit.java","The `Unit` class is an abstract class responsible for representing a hierarchical structure of units, with each unit potentially containing child units. It maintains a private collection of child units and provides a method `beVisited` to facilitate visitation by a `UnitVisitor` object, adhering to the Visitor design pattern. The class collaborates with `UnitVisitor` to enable operations on unit hierarchies."
"JamesZBL","visitor","Application.java","The Application class serves as the entry point for the JamesZBL_visitor project, with its sole responsibility being to initiate the program execution. It contains a public static main method that takes a String array as an argument, indicating it's designed to be run as a standalone application. No design patterns are explicitly identified, and no collaborators are evident from the static analysis."
"spring-framework","AbstractFactory","ClientHttpRequestFactory.java","The `ClientHttpRequestFactory` interface defines a contract for creating `ClientHttpRequest` objects. It collaborates with `URI` and `HttpMethod` to produce requests. This interface serves as a factory, enabling the creation of HTTP requests without specifying concrete implementation details, thus promoting flexibility and adhering to the Dependency Inversion Principle."
"spring-framework","AbstractFactory","AutowireCapableBeanFactory.java","The `AutowireCapableBeanFactory` interface, extending `BeanFactory`, defines responsibilities for creating and autowiring beans within the Spring framework. It collaborates with `Class` objects to instantiate beans and supports various autowiring modes, such as by name, type, or constructor. The interface provides methods for bean creation, configuration, and property autowiring, facilitating dependency injection. No explicit design patterns are captured in static analysis."
