Project Name,Folder Name,File Name,Summary
"JamesZBL","abstract-factory","YoungTeamFactory.java","The YoungTeamFactory class, implementing the TeamFactory interface, is responsible for creating specific team members: Ship, Captain, and Sailor. It collaborates with these classes to instantiate them. This class plays a role in the Factory Method, Abstract Factory, and Memento design patterns, indicating its involvement in object creation and state management processes."
"JamesZBL","abstract-factory","YoungCaptain.java","The `YoungCaptain` class, implementing the `Captain` interface, is responsible for providing a description of a young captain. It collaborates with the abstract factory, observer, and memento patterns, suggesting it may be created through a factory, notify observers of changes, and support state saving and restoration. Its sole field, `DESCRIPTION`, is a static final string."
"JamesZBL","abstract-factory","Captain.java","The `Captain` interface, extending `Member`, serves as a key participant in multiple design patterns. It collaborates within the abstract factory pattern, likely facilitating the creation of related objects. Additionally, it engages in the observer pattern, suggesting it manages or is observed by other components. The memento pattern involvement implies it maintains or restores internal states."
"JamesZBL","abstract-factory","OldSailor.java","The OldSailor class, implementing the Sailor interface, represents an old sailor with a static description. It collaborates within a system employing factory method, abstract factory, observer, and memento patterns, suggesting it is created and managed by factories, observed, and its state can be saved and restored. Its primary responsibility is to provide a description of an old sailor."
"JamesZBL","abstract-factory","NewShip.java","The NewShip class, implementing the Ship interface, represents a new ship with a static description field. It collaborates within an abstract factory pattern, likely creating new ship instances, and participates in observer and memento patterns, suggesting it may notify observers of state changes and support state saving/restoration. Its primary responsibility is to provide a description of a new ship."
"JamesZBL","abstract-factory","PermanentTeamFactory.java","The `PermanentTeamFactory` class, implementing the `TeamFactory` interface, is responsible for creating permanent team members, including ships, captains, and sailors, adhering to the Abstract Factory pattern. It collaborates with the `Ship`, `Captain`, and `Sailor` classes to instantiate these objects. Additionally, the class is involved in the Memento pattern, suggesting it participates in object state management and restoration."
"JamesZBL","abstract-factory","OldCaptain.java","The `OldCaptain` class, implementing the `Captain` interface, is responsible for providing a specific description of an old captain. It collaborates within an abstract factory pattern context, suggesting it is one of several products created by a concrete factory. Additionally, it participates in observer and memento patterns, indicating it may be observed for state changes and support state saving/restoration."
"JamesZBL","abstract-factory","Ship.java","The `Ship` interface, extending `Member`, serves as an abstract blueprint for ship entities within the system. It participates in the abstract factory, observer, and memento patterns, suggesting it is created by a factory, can be observed for state changes, and supports state restoration. Collaborators include factory classes and observer/memento pattern participants."
"JamesZBL","abstract-factory","TeamFactory.java","The `TeamFactory` interface defines a contract for creating teams, including ships, captains, and sailors, adhering to the Abstract Factory pattern. It collaborates with concrete factory implementations to produce family of related objects. The interface also hints at the Factory Method pattern, suggesting deferred instantiation to subclasses. Additionally, the presence of the Memento pattern indicates potential state-saving functionality within the factory's scope."
"JamesZBL","abstract-factory","Application.java","The `Application` class is responsible for creating and managing a team consisting of a `Ship`, `Captain`, and `Sailor` using a `TeamFactory`. It collaborates with these components and utilizes the Observer and Memento patterns, as detected via static analysis, to maintain and potentially restore the state of the team. The class serves as the main entry point, with the `main` method initiating the team creation process."
"JamesZBL","abstract-factory","Member.java","The `Member` interface defines a contract for objects that can provide a description through the `getDescription()` method. It serves as an abstract blueprint for member entities within the system, without specifying implementation details. No explicit design patterns or collaborators are identified in the static analysis."
"JamesZBL","abstract-factory","Sailor.java","The `Sailor` interface, extending `Member`, defines the abstract behavior for sailor entities within the system. It participates in the abstract factory, observer, and memento design patterns, suggesting it is created by a factory, can be observed for state changes, and can save/restore its internal state. Collaborators include the factory producing `Sailor` instances and observers monitoring its activities."
"JamesZBL","adapter","Bus.java","The Bus class is responsible for executing a run operation, as indicated by its single public method. It utilizes a static Logger instance for logging purposes, suggesting it may record or monitor its activities. The class does not explicitly implement any design patterns, and its collaborators beyond the Logger are not captured in the provided structural analysis."
"JamesZBL","adapter","Car.java","The `Car` interface, part of the JamesZBL_adapter project, defines a single method `drive()` and serves as a component in the Decorator pattern. It establishes a contract for car-like objects, allowing decorators to add responsibilities dynamically. Collaborators include concrete car implementations and decorator classes that extend functionality."
"JamesZBL","adapter","Driver.java","The `Driver` class, implementing the `Car` interface, is responsible for driving a car. It collaborates with a `Car` instance, which is injected via its constructor. The `Driver` class adheres to the Decorator pattern, allowing it to be used as a wrapper to add responsibilities to the `Car` interface dynamically."
"JamesZBL","adapter","Application.java","The Application class serves as the entry point for the JamesZBL_adapter project, with its sole responsibility being the execution of the main method. It does not collaborate with other classes or implement any design patterns, as indicated by the lack of captured design pattern insights in static analysis."
"JamesZBL","adapter","BusAdapter.java","The `BusAdapter` class acts as an adapter, implementing the `Car` interface to adapt the `Bus` class. It contains a private `Bus` field and overrides the `drive()` method. This class participates in the decorator pattern, allowing it to modify or extend the behavior of the `Bus` class."
"JamesZBL","decorator","HammerSmithOperation.java","The `HammerSmithOperation` class, implementing the `Operation` interface, acts as a decorator in the Decorator pattern, enhancing the behavior of other `Operation` objects. It maintains a reference to a `previousOperation`, which it decorates, and utilizes a `Logger` for logging purposes. Its responsibilities include checking before and after operations, and joining operations, all while delegating to the wrapped operation."
"JamesZBL","decorator","Operation.java","The `Operation` interface defines a contract for operations with three methods: `checkBefore`, `join`, and `checkAfter`. It serves as a component in the Decorator pattern, allowing objects to be dynamically wrapped with additional responsibilities. Collaborators implement this interface to provide concrete operations and decorators to extend or alter behavior."
"JamesZBL","decorator","Application.java","The `Application` class serves as the entry point for the JamesZBL_decorator project, responsible for initiating the program execution. It utilizes the `Logger` interface from the `LoggerFactory` for logging purposes, indicating its role in managing application-wide logging. The class does not exhibit any explicit design pattern roles based on static analysis."
"JamesZBL","decorator","CarpenterOperation.java","The `CarpenterOperation` class, implementing the `Operation` interface, serves as a concrete component in the decorator pattern, providing core functionality for carpentry operations. It utilizes a static `Logger` for logging and defines three methods: `checkBefore`, `join`, and `chekcAfter`, which are overridden from the `Operation` interface. This class is designed to be extended or decorated by other classes to add responsibilities."
"JamesZBL","facade","CourseFacade.java","The `CourseFacade` class serves as an intermediary for managing course participants, encapsulating the complexity of participant interactions. It maintains a list of `CourseParticipator` objects and provides methods to prepare, proceed, and stop course-related activities. No explicit design patterns are identified."
"JamesZBL","facade","CourseParticipator.java","The `CourseParticipator` class is an abstract public class responsible for managing course-related actions such as preparing, proceeding, and stopping a course, as well as handling school and home commutes. It collaborates with itself for various actions and utilizes a static `Logger` for logging. The class does not exhibit explicit design pattern roles."
"JamesZBL","facade","CourseStudent.java","The `CourseStudent` class, a public subclass of `CourseParticipator`, is responsible for representing a student enrolled in a course. It overrides the `name()` method to provide student-specific naming functionality. The class collaborates with its parent class to inherit and extend course participant behaviors. No design patterns are explicitly captured in the static analysis."
"JamesZBL","facade","Application.java","The `Application` class serves as the entry point for the JamesZBL_facade project. It is a public class with a single static `main` method, which takes a `String` array as an argument. This class is responsible for initiating the application's execution. No design patterns are explicitly identified through static analysis, and no collaborators are evident from the provided structural facts."
"JamesZBL","facade","CourseTeacher.java","The CourseTeacher class, a public subclass of CourseParticipator, is responsible for representing a teacher within a course context. It overrides the name() method from its parent class, suggesting it provides a specific implementation for retrieving the teacher's name. The class does not exhibit any explicit design pattern roles based on static analysis."
"JamesZBL","factory-method","ChineseCook.java","The `ChineseCook` class, implementing the `Cook` interface, is responsible for preparing food based on the specified `FoodType`. It collaborates with the `Food` class to produce the cooked food. This class participates in the Factory Method pattern by overriding the `cookFood` method, suggesting it contributes to the creation of specific food products. Additionally, it is involved in the Abstract Factory and Memento patterns, indicating roles in creating families of related objects and capturing and restoring object states, respectively."
"JamesZBL","factory-method","FoodType.java","The `FoodType` class encapsulates a food type's name, serving as a simple data holder. It collaborates with other classes by providing its name via the `getName()` method. The class has no explicit design pattern roles, focusing solely on storing and retrieving the food type's name."
"JamesZBL","factory-method","WesternFood.java","The WesternFood class, implementing the Food interface, represents a type of western cuisine. It collaborates with the FoodType class to define the specific type of western food. It participates in the factory method, abstract factory, and memento design patterns, suggesting its role in object creation, family of objects creation, and object state management, respectively."
"JamesZBL","factory-method","Cook.java","The `Cook` interface defines a contract for cooking food, with a single method `cookFood` that takes a `FoodType` parameter and returns a `Food` object. It participates in the factory method and abstract factory patterns, suggesting it is part of a system for creating and managing food objects. The memento pattern detection implies involvement in state-saving and restoration mechanisms, though specific collaborators are not detailed."
"JamesZBL","factory-method","ChineseFood.java","The `ChineseFood` class, implementing the `Food` interface, represents a type of Chinese cuisine. It collaborates with `FoodType` to specify the kind of Chinese food. This class participates in the Factory Method, Abstract Factory, and Memento design patterns, suggesting its role in creating and managing food objects and their states."
"JamesZBL","factory-method","Application.java","The `Application` class serves as the entry point for the program, utilizing the Factory Method pattern to create and manage a `Cook` instance. It maintains a private `Cook` field and a static `Logger` for logging purposes. The class's primary responsibility is to initiate the food-making process through the `makeFood` method, which is called from the `main` method. The `Cook` collaborator is injected via the constructor, demonstrating dependency injection principles."
"JamesZBL","factory-method","WesternCook.java","The WesternCook class, implementing the Cook interface, is responsible for preparing food based on the specified FoodType. It collaborates with the Food class to produce the cooked food. This class participates in the Abstract Factory pattern, suggesting it is part of a family of factories producing related objects. Additionally, it is involved in the Memento pattern, indicating it may handle the saving and restoring of internal states."
"JamesZBL","factory-method","Food.java","The `Food` interface defines a contract for food items, requiring the implementation of a `getFoodType()` method. It participates in the Abstract Factory pattern, suggesting it is part of a system for creating families of related or dependent objects without specifying their concrete classes. The presence of the Memento pattern indicates it may also be involved in capturing and restoring the state of objects."
"JamesZBL","memento","Flower.java","The `Flower` class, a public subclass of `Plant`, encapsulates flower-specific attributes like type, name, height, and weight. It collaborates with `FlowerMemento` for state management, utilizing the Memento pattern implicitly. The class participates in the Observer pattern, as detected via static analysis, suggesting it notifies observers of state changes. It also plays a role in the Abstract Factory pattern, indicating it might be created by a factory method. The class overrides several methods from its superclass, including `toString()` and `getWeight()`."
"JamesZBL","memento","Plant.java","The `Plant` interface defines a contract for plant entities, mandating implementations to provide methods for retrieving weight, height, and type. It serves as a product interface within the Abstract Factory pattern, collaborating with factory classes to create and manage plant objects."
"JamesZBL","memento","FlowerType.java","The `FlowerType` class encapsulates the name of a flower type, serving as a simple data holder. It collaborates with other classes in the context of the Observer pattern, suggesting it may be observed or hold state relevant to observers. The class provides a constructor for initialization and a `toString()` method for string representation."
"JamesZBL","memento","Application.java","The `Application` class serves as the entry point for the JamesZBL_memento project, with its sole responsibility being to initiate the application's execution. It utilizes the `Logger` interface from the `LoggerFactory` for logging purposes, indicating a collaboration with a logging framework. The class does not exhibit any explicit design pattern roles."
"JamesZBL","observer","Northern.java","The `Northern` class, implementing the `TimeObserver` interface, serves as an observer in the Observer design pattern. It utilizes a static `Logger` for logging purposes. Its sole responsibility is to react to time updates, as evidenced by the overridden `update(TimePoint time)` method, suggesting it collaborates with a subject that provides time updates."
"JamesZBL","observer","TimePoint.java","The `TimePoint` class encapsulates a time-related entity with a name, serving as a simple data holder. It collaborates with no other classes explicitly. The class overrides the `toString()` method to provide a string representation of the time point. No design pattern roles are identified for this class."
"JamesZBL","observer","Time.java","The `Time` class, adhering to the Observer pattern, manages a `TimePoint` and notifies registered `TimeObserver` instances of state changes. It maintains a list of observers and provides methods to add or remove them. The class uses a logger for internal tracking. When the `passing` method is called, it triggers the `notifyObservers` method to update all registered observers."
"JamesZBL","observer","Southern.java","The `Southern` class, implementing the `TimeObserver` interface, acts as an observer in the Observer pattern, reacting to time updates. It utilizes a static `Logger` for logging and overrides the `update` method to process `TimePoint` updates, collaborating with the subject (not explicitly stated) to receive time notifications."
"JamesZBL","observer","Application.java","The Application class serves as the entry point for the JamesZBL_observer project. It is responsible for initiating the program execution through its main method. This class does not explicitly collaborate with other classes or employ any discernible design patterns based on the provided structural facts. Its sole purpose is to start the application."
"JamesZBL","observer","TimeObserver.java","The `TimeObserver` interface defines the responsibility of observing time updates within the Observer pattern. It declares a single method, `update(TimePoint time)`, which is invoked to notify observers of changes in time. Collaborators implement this interface to receive time updates, adhering to the Observer pattern's decoupled design."
"JamesZBL","singleton","ThreadSafeDoubleCheckLocking.java","The `ThreadSafeDoubleCheckLocking` class implements the Singleton pattern, ensuring only one instance exists and providing global access to it. It uses a private constructor and a static volatile field `INSTANCE` to maintain the single instance. The `getInstance()` method allows controlled access to this instance, employing double-checked locking for thread safety. The class also exhibits Memento pattern traits, suggesting it may capture and restore internal states."
"JamesZBL","singleton","EnumDirector.java","The EnumDirector class is a public class with a single responsibility of providing a string representation of itself, as indicated by its overridden toString() method. It does not collaborate with any other classes or implement any specific design patterns, as no design pattern insights were captured in the static analysis."
"JamesZBL","singleton","LazyInitializationDirector.java","The `LazyInitializationDirector` class is a public final class that implements the Singleton pattern, ensuring only one instance exists throughout the application. It uses lazy initialization, creating the instance only when the `getInstance()` method is called. The class collaborates with itself, maintaining a private static final reference to its sole instance. Additionally, static analysis suggests the class may also participate in the Memento pattern, though this is not explicitly evident from the provided structural facts."
"JamesZBL","singleton","Director.java","The `Director` class is a public final class that implements the Singleton pattern, ensuring only one instance exists throughout the application. It serves as a central coordinator, likely managing the state of other objects, as suggested by the detected Memento pattern. The single instance is accessed via the static `getInstance()` method, with the constructor kept private to prevent external instantiation."
"JamesZBL","singleton","ThreadSafeLazyLoadDirector.java","The `ThreadSafeLazyLoadDirector` class implements the Singleton pattern, ensuring a single instance is created and accessed in a thread-safe manner. It uses lazy initialization, with the `getInstance()` method providing synchronized access to the static `INSTANCE` field. The class's responsibility is to manage its sole instance, with no explicit collaborators. Static analysis also suggests a potential role in the Memento pattern, though this is not evident from the provided structure."
"JamesZBL","singleton","Application.java","The `Application` class serves as the entry point for the JamesZBL_singleton project, housing the main method to initiate program execution. It collaborates with a `Logger` instance, obtained through `LoggerFactory`, to facilitate logging operations. No explicit design patterns are identified within this class based on static analysis."
"JamesZBL","visitor","Boss.java","The Boss class, a public subclass of Unit, represents a unit that can manage other units. It initializes with a variable number of child units and provides methods to be visited by a UnitVisitor and to return a string representation. The class collaborates with Unit and UnitVisitor, adhering to the Visitor design pattern."
"JamesZBL","visitor","Engineer.java","The Engineer class, a public subclass of Unit, is responsible for representing an engineer unit within the JamesZBL_visitor project. It initializes with an array of Unit objects, indicating that it manages a collection of unit children. The class overrides the beVisited method, suggesting it participates in a visitor pattern, accepting a UnitVisitor to perform operations. It also overrides toString, likely for custom string representation."
"JamesZBL","visitor","ManagerVisitor.java","The ManagerVisitor class, implementing the UnitVisitor interface, is responsible for visiting and performing operations on Engineer, Boss, and Manager units. It utilizes a static Logger for logging purposes. The class adheres to the Visitor design pattern, allowing it to apply specific operations to each unit type through overridden visit methods."
"JamesZBL","visitor","UnitVisitor.java","The UnitVisitor interface defines a visitor pattern for traversing and operating on a hierarchy of unit types, including Engineer, Boss, and Manager. It declares three visit methods, each corresponding to a specific unit type, enabling type-specific operations. The interface serves as a contract for concrete visitor implementations to provide the appropriate behavior for each unit type."
"JamesZBL","visitor","BossVisitor.java","The BossVisitor class, implementing the UnitVisitor interface, is responsible for visiting and performing operations on different unit types: Engineer, Boss, and Manager. It utilizes a static Logger for logging purposes. The class follows the Visitor design pattern, allowing it to apply specific operations to each unit type without modifying their classes."
"JamesZBL","visitor","EngineerVisitor.java","The EngineerVisitor class, implementing the UnitVisitor interface, is responsible for visiting and processing Engineer, Boss, and Manager objects. It utilizes a static Logger for logging purposes. The class follows the Visitor design pattern, allowing it to perform operations on these elements without changing their classes."
"JamesZBL","visitor","Manager.java","The Manager class, a public subclass of Unit, is responsible for managing a collection of Unit objects, which are passed to its constructor. It overrides the beVisited method to facilitate visitor pattern interactions with UnitVisitor instances, and the toString method for string representation. No explicit design patterns are captured in static analysis."
"JamesZBL","visitor","Unit.java","The `Unit` class is an abstract class responsible for representing a hierarchical structure of units, with each unit potentially containing child units. It maintains a private collection of child units and provides a method `beVisited` to facilitate visitor pattern interactions. The class collaborates with a `UnitVisitor` to allow external operations on its structure."
"JamesZBL","visitor","Application.java","The `Application` class serves as the entry point for the JamesZBL_visitor project, with a single public static `main` method that initiates the program execution. It does not collaborate with other classes or employ any discernible design patterns based on static analysis. Its primary responsibility is to start the application."
"spring-framework","spring-aop","MethodBeforeAdviceAdapter.java","The MethodBeforeAdviceAdapter class implements the AdvisorAdapter and Serializable interfaces, acting as an adapter for MethodBeforeAdvice. It checks if it supports a given Advice via the supportsAdvice method and provides a MethodInterceptor for an Advisor through the getInterceptor method. It collaborates with Advice and Advisor, facilitating the integration of MethodBeforeAdvice into the AOP framework. No explicit design patterns are captured in static analysis."
