Project Name,Folder Name,File Name,Summary
"spring-framework","spring-aop","ScopedProxyBeanDefinitionDecorator.java","The ScopedProxyBeanFactoryDecorator class implements the BeanDefinitionDecorator interface, focusing on decorating bean definitions to support scoped proxies. It collaborates with Node, BeanDefinitionHolder, and ParserContext to modify bean definitions, ensuring proper proxy creation. The class utilizes the PROXY_TARGET_CLASS constant for configuration. No explicit design patterns are identified."
"spring-framework","spring-beans","SmartInitializingSingleton.java","The `SmartInitializingSingleton` interface in the spring-framework_spring-beans project defines a single method, `afterSingletonsInstantiated()`, indicating its responsibility to notify implementing classes after the singleton beans are instantiated. It serves as a callback mechanism within the Spring IoC container, allowing beans to perform post-instantiation initialization. No explicit design patterns are captured in static analysis."
"spring-framework","spring-beans","BeanDefinitionVisitor.java","The `BeanDefinitionVisitor` class is responsible for visiting and resolving values within a `BeanDefinition`. It collaborates with a `StringValueResolver` to resolve string values and interacts with various collection types like lists, arrays, maps, and sets. The class does not exhibit any explicit design pattern roles."
"spring-framework","spring-beans","DefaultSingletonBeanRegistry.java","The DefaultSingletonBeanRegistry class, extending SimpleAliasRegistry and implementing SingletonBeanRegistry, manages singleton beans within the Spring framework. It utilizes several concurrent maps to store singleton objects, factories, callbacks, and early singleton objects, with a ReentrantLock for thread safety. The class provides methods to register, retrieve, and manage singleton beans, collaborating with various internal methods for bean creation and destruction. No explicit design patterns are identified."
"spring-framework","spring-beans","BeanFactory.java","The `BeanFactory` interface serves as a central registry for accessing beans, which are objects managed by the Spring IoC container. It provides methods to retrieve beans by name or type, collaborating with `ObjectProvider` for lazy bean access. The interface embodies the Abstract Factory pattern, enabling the creation of beans without specifying their concrete classes."
"spring-framework","spring-beans","DefaultListableBeanFactory.java","The DefaultListableBeanFactory class, extending AbstractAutowireCapableBeanFactory and implementing ConfigurableListableBeanFactory, BeanDefinitionRegistry, and Serializable, manages bean definitions and their registration. It collaborates with various internal methods and fields to control bean definition overriding, eager class loading, and serialization. The class handles bean management and configuration, with no explicit design pattern roles identified."
"spring-framework","spring-beans","SingletonBeanRegistry.java","The SingletonBeanRegistry interface defines a registry for managing singleton beans, allowing registration, retrieval, and enumeration of singletons. It collaborates with consumers for singleton callbacks. The interface does not explicitly implement any design patterns, but its responsibilities align with the Singleton pattern's object management principles."
"spring-framework","spring-beans","AutowireCapableBeanFactory.java","The `AutowireCapableBeanFactory` interface extends `BeanFactory` and defines responsibilities for creating and autowiring beans within the Spring framework. It collaborates with bean classes and existing bean instances to manage bean creation and dependency injection. The interface supports various autowire modes, including by name, type, constructor, and autodetect. It participates in the abstract factory design pattern, facilitating the creation of beans with specified autowire strategies and dependency checks."
"spring-framework","spring-beans","HierarchicalBeanFactory.java","The HierarchicalBeanFactory interface extends BeanFactory and defines a hierarchical bean factory, responsible for managing beans in a parent-child relationship. It collaborates with another BeanFactory instance as its parent, delegating bean resolution to the parent when necessary. The interface includes methods to retrieve the parent bean factory and check for local bean existence. It participates in the abstract factory pattern, facilitating the creation and management of beans in a hierarchical structure."
"spring-framework","spring-beans","ListableBeanFactory.java","The `ListableBeanFactory` interface, extending `BeanFactory`, is responsible for providing methods to list and query bean definitions within a Spring IoC container. It collaborates with `ObjectProvider` and `ResolvableType` to facilitate type-based bean retrieval. This interface adheres to the abstract factory pattern, enabling the creation and management of beans in a flexible and extensible manner."
"spring-framework","spring-context","SimpleApplicationEventMulticaster.java","The SimpleApplicationEventMulticaster class, extending AbstractApplicationEventMulticaster, is responsible for multicasting application events within the Spring Framework. It collaborates with Executor for task execution and ErrorHandler for error management. The class utilizes a BeanFactory for bean resolution and employs a lazy-initialized logger. No explicit design patterns are captured in static analysis."
"spring-framework","spring-context","ApplicationEventPublisher.java","The `ApplicationEventPublisher` interface defines a contract for publishing application events within the Spring Framework. It declares two methods: `publishEvent` for both `ApplicationEvent` and generic `Object` event types. This interface enables decoupled communication between components, acting as a mediator for event-driven interactions. No explicit design patterns are captured in static analysis."
"spring-framework","spring-context","ApplicationListener.java","The `ApplicationListener` interface in the Spring Framework defines a contract for listening to application events. It requires implementing classes to handle events via the `onApplicationEvent` method. Collaborators include event objects and consumers for payload events. The interface provides a default method to indicate support for asynchronous execution and a static factory method to create listeners for payload events. No explicit design patterns are captured in static analysis."
"spring-framework","spring-context","AbstractApplicationEventMulticaster.java","The `AbstractApplicationEventMulticaster` class serves as an abstract base for event multicasting in the Spring framework, implementing `ApplicationEventMulticaster`, `BeanClassLoaderAware`, and `BeanFactoryAware`. It manages event listeners and their retrieval, utilizing `DefaultListenerRetriever` and a cache for efficiency. Collaborators include `ConfigurableBeanFactory` and `ClassLoader`, with methods to set and retrieve these dependencies. The class does not explicitly follow a design pattern."
"spring-framework","spring-context-support","CronTriggerFactoryBean.java","The `CronTriggerFactoryBean` class is responsible for creating and configuring `CronTrigger` instances within the Spring framework. It implements the `FactoryBean` interface to produce `CronTrigger` objects, and it collaborates with `JobDetail` and `JobDataMap` to define the job and its data. The class also implements `BeanNameAware` and `InitializingBean` for Spring container integration. It provides setters for various properties like name, group, and start time, and a method to set job data as a map. No explicit design patterns are captured in static analysis."
"spring-framework","spring-context-support","SchedulerFactoryBean.java","The `SchedulerFactoryBean` class is responsible for creating and managing a Quartz Scheduler instance, implementing the `FactoryBean` interface to provide access to the Scheduler. It collaborates with `SchedulerFactory` and various thread-local holders for resources like `ResourceLoader`, `Executor`, and `DataSource`. The class adheres to several Spring interfaces, including `BeanNameAware`, `ApplicationContextAware`, `InitializingBean`, `DisposableBean`, and `SmartLifecycle`, indicating its role in the Spring IoC container lifecycle. No explicit design patterns are captured in static analysis..."
"spring-framework","spring-context-support","SingletonSupplier.java","The SingletonSupplier class is responsible for providing a singleton instance of type T, utilizing the Supplier interface. It collaborates with two suppliers: one for the instance and another for a default value. The class employs a ReentrantLock for thread-safe initialization, ensuring the singleton instance is created only once. It does not explicitly follow a specific design pattern, but it encapsulates the singleton pattern conceptually. The class offers static factory methods for creating instances with various configurations."
"spring-framework","spring-context-support","AdaptableJobFactory.java","The `AdaptableJobFactory` class, implementing the `JobFactory` interface, is responsible for creating and adapting job instances. It collaborates with `TriggerFiredBundle` and `Scheduler` to instantiate jobs and adapt them as needed. The class overrides the `newJob` method to facilitate this process. No explicit design patterns are captured in the static analysis."
"spring-framework","spring-context-support","JobDetailFactoryBean.java","The `JobDetailFactoryBean` class is a public factory bean responsible for creating and configuring `JobDetail` instances in the Spring framework. It implements several interfaces, including `FactoryBean<JobDetail>`, `BeanNameAware`, `ApplicationContextAware`, and `InitializingBean`, indicating its role in object creation and Spring context awareness. Key collaborators include `JobDataMap` for job data management. The class sets up job details such as name, group, job class, and job data, facilitating the integration of Quartz jobs within the Spring IoC container. No explicit design patterns ar..."
"spring-framework","spring-context-support","MethodInvokingJobDetailFactoryBean.java","The `MethodInvokingJobDetailFactoryBean` class is responsible for creating and configuring `JobDetail` instances for use with a scheduler, extending `ArgumentConvertingMethodInvoker` and implementing several `Aware` and `FactoryBean` interfaces. It collaborates with a target bean, whose method will be invoked when the job is executed. The class sets properties such as name, group, and concurrency, and overrides methods from the `Aware` interfaces to gain context awareness. No explicit design patterns are captured in static analysis."
"spring-framework","spring-jdbc","IsolationLevelDataSourceAdapter.java","The `IsolationLevelDataSourceAdapter` class extends `UserCredentialsDataSourceAdapter` and manages transaction isolation levels for database connections. It maintains a map of isolation level constants and allows setting the isolation level via a name or integer value. The class collaborates with itself to retrieve and set the isolation level, and to determine the current read-only flag. It overrides the `doGetConnection` method to apply the specified isolation level. No explicit design patterns are identified."
"spring-framework","spring-jdbc","JdbcTemplate.java","The `JdbcTemplate` class, extending `JdbcAccessor` and implementing `JdbcOperations`, is responsible for providing core JDBC workflows, such as querying and updating data. It collaborates with `DataSource` for database connections and internally utilizes various private methods for mapping and setting up statements. The class manages settings like fetch size, max rows, and query timeout, and handles warnings and results mapping. No explicit design patterns are captured in static analysis."
"spring-framework","spring-jms","JmsTemplate.java","The `JmsTemplate` class, extending `JmsDestinationAccessor` and implementing `JmsOperations`, serves as a central component for JMS operations within the Spring Framework. It manages JMS resources, including a default destination and message converter, facilitating message sending and receiving. Collaborators include `JmsDestinationAccessor`, `JmsOperations`, and `MessageConverter`. No explicit design patterns are identified."
"spring-framework","spring-tx","SavepointManager.java","The `SavepointManager` interface defines a contract for managing transaction savepoints, allowing creation, rollback, and release of savepoints. It collaborates with an unspecified object type for savepoint representation. The interface does not explicitly implement any design patterns, leaving the concrete implementation details to the classes that realize this interface."
"spring-framework","spring-tx","TransactionTemplate.java","The TransactionTemplate class, implementing TransactionOperations and InitializingBean, serves as a template for transactional operations. It collaborates with PlatformTransactionManager to manage transactions and utilizes DefaultTransactionDefinition for transaction definitions. It executes transactional code within a given callback, handling rollback on exceptions. The class does not explicitly employ any design patterns."
"spring-framework","spring-tx","AbstractTransactionStatus.java","The AbstractTransactionStatus class, implementing the TransactionStatus interface, manages the state of a transaction, including rollback and completion statuses, and handles savepoints. It interacts with itself and other classes to manage transaction states and savepoints, with methods to set, check, and release savepoints. No explicit design patterns are identified."
"spring-framework","spring-web","ClientHttpRequestFactory.java","The `ClientHttpRequestFactory` interface defines a contract for creating `ClientHttpRequest` objects, facilitating HTTP client operations. It collaborates with `URI` and `HttpMethod` to specify the target and type of HTTP request. This interface serves as a factory, enabling the creation of HTTP requests without exposing the instantiation logic. No explicit design patterns are captured in static analysis."
"spring-framework","spring-web","BufferingClientHttpResponseWrapper.java","The `BufferingClientHttpResponseWrapper` class is a final implementation of the `ClientHttpResponse` interface, designed to buffer the response body. It wraps a `ClientHttpResponse` instance, storing the body in a volatile byte field. The class overrides all methods from the interface, delegating to the wrapped response and managing the buffered body. It serves as a decorator, enhancing the original response with buffering capabilities. No explicit design patterns are captured in static analysis."
"spring-framework","spring-web","RestTemplate.java","The `RestTemplate` class is a public client-side HTTP accessor in the Spring Framework, implementing the `RestOperations` interface. It facilitates synchronous HTTP requests, handling resource interpretation and error handling. Key collaborators include `HttpMessageConverter` for message conversion, `ResponseErrorHandler` for error management, and `UriTemplateHandler` for URI template processing. It extends `InterceptingHttpAccessor` and utilizes an internal `ClientHttpRequestFactory` for HTTP request execution. No explicit design patterns are captured in static analysis."
"spring-framework","spring-webmvc","HttpRequestHandlerAdapter.java","The `HttpRequestHandlerAdapter` class, implementing the `HandlerAdapter` interface, is responsible for adapting `HttpRequestHandler` instances to the `HandlerAdapter` interface. It supports the `HandlerAdapter` contract by providing implementations for the `supports` and `handle` methods. This class collaborates with `HttpServletRequest`, `HttpServletResponse`, and `ModelAndView` to process HTTP requests and generate responses. No explicit design pattern roles are captured in static analysis."
"spring-framework","spring-webmvc","SimpleControllerHandlerAdapter.java","The SimpleControllerHandlerAdapter class, implementing the HandlerAdapter interface, is responsible for adapting controller handlers in the Spring Web MVC framework. It collaborates with HttpServletRequest and HttpServletResponse to process requests and generate ModelAndView responses. The class overrides two methods, supports and handle, to determine handler compatibility and process requests, respectively. No explicit design patterns are captured in static analysis."
"spring-framework","spring-websocket","WebSocketHandlerDecorator.java","The `WebSocketHandlerDecorator` class implements the `WebSocketHandler` interface and acts as a decorator for another `WebSocketHandler`, delegating all operations to its private `delegate` field. It provides methods to access the delegate and unwrap handlers, facilitating the chaining of handlers. The class overrides key methods to extend or modify the behavior of the delegated handler. It does not explicitly follow a design pattern, but its structure enables functional extension through composition."
