Project Name,Folder Name,File Name,Summary
"AbdurRKhalid","Abstract Factory","WindowsOSFactory.java","The `WindowsOSFactory` class, implementing the `GUIFactory` interface, is responsible for creating Windows-specific GUI components, specifically `Button` and `CheckBox` instances. It collaborates with these concrete product classes to instantiate them. This class plays a role in the Abstract Factory pattern, providing an interface for creating families of related or dependent objects without specifying their concrete classes. Additionally, it participates in the Factory Method pattern by deferring instantiation to subclasses, and the Memento pattern, though its role in the latter is not explic..."
"AbdurRKhalid","Abstract Factory","WindowsButton.java","The `WindowsButton` class, implementing the `Button` interface, is responsible for rendering a button specific to the Windows operating system. It collaborates with the abstract factory pattern to create platform-specific UI components. Additionally, it participates in the memento pattern, likely to save and restore its state. Its primary method, `paint()`, overrides the interface's method to provide Windows-specific rendering behavior."
"AbdurRKhalid","Abstract Factory","Button.java","The `Button` interface defines a contract for painting buttons, serving as a product in the Abstract Factory pattern. It collaborates with concrete button implementations, which are created by specific factory classes. The interface's `paint()` method is implemented by these concrete classes to render buttons appropriately. Additionally, the `Button` interface is involved in the Memento pattern, suggesting it participates in capturing and restoring its internal state."
"AbdurRKhalid","Abstract Factory","Test.java","The `Test` class serves as the entry point for the application, initiating the process by calling the `paint` method of the `Application` class. Its primary responsibility is to execute the main method, which triggers the application's painting functionality. The class interacts solely with the `Application` class, with no explicit design patterns identified in its static structure."
"AbdurRKhalid","Abstract Factory","CheckBox.java","The `CheckBox` interface defines a contract for painting a checkbox component. It participates in the Abstract Factory pattern, suggesting it is one of the products created by a factory. The presence of the Memento pattern indicates that `CheckBox` may support state preservation and restoration. Collaborators are implied through the patterns but not explicitly stated in the provided structure."
"AbdurRKhalid","Abstract Factory","MacOSFactory.java","The `MacOSFactory` class, implementing the `GUIFactory` interface, is responsible for creating macOS-specific GUI components, specifically `Button` and `CheckBox` instances. It collaborates with these concrete product classes to instantiate platform-specific objects. This class plays the role of a concrete factory in the Abstract Factory design pattern, providing an interface for creating families of related or dependent objects without specifying their concrete classes. Additionally, static analysis suggests the presence of the Memento pattern within the project."
"AbdurRKhalid","Abstract Factory","MacOSButton.java","The `MacOSButton` class, implementing the `Button` interface, is responsible for rendering buttons specific to macOS. It collaborates with the abstract factory pattern to create platform-specific UI components. The class overrides the `paint()` method to provide macOS-specific button rendering. Additionally, it participates in the memento pattern, likely for saving and restoring button states."
"AbdurRKhalid","Abstract Factory","WindowsCheckBox.java","The WindowsCheckBox class, implementing the CheckBox interface, is responsible for rendering a checkbox component in a Windows-specific style. It collaborates with the abstract factory and factory method patterns to create platform-specific UI components, adhering to the memento pattern for state management. Its sole method, paint(), overrides the interface's method to provide Windows-specific rendering."
"AbdurRKhalid","Abstract Factory","Application.java","The `Application` class is responsible for creating and managing GUI components, specifically `Button` and `CheckBox` objects, using a `GUIFactory`. It collaborates with `GUIFactory` to instantiate these components and utilizes the `paint` method to render them. The class is invoked by the `Test` class's `main` method. Notably, it operates within the context of the Memento design pattern, as indicated by static analysis."
"AbdurRKhalid","Abstract Factory","MacOSCheckBox.java","The `MacOSCheckBox` class, implementing the `CheckBox` interface, is responsible for rendering a checkbox specific to the macOS operating system. It collaborates with the abstract factory and factory method patterns to create platform-specific UI components, adhering to the memento pattern for state management. Its sole method, `paint()`, overrides the interface's method to provide macOS-specific rendering."
"AbdurRKhalid","Abstract Factory","GUIFactory.java","The `GUIFactory` interface defines a contract for creating GUI components, specifically `Button` and `CheckBox` objects, adhering to the Abstract Factory pattern. It collaborates with concrete factory implementations to produce platform-specific GUI components. The interface also participates in the Factory Method pattern, delegating the instantiation of products to subclasses. Additionally, it is involved in the Memento pattern, suggesting its role in capturing and restoring the state of GUI components."
"AbdurRKhalid","Adapter","RoundHole.java","The RoundHole class represents a hole with a specific radius, encapsulating the geometric property within its private field. It collaborates with the RoundPeg class to determine if a peg can fit through the hole via the fits method. The class serves as a concrete component in a potential structural design pattern, although no explicit pattern roles are captured in static analysis."
"AbdurRKhalid","Adapter","RoundPeg.java","The `RoundPeg` class represents a peg with a circular shape, encapsulating its radius as a private field. It provides a constructor and a method to access the radius. In the context of the Adapter pattern, `RoundPeg` serves as the adaptee, collaborating with adapter classes to enable compatibility with square-shaped holes."
"AbdurRKhalid","Adapter","SquarePegAdapter.java","The SquarePegAdapter class acts as an adapter in the Adapter design pattern, converting the interface of a SquarePeg to be compatible with a RoundPeg. It contains a SquarePeg instance and overrides the getRadius() method to provide the adapted functionality. The class extends RoundPeg and collaborates with SquarePeg to enable the adaptation."
"AbdurRKhalid","Adapter","Test.java","The `Test` class serves as the entry point for the AbdurRKhalid_Adapter project, with the sole responsibility of executing the main method. It does not collaborate with other classes or implement any design patterns, as indicated by the lack of captured design pattern insights in static analysis. Its purpose is to initiate the program's execution."
"AbdurRKhalid","Adapter","SquarePeg.java","The SquarePeg class represents a square object with a specified width. It provides methods to retrieve the width and calculate the area of the square. As part of the Adapter pattern, it serves as the adaptee, collaborating with the RoundPeg class to enable compatibility between incompatible interfaces."
"AbdurRKhalid","Decorator","DataSourceDecorator.java","The `DataSourceDecorator` class serves as a decorator for `DataSource` objects, implementing the same interface. It wraps a `DataSource` instance, delegating calls to it while potentially adding or altering behavior. The class has a single collaborator, the `DataSource` it wraps, and is used by the `Test` class. It follows the Decorator design pattern, allowing dynamic addition of responsibilities to objects."
"AbdurRKhalid","Decorator","EncryptionDecorator.java","The `EncryptionDecorator` class extends `DataSourceDecorator` and implements the Decorator pattern to add encryption functionality to a `DataSource`. It collaborates with a `DataSource` instance, which is passed to its constructor. The class overrides `writeData` and `readData` methods to provide encrypted data handling, utilizing private `encode` and `decode` methods for the encryption process."
"AbdurRKhalid","Decorator","Test.java","The `Test` class serves as the entry point for the application, containing a `main` method that initiates the program's execution. It collaborates with `DataSource` and `DataSourceDecorator` to read and write data, demonstrating a decorator pattern where `DataSourceDecorator` extends the functionality of `DataSource`. No explicit design-pattern roles are captured in static analysis."
"AbdurRKhalid","Decorator","CompressionDecorator.java","The CompressionDecorator class extends DataSourceDecorator and implements the Decorator pattern to add compression functionality to a DataSource. It manages a compression level field and collaborates with a DataSource instance. Its responsibilities include compressing data before writing and decompressing data after reading. It overrides writeData and readData methods, utilizing its private compress and decompress methods to handle data transformation."
"AbdurRKhalid","Decorator","FileDataSource.java","The `FileDataSource` class implements the `DataSource` interface, serving as a concrete component in the Decorator pattern. It manages a file data source, identified by a private `name` field, and provides methods to read and write data. The class collaborates with the `DataSource` interface, adhering to its contract. No explicit design pattern roles are captured in static analysis."
"AbdurRKhalid","Decorator","DataSource.java","The `DataSource` interface defines a contract for data operations, specifying methods for writing and reading data. It serves as an abstraction for data handling, with its primary responsibility being to outline the basic operations any data source implementation must provide. The interface is utilized by the `Test` class, which invokes its methods. No explicit design pattern roles are captured in the static analysis."
"AbdurRKhalid","Facade","Codec.java","The `Codec` interface defines a public contract for encoding and decoding operations, serving as a high-level facade in the AbdurRKhalid_Facade project. It collaborates with unspecified implementing classes to provide these functionalities. The interface is involved in the Memento pattern, suggesting it may participate in capturing and restoring the state of an object."
"AbdurRKhalid","Facade","OggCompressionCodec.java","The OggCompressionCodec class implements the Codec interface, indicating its responsibility for providing compression and decompression functionality specific to the Ogg format. It collaborates with other classes through the Codec interface. Notably, static analysis suggests its involvement in the Memento pattern, implying it may participate in object state saving and restoring mechanisms."
"AbdurRKhalid","Facade","Test.java","The `Test` class serves as an entry point for the application, initiating the video conversion process. It directly collaborates with the `VideoConversionFacade` class, delegating the video conversion task to it through the `convertVideo` method. The class does not exhibit any explicit design pattern roles based on the provided static analysis."
"AbdurRKhalid","Facade","VideoConversionFacade.java","The VideoConversionFacade class serves as a public interface for video conversion operations. It is responsible for converting a video file to a specified format by delegating tasks to collaborators: CodecFactory for extracting codecs, BitrateReader for reading and converting bitrates, and AudioMixer for fixing audio. It interacts with the Test class and does not explicitly implement any design patterns."
"AbdurRKhalid","Facade","VideoFile.java","The VideoFile class encapsulates video file information, storing the file name and codec type. It provides methods to retrieve these values. The class is utilized by the CodecFactory class, specifically within the extract method. No design patterns are explicitly implemented or utilized within this class."
"AbdurRKhalid","Facade","AudioMixer.java","The AudioMixer class is responsible for processing and fixing audio within a video file. It is invoked by the VideoConversionFacade class during video conversion. The class contains a single public method, fix, which takes a VideoFile object as input and returns a File object. No explicit design patterns are identified in this class."
"AbdurRKhalid","Facade","CodecFactory.java","The `CodecFactory` class is responsible for extracting the appropriate codec from a given video file. It collaborates with the `VideoConversionFacade` class, which calls its static `extract` method, and the `VideoFile` class, from which it retrieves the codec type. This class operates within the Memento design pattern context, facilitating the restoration of the codec state."
"AbdurRKhalid","Facade","MPEG4CompressionCodec.java","The MPEG4CompressionCodec class implements the Codec interface, indicating its responsibility for handling MPEG-4 compression. It collaborates with the Codec interface and utilizes the Memento pattern, suggesting it participates in object state management or serialization. The class has a single public field, type, initialized to ""mp4""."
"AbdurRKhalid","Facade","BitrateReader.java","The BitrateReader class is responsible for reading and converting video files using specified codecs. It provides two static methods: `read` and `convert`, both of which operate on VideoFile objects and utilize Codec objects. This class is invoked by the VideoConversionFacade for video conversion tasks. No explicit design patterns are identified in this class."
"AbdurRKhalid","Factory Method","WindowsButton.java","The `WindowsButton` class, implementing the `Button` interface, is responsible for rendering and handling click events specific to a Windows operating system environment. It collaborates with itself to execute the `onClick` method when rendered. This class participates in the Factory Method pattern, suggesting it is created by a factory method, and the Memento pattern, indicating it may save and restore its internal state."
"AbdurRKhalid","Factory Method","Button.java","The `Button` interface defines a public contract for button components, specifying `render` and `onClick` methods. It serves as an abstraction for different button implementations, indicating a Factory Method pattern role. The interface's design suggests collaboration with concrete button classes. Notably, static analysis detects a Memento pattern, implying state-saving capabilities within the button's lifecycle."
"AbdurRKhalid","Factory Method","Test.java","The `Test` class serves as an entry point for the application, containing a static `main` method. It holds a private static reference to a `Dialog` object, indicating its responsibility to create and manage the dialog instance. No explicit design patterns are captured in static analysis."
"AbdurRKhalid","Factory Method","Dialog.java","The `Dialog` class is an abstract class that serves as a creator in the Factory Method pattern, responsible for rendering a window and creating buttons. It collaborates with a concrete subclass to implement the abstract `createButton` method. The class also interacts with the `Button` class, which is created via the factory method. Additionally, static analysis suggests the presence of the Memento pattern, indicating potential state-saving functionality."
"AbdurRKhalid","Factory Method","WindowsDialog.java","The WindowsDialog class, a public subclass of Dialog, is responsible for creating and managing Windows-specific dialog components. It collaborates with the Button class through the overridden createButton() method, which suggests it utilizes the Factory Method pattern to instantiate buttons. Notably, static analysis detected the Memento pattern within this class, indicating it likely handles the saving and restoring of internal states."
"AbdurRKhalid","Factory Method","HtmlDialog.java","The `HtmlDialog` class, a public subclass of `Dialog`, is responsible for creating HTML-specific buttons through its overridden `createButton()` method. It collaborates with the `Button` class to achieve this functionality. Notably, static analysis suggests the presence of the Memento pattern within this class's context, indicating state-saving capabilities."
"AbdurRKhalid","Factory Method","HtmlButton.java","The `HtmlButton` class, implementing the `Button` interface, is responsible for rendering and handling click events for HTML buttons. It collaborates with itself to manage these actions. Within the factory method pattern, it serves as a product, created by a concrete creator. Additionally, it participates in the memento pattern, suggesting state-saving capabilities."
"AbdurRKhalid","Memento","TextEditor.java","The TextEditor class is responsible for managing the state of a TextWindow and providing functionality to save and undo changes. It collaborates with a TextWindow instance to manipulate the current text and a savedTextWindowState to store the state for undo operations. The class does not explicitly implement any design patterns."
"AbdurRKhalid","Memento","TextWindow.java","The `TextWindow` class is responsible for managing and manipulating text content within a window, utilizing a `StringBuilder` to store the current text. It collaborates with the `TextWindowState` class to save and restore the state of the text. The class provides methods to add text, save the current state, and restore a previously saved state. No explicit design patterns are identified in the static analysis."
"AbdurRKhalid","Memento","TextWindowState.java","The TextWindowState class encapsulates the state of a text window, storing the text content as a private String field. It provides a constructor to initialize the text and a getter method to retrieve it. The class serves as a Memento, capturing and externalizing the state of a TextWindow for later restoration, adhering to the Memento design pattern."
"AbdurRKhalid","Observer","EmailNotificationListener.java","The `EmailNotificationListener` class, implementing the `EventListener` interface, acts as an observer in the Observer pattern. It is responsible for sending email notifications upon receiving updates. The class collaborates with a `File` object to access relevant data and uses a private `email` field to store the recipient's address. Its single constructor initializes the email address, and the overridden `update` method processes event notifications."
"AbdurRKhalid","Observer","EventManager.java","The EventManager class, implementing the Observer pattern, manages event listeners for various operations. It maintains a map of event types to lists of EventListener collaborators. The class provides methods to subscribe, unsubscribe, and notify listeners about file events, facilitating decoupled event handling."
"AbdurRKhalid","Observer","EventListener.java","The `EventListener` interface defines a contract for observers in the Observer pattern, requiring implementing classes to provide an `update` method. This method is invoked with a `String` event type and a `File` object, indicating the interface's responsibility to notify observers of file-related events. Collaborators are unspecified, but the pattern suggests a one-to-many relationship with subjects that maintain and notify a list of observers."
"AbdurRKhalid","Observer","Editor.java","The Editor class is responsible for managing file operations, specifically opening and saving files. It collaborates with an EventManager to handle events and maintains a reference to a File. The class does not explicitly implement any design patterns, as per static analysis. Its primary role is to facilitate file manipulation while delegating event management to the EventManager."
"AbdurRKhalid","Observer","LogOpenListener.java","The `LogOpenListener` class, implementing the `EventListener` interface, acts as an observer in the Observer pattern. It is responsible for logging file events, utilizing a private `File` field to store the log file. The class collaborates with the `File` class and is instantiated with a filename. Its single method, `update`, handles event notifications, indicating its role in reacting to file-related events."
"AbdurRKhalid","Singleton","Test.java","The `Test` class serves as an entry point for the AbdurRKhalid_Singleton project, with its sole responsibility being to execute the application's main method. It contains a single public static method, `main(String[] args)`, which initiates the program. No design patterns are explicitly captured in static analysis, and the class does not collaborate with other classes."
"AbdurRKhalid","Singleton","Singleton.java","The Singleton class is responsible for managing a single instance of itself, encapsulating a String value. It collaborates with itself through a public static instance and a private constructor, ensuring controlled access to the instance. The class provides a static getInstance method to retrieve or create the instance, adhering to the Singleton design pattern."
"AbdurRKhalid","Visitor","ComputerPart.java","The `ComputerPart` interface defines a contract for accepting a `ComputerPartVisitor` in the Visitor design pattern. It is implemented by concrete computer part classes and is utilized by the `Test` class's main method and the `Computer` class. Its primary responsibility is to enable visitation by providing an `accept` method."
"AbdurRKhalid","Visitor","Monitor.java","The Monitor class, a public subclass of ComputerPart, implements the Visitor pattern by accepting a ComputerPartVisitor to handle operations. It overrides the accept method to facilitate visitor access, collaborating with ComputerPartVisitor through the visit method. This design enables dynamic operation execution on Monitor objects without modifying their class."
"AbdurRKhalid","Visitor","Mouse.java","The `Mouse` class, a public subclass of `ComputerPart`, implements the `ComputerPart` interface and participates in the Visitor design pattern. Its primary responsibility is to accept visitors, facilitating operations on the object structure without modifying its classes. It collaborates with `ComputerPartVisitor`, invoking its `visit` method to perform specific operations."
"AbdurRKhalid","Visitor","ComputerPartDisplayVisitor.java","The `ComputerPartDisplayVisitor` class, implementing the Visitor pattern, extends `ComputerPartVisitor` and overrides methods to visit specific computer parts: `Computer`, `Mouse`, `Keyboard`, and `Monitor`. It collaborates with these concrete element classes to perform display-related operations, adhering to the Visitor pattern's structure for separating algorithms from object structures."
"AbdurRKhalid","Visitor","Test.java","The `Test` class serves as the entry point for the AbdurRKhalid_Visitor project, containing a public static `main` method. Its primary responsibility is to initiate the program execution. It interacts with the `ComputerPart` class by invoking the `accept` method, suggesting it facilitates the visitor pattern's operation. No explicit design patterns are captured in the static analysis."
"AbdurRKhalid","Visitor","Keyboard.java","The `Keyboard` class, a public subclass of `ComputerPart`, implements the Visitor pattern by accepting a `ComputerPartVisitor` to perform operations on it. Its primary responsibility is to facilitate visitation by calling the `visit` method on the provided visitor, enabling the visitor to access and manipulate the keyboard's data."
"AbdurRKhalid","Visitor","Computer.java","The `Computer` class, extending and implementing `ComputerPart`, represents a component in a hierarchical structure. It maintains a collection of `ComputerPart` objects and facilitates visitor pattern operations by accepting a `ComputerPartVisitor` to traverse and perform operations on its parts, delegating to `ComputerPart.accept` and `ComputerPartVisitor.visit`."
"AbdurRKhalid","Visitor","ComputerPartVisitor.java","The `ComputerPartVisitor` interface defines a visitor pattern, accepting visits from various computer parts. It declares methods to visit `Computer`, `Mouse`, `Keyboard`, and `Monitor` objects, facilitating operations on these elements without modifying their classes. Collaborators include `Mouse`, `Monitor`, `Computer`, and `Keyboard`, which call the visitor's methods via their `accept` methods."
"JamesZBL","abstract-factory","YoungSailor.java","The `YoungSailor` class, implementing the `Sailor` interface, represents a young sailor with a static description field. It provides a method to retrieve this description. It participates in factory method, abstract factory, observer, and memento design patterns, suggesting it is created and managed by factory classes and can be observed or saved/restored."
"JamesZBL","abstract-factory","OldShip.java","The OldShip class, implementing the Ship interface, represents a specific type of ship with a predefined description. It collaborates within an abstract factory pattern context, suggesting it is created by a factory method. Additionally, it participates in observer and memento patterns, indicating it may be observed for state changes and support state restoration. Its primary responsibility is to provide a description of an old ship."
