Project,Folder Name,File Name,Summary
"spring-framework","Adapter","IsolationLevelDataSourceAdapter.java","The `IsolationLevelDataSourceAdapter` class extends `UserCredentialsDataSourceAdapter` and manages transaction isolation levels for database connections. It maintains a static map of isolation level constants and a private field for the current isolation level. The class provides methods to set and get the isolation level, and overrides the `doGetConnection` method to apply the specified isolation level. It collaborates with itself to manage isolation level settings and connection handling, without explicitly implementing any design patterns."
"spring-framework","Adapter","HttpRequestHandlerAdapter.java","The `HttpRequestHandlerAdapter` class, implementing the `HandlerAdapter` interface, adapts HTTP request handling. It supports and processes requests via the `supports` and `handle` methods, collaborating with `HttpServletRequest`, `HttpServletResponse`, and a generic handler object. No explicit design patterns are identified."
"spring-framework","Adapter","SimpleControllerHandlerAdapter.java","The `SimpleControllerHandlerAdapter` class implements the `HandlerAdapter` interface, indicating its role in adapting handlers within the Spring framework. It is responsible for supporting and handling HTTP requests and responses, as evidenced by its methods `supports` and `handle`. The class collaborates with `HttpServletRequest`, `HttpServletResponse`, and an unspecified handler object. No explicit design patterns are captured in the static analysis."
"spring-framework","Adapter","MethodBeforeAdviceAdapter.java","The `MethodBeforeAdviceAdapter` class, implementing `AdvisorAdapter` and `Serializable`, adapts `MethodBeforeAdvice` to the `MethodInterceptor` interface. It checks advice support via `supportsAdvice` and creates interceptors using `getInterceptor`, collaborating with `Advisor` and `Advice`. No explicit design patterns are captured in static analysis."
"spring-framework","Decorator","BufferingClientHttpResponseWrapper.java","The `BufferingClientHttpResponseWrapper` class is a final implementation of the `ClientHttpResponse` interface, designed to buffer the response body for later use. It collaborates with a `ClientHttpResponse` instance to delegate operations like getting status code, status text, headers, and closing the response. The class overrides the `getBody()` method to provide a buffered input stream, utilizing a volatile byte field for buffering. No explicit design pattern roles are captured in static analysis."
"spring-framework","Decorator","ContentCachingRequestWrapper.java","The ContentCachingRequestWrapper class extends HttpServletRequestWrapper to cache the content of an HTTP request. It collaborates with FastByteArrayOutputStream to store the cached content and manages ServletInputStream and BufferedReader for reading the request data. The class overrides methods to provide cached content, handling parameters and input streams. It does not explicitly implement a design pattern."
"spring-framework","Decorator","ScopedProxyBeanDefinitionDecorator.java","The ScopedProxyBeanDefinitionDecorator class implements the BeanDefinitionDecorator interface, focusing on decorating bean definitions within the Spring framework. It utilizes the PROXY_TARGET_CLASS constant and collaborates with Node, BeanDefinitionHolder, and ParserContext to override the decorate method, enhancing bean definitions with scoped proxy capabilities. No explicit design patterns are identified."
"spring-framework","Decorator","WebSocketHandlerDecorator.java","The `WebSocketHandlerDecorator` class implements the `WebSocketHandler` interface and acts as a decorator, extending the functionality of a wrapped `WebSocketHandler` instance. It maintains a private `delegate` field to reference the wrapped handler. The class overrides several methods to provide additional behavior before or after delegating to the wrapped handler. It does not explicitly follow a design pattern."
"spring-framework","Facade","RestTemplate.java","The `RestTemplate` class is a public facade for performing synchronous client-side HTTP requests, implementing the `RestOperations` interface. It extends `InterceptingHttpAccessor` and collaborates with `HttpMessageConverter`, `ResponseErrorHandler`, and `UriTemplateHandler` to handle message conversion, error handling, and URI templating. It manages a list of message converters and provides methods for setting and retrieving them, along with error handlers. No explicit design patterns are identified."
"spring-framework","Facade","TransactionTemplate.java","The `TransactionTemplate` class, extending `DefaultTransactionDefinition` and implementing `TransactionOperations` and `InitializingBean`, serves as a template for transactional operations. It collaborates with a `PlatformTransactionManager` to manage transactions and uses a `TransactionCallback` for executing transactional code. It overrides methods for setting the transaction manager, executing transactions, and validating properties. No explicit design patterns are captured in static analysis."
"spring-framework","Facade","JmsTemplate.java","The `JmsTemplate` class, extending `JmsDestinationAccessor` and implementing `JmsOperations`, serves as a high-level abstraction for JMS (Java Message Service) operations. It manages default destinations, message conversion, and JMS resource access. Key collaborators include `ConnectionFactory`, `MessageConverter`, and `JmsTemplateResourceFactory`. It does not explicitly employ design patterns."
"spring-framework","Facade","JdbcTemplate.java","The `JdbcTemplate` class, extending `JdbcAccessor` and implementing `JdbcOperations`, serves as a core Spring JDBC facade for database operations. It manages data source interactions, handling SQL queries, updates, and result processing. Key collaborators include `DataSource`, `RowMapper`, and `PreparedStatementSetter`. It configures statement settings like fetch size and timeout, and processes results. No explicit design patterns are captured in static analysis."
"spring-framework","FactoryMethod","CronTriggerFactoryBean.java","The `CronTriggerFactoryBean` class is responsible for creating and configuring `CronTrigger` instances in the Spring framework. It implements the `FactoryBean` pattern, providing a factory method to produce `CronTrigger` objects. Key collaborators include `JobDetail`, `JobDataMap`, and `Date`, which are used to set up the trigger's job details, data map, and start time. The class also adheres to the `BeanNameAware` and `InitializingBean` interfaces, indicating its integration with the Spring IoC container."
"spring-framework","FactoryMethod","SchedulerFactoryBean.java","The `SchedulerFactoryBean` class, extending `SchedulerAccessor` and implementing several bean-related interfaces, is responsible for creating and managing a Quartz `Scheduler` instance. It collaborates with `SchedulerFactory` and holds various thread-local resources like `ResourceLoader`, `Executor`, and `DataSource`. The class provides methods to access these resources and configure the scheduler factory. No explicit design patterns are identified."
"spring-framework","FactoryMethod","AdaptableJobFactory.java","The AdaptableJobFactory class, implementing the JobFactory interface, is responsible for creating and adapting job instances. It collaborates with TriggerFiredBundle and Scheduler to produce jobs, utilizing the newJob method to initiate this process. The class employs createJobInstance to instantiate job objects and adaptJob to modify them as needed, demonstrating a factory method pattern without explicit design pattern annotations."
"spring-framework","FactoryMethod","JobDetailFactoryBean.java","The `JobDetailFactoryBean` class is a public factory bean that creates and configures `JobDetail` instances for the Quartz scheduler. It implements several Spring interfaces, including `FactoryBean`, `BeanNameAware`, `ApplicationContextAware`, and `InitializingBean`, indicating its role in the Spring IoC container. It collaborates with `JobDataMap` to store job-specific data and uses `Job` as a generic type for job classes. The class sets up job details like name, group, job class, and durability, but no explicit design patterns are captured in static analysis."
"spring-framework","FactoryMethod","MethodInvokingJobDetailFactoryBean.java","The `MethodInvokingJobDetailFactoryBean` class is responsible for creating `JobDetail` instances for use in scheduling tasks, extending `ArgumentConvertingMethodInvoker` and implementing several `Aware` and `FactoryBean` interfaces. It collaborates with a target bean, whose method will be invoked when the job is executed. The class sets up job details like name, group, and concurrency, but no explicit design patterns are captured in static analysis."
"spring-framework","Memento","SimpleApplicationEventMulticaster.java","The `SimpleApplicationEventMulticaster` class is responsible for multicasting application events, extending the `AbstractApplicationEventMulticaster` class. It collaborates with `Executor` for task execution and `ErrorHandler` for error management, with both being configurable. The class utilizes a `Log` for logging purposes. It overrides event multicasting methods to incorporate its specific behavior. No explicit design patterns are captured in static analysis."
"spring-framework","Memento","SavepointManager.java","The `SavepointManager` interface defines a contract for managing savepoints in a system, allowing the creation, rollback, and release of savepoints. It collaborates with an unspecified object type for savepoints. The interface does not explicitly implement any design patterns, as no patterns were captured in static analysis."
"spring-framework","Memento","AbstractTransactionStatus.java","The `AbstractTransactionStatus` class, implementing the `TransactionStatus` interface, manages transaction state, including rollback and completion status. It maintains a savepoint object and interacts with a savepoint manager. The class provides methods to set and check rollback and completion states, and to manage savepoints. It collaborates with other classes to handle transaction status operations, but no explicit design patterns are captured in static analysis."
"spring-framework","Observer","ApplicationEventPublisher.java","The `ApplicationEventPublisher` interface defines a contract for publishing application events. It requires implementations to provide methods for publishing events of type `ApplicationEvent` and generic `Object`. This interface serves as a central point for event dissemination, collaborating with event listeners to notify them of state changes or occurrences within the application. No explicit design-pattern roles are captured in static analysis."
"spring-framework","Observer","ApplicationListener.java","The `ApplicationListener` interface defines a contract for listening to application events in the Spring Framework. It extends `EventListener` and declares a single method, `onApplicationEvent`, to handle events. It also provides a default method, `supportsAsyncExecution`, and a static factory method, `forPayload`, to create listeners for payload events. It collaborates with event objects and consumers, but no explicit design patterns are captured in static analysis."
"spring-framework","Observer","AbstractApplicationEventMulticaster.java","The `AbstractApplicationEventMulticaster` class serves as an abstract base for event multicasters in the Spring framework, implementing `ApplicationEventMulticaster`, `BeanClassLoaderAware`, and `BeanFactoryAware` interfaces. It manages event listeners and their retrieval, utilizing `DefaultListenerRetriever` and a cache for efficiency. Collaborators include `ConfigurableBeanFactory` and `ClassLoader`, injected via `BeanFactoryAware` and `BeanClassLoaderAware`. No explicit design patterns are captured."
"spring-framework","Singleton","SmartInitializingSingleton.java","The `SmartInitializingSingleton` interface defines a contract for singleton beans in the Spring framework, requiring them to implement the `afterSingletonsInstantiated()` method. It enables beans to perform initialization after the singleton beans are instantiated, facilitating post-initialization logic. No specific collaborators or design patterns are explicitly captured in the static analysis."
"spring-framework","Singleton","DefaultSingletonBeanRegistry.java","The `DefaultSingletonBeanRegistry` class, implementing `SingletonBeanRegistry`, manages singleton beans in the Spring framework. It maintains maps for singleton objects, factories, callbacks, and early singletons, using a `ReentrantLock` for thread safety. Collaborators include `SimpleAliasRegistry` and various internal maps. It provides methods to register, retrieve, and manage singleton beans, without explicitly employing a design pattern."
"spring-framework","Singleton","DefaultListableBeanFactory.java","The `DefaultListableBeanFactory` class, extending `AbstractAutowireCapableBeanFactory` and implementing several interfaces, serves as a configurable and serializable bean factory. It manages bean definitions, allowing registration, removal, and overriding, and supports eager class loading. Collaborating with various Spring framework components, it provides methods to access and manipulate bean definitions. It does not explicitly follow a specific design pattern."
"spring-framework","Singleton","SingletonSupplier.java","The SingletonSupplier class is responsible for managing and providing a singleton instance of type T. It collaborates with Supplier interfaces to obtain and manage the singleton instance, utilizing a ReentrantLock for thread-safe initialization. The class provides static factory methods for creating instances with or without a default value. It does not explicitly implement a known design pattern."
"spring-framework","Singleton","SingletonBeanRegistry.java","The SingletonBeanRegistry interface defines a registry for managing singleton objects within a Spring application context. It provides methods to register, retrieve, and manage singleton beans, collaborating with consumers for singleton callbacks. The interface does not explicitly implement any design patterns, but it facilitates the Singleton pattern by providing a centralized registry for singleton instances."
"spring-framework","Visitor","BeanDefinitionVisitor.java","The `BeanDefinitionVisitor` class is responsible for visiting and processing various aspects of a `BeanDefinition`, such as its parent name, class name, factory details, and scope. It collaborates with a `StringValueResolver` to resolve string values and utilizes its own methods to visit collections like maps, sets, lists, and arrays. The class does not explicitly implement any design patterns."
"spring-framework","Visitor","BeanFactory.java","The `BeanFactory` interface defines a generic factory pattern for managing and retrieving beans, with methods to obtain beans by name or type. It collaborates with generic types `T` and `ObjectProvider<T>` for flexible bean retrieval. The interface includes constants for factory bean prefixes. No explicit design patterns are captured in static analysis."
