Project,Folder Name,File Name,Summary
"JamesZBL","abstract-factory","OldSailor.java","The `OldSailor` class, implementing the `Sailor` interface, is responsible for providing a description of an old sailor. It contains a static final field `DESCRIPTION` and a method `getDescription()` to retrieve this description. The class participates in multiple design patterns, including Factory Method, Abstract Factory, Observer, and Memento, suggesting its role in object creation, observation, and state management within the system."
"JamesZBL","abstract-factory","NewShip.java","The `NewShip` class, implementing the `Ship` interface, is responsible for providing a description of a new ship. It collaborates with the abstract factory, observer, and memento patterns, suggesting it may be created through a factory, observed for state changes, and support state saving/restoration. Its sole field, `DESCRIPTION`, is a static final string."
"JamesZBL","abstract-factory","PermanentTeamFactory.java","The `PermanentTeamFactory` class, implementing the `TeamFactory` interface, is responsible for creating permanent team members, including ships, captains, and sailors, adhering to the Abstract Factory pattern. It collaborates with the `Ship`, `Captain`, and `Sailor` classes to instantiate these objects. Additionally, the class is involved in the Memento pattern, suggesting it participates in the creation or restoration of team states."
"JamesZBL","abstract-factory","OldCaptain.java","The OldCaptain class, implementing the Captain interface, provides a concrete implementation for an abstract factory pattern, serving as a product variant. It holds a static description field and offers a method to retrieve this description. The class participates in observer and memento patterns, suggesting it notifies observers of state changes and supports object state saving and restoring. Its key collaborator is the abstract factory that produces it."
"JamesZBL","abstract-factory","Ship.java","The `Ship` interface, extending `Member`, serves as an abstract blueprint for ship entities within the system. It participates in the abstract factory, observer, and memento patterns, suggesting it is created by a factory, can be observed for state changes, and supports state restoration. Collaborators include factory classes and observers."
"JamesZBL","abstract-factory","TeamFactory.java","The `TeamFactory` interface defines a contract for creating teams of ships, captains, and sailors, adhering to the Abstract Factory pattern. It collaborates with `Ship`, `Captain`, and `Sailor` classes to produce team members. The interface also hints at the Factory Method and Memento patterns, suggesting it may manage the creation and state-saving processes of team components."
"JamesZBL","abstract-factory","Application.java","The `Application` class is responsible for creating and managing a team consisting of a `Ship`, `Captain`, and `Sailor` using a `TeamFactory`. It collaborates with these components and utilizes the Observer and Memento design patterns, as detected via static analysis, to maintain and potentially restore the state of the application and its team."
"JamesZBL","abstract-factory","Member.java","The `Member` interface defines a contract for objects that can provide a description through the `getDescription()` method. It serves as a blueprint for member entities within the system, abstracting the common behavior of description retrieval. No explicit design patterns or collaborators are identified through static analysis."
"JamesZBL","abstract-factory","Sailor.java","The `Sailor` interface, extending `Member`, defines the abstract behavior for sailor entities within the system. It participates in the abstract factory, observer, and memento patterns, suggesting it is created by a factory, can be observed for state changes, and supports state preservation and restoration. Collaborators include the factory producing `Sailor` instances and observers monitoring its state."
"JamesZBL","adapter","Bus.java","The Bus class in the JamesZBL_adapter project is responsible for executing a run operation, as indicated by its single public method. It utilizes a private static final Logger instance, created via LoggerFactory, to facilitate logging activities. No explicit design patterns are identified within this class based on static analysis."
"JamesZBL","adapter","Car.java","The `Car` interface, part of the JamesZBL_adapter project, defines a single method `drive()` and serves as a component in the Decorator pattern. It establishes a contract for car-like objects, allowing decorators to dynamically add responsibilities. Collaborators include concrete car implementations and decorator classes that extend functionality."
"JamesZBL","adapter","Driver.java","The `Driver` class, implementing the `Car` interface, is responsible for driving a car. It collaborates with a `Car` object, which is injected via its constructor. The `drive()` method is overridden to provide specific driving behavior. This class participates in the Decorator pattern, allowing for dynamic addition of responsibilities to the `Car` object."
"JamesZBL","adapter","Application.java","The Application class serves as the entry point for the JamesZBL_adapter project, housing the main method that initiates the program's execution. It does not exhibit any explicit design pattern roles or collaborate with other classes based on the provided structural facts. Its primary responsibility is to launch the application."
"JamesZBL","adapter","BusAdapter.java","The `BusAdapter` class acts as a decorator, implementing the `Car` interface to adapt a `Bus` object. It encapsulates a `Bus` instance and overrides the `drive()` method, adhering to the Decorator pattern. This design allows `BusAdapter` to modify or extend the behavior of the `Bus` without altering its structure."
"JamesZBL","decorator","HammerSmithOperation.java","The `HammerSmithOperation` class implements the `Operation` interface and serves as a decorator in the Decorator pattern, enhancing the behavior of other `Operation` objects. It maintains a reference to a `previousOperation`, which it decorates, and uses a logger for tracking. Its methods `checkBefore`, `join`, and `chekcAfter` override those of the `Operation` interface, indicating it extends or modifies the behavior of the decorated operation."
"JamesZBL","decorator","Operation.java","The `Operation` interface defines a contract for operations with methods to check conditions before and after execution, and to join an operation. It serves as a component in the Decorator pattern, allowing dynamic addition of responsibilities to objects. Collaborators include concrete implementations and decorators that extend its functionality."
"JamesZBL","decorator","Application.java","The `Application` class serves as the entry point for the JamesZBL_decorator project, responsible for initiating the program execution. It utilizes the `Logger` interface from the `LoggerFactory` for logging purposes. The class does not exhibit any explicit design-pattern roles based on static analysis."
"JamesZBL","decorator","CarpenterOperation.java","The `CarpenterOperation` class, implementing the `Operation` interface, serves as a base for operations related to carpentry tasks. It utilizes a `Logger` for logging purposes. This class is part of the Decorator pattern, suggesting it may be extended or decorated to modify or enhance its behavior at runtime."
"JamesZBL","facade","CourseFacade.java","The `CourseFacade` class serves as an intermediary, managing course-related operations. It maintains a list of `CourseParticipator` objects, suggesting it coordinates participant activities. The class provides methods to prepare, proceed, and stop course processes, indicating a role in controlling the course lifecycle. No explicit design patterns are identified."
"JamesZBL","facade","CourseParticipator.java","The `CourseParticipator` class is an abstract public class responsible for managing course-related actions such as preparation, progression, and termination, as well as handling school and home commutes. It utilizes a static `Logger` for logging purposes. The class defines abstract method `name()` and interacts with itself for various course and movement actions. No explicit design patterns are identified."
"JamesZBL","facade","CourseStudent.java","The CourseStudent class, a public subclass of CourseParticipator, is responsible for representing a student participant in a course. It overrides the name() method to provide student-specific naming functionality. The class collaborates with its parent class, CourseParticipator, inheriting and potentially extending its behavior. No explicit design patterns are captured in the static analysis of this class."
"JamesZBL","facade","Application.java","The `Application` class serves as the entry point for the JamesZBL_facade project, with its sole responsibility being the execution of the program through the `main` method. This class does not exhibit any explicit design-pattern roles or interactions with other classes, as indicated by the lack of captured design-pattern insights in static analysis. Its simplicity suggests it may delegate responsibilities to other classes not visible in the provided structural facts."
"JamesZBL","facade","CourseTeacher.java","The CourseTeacher class, a public subclass of CourseParticipator, is responsible for representing a teacher within a course context. It overrides the name() method to provide teacher-specific naming functionality. Collaborating with other classes through inheritance, it extends the base CourseParticipator functionality. No explicit design patterns are identified in this class."
"JamesZBL","factory-method","ChineseCook.java","The `ChineseCook` class, implementing the `Cook` interface, is responsible for preparing food based on the specified `FoodType`. It collaborates with the `Food` class to produce the desired culinary output. This class participates in the factory method and abstract factory patterns, suggesting its role in creating and managing food objects. Additionally, it engages in the memento pattern, indicating involvement in capturing and restoring the state of cooking processes."
"JamesZBL","factory-method","FoodType.java","The `FoodType` class encapsulates a food type's name, serving as a simple data holder. It has a single private field, `name`, and provides a constructor and getter method to access this value. The class does not collaborate with other classes or participate in any design patterns, focusing solely on storing and providing access to the food type's name."
"JamesZBL","factory-method","WesternFood.java","The WesternFood class, implementing the Food interface, represents a type of Western cuisine. It collaborates with the FoodType class to define its specific food type. WesternFood participates in the factory method, abstract factory, and memento design patterns, suggesting it is created by a factory, part of a product hierarchy, and can save/restore its state. Its primary responsibility is to encapsulate Western food types and provide basic functionality through overridden methods."
"JamesZBL","factory-method","Cook.java","The `Cook` interface defines a contract for cooking food, with a single method `cookFood` that takes a `FoodType` parameter. It collaborates with `FoodType` to determine the type of food to be cooked. The interface is part of multiple design patterns: it serves as the creator in the Factory Method pattern, as part of the Abstract Factory pattern, and potentially in the Memento pattern for state management."
"JamesZBL","factory-method","ChineseFood.java","The `ChineseFood` class, implementing the `Food` interface, represents a type of Chinese cuisine. It collaborates with `FoodType` to specify the kind of Chinese food. It participates in the Factory Method, Abstract Factory, and Memento design patterns, suggesting its role in creating and managing food objects, as well as capturing and restoring internal states."
"JamesZBL","factory-method","Application.java","The `Application` class serves as the entry point for the program, utilizing the Factory Method pattern to create and manage a `Cook` instance. It maintains a private `Cook` field and a static `Logger` for logging purposes. The class's primary responsibility is to initiate the food-making process through the `makeFood` method, which is called from the `main` method."
"JamesZBL","factory-method","WesternCook.java","The `WesternCook` class, implementing the `Cook` interface, is responsible for preparing food based on specified `FoodType`. It collaborates with the `Food` class to produce the desired cuisine. Within the abstract factory pattern, it serves as a concrete factory for Western-style dishes. Additionally, it participates in the memento pattern, likely to manage and restore the state of cooking processes."
"JamesZBL","factory-method","Food.java","The `Food` interface defines a contract for food items, requiring the implementation of a `getFoodType()` method to retrieve the type of food. It participates in the Abstract Factory pattern, suggesting it is part of a system for creating families of related objects. The detection of the Memento pattern indicates potential involvement in object state management, though specific collaborators are not explicitly stated."
"JamesZBL","memento","Flower.java","The `Flower` class, a public subclass of `Plant`, encapsulates flower-specific attributes like type, name, height, and weight. It collaborates with `FlowerMemento` for state management, utilizing the Memento pattern implicitly. The class adheres to the Observer pattern, as detected via static analysis, suggesting it maintains or notifies observers of its state changes. It also participates in the Abstract Factory pattern, indicating its creation is managed by a factory. The class overrides several methods from its superclass, including `toString()`, `getWeight()`, and provides specific methods..."
"JamesZBL","memento","Plant.java","The `Plant` interface defines a contract for plant entities, mandating implementations to provide methods for retrieving weight, height, and type. It serves as a product interface within the Abstract Factory pattern, collaborating with factory classes to create and manage plant objects."
"JamesZBL","memento","FlowerType.java","The `FlowerType` class encapsulates the name of a flower type, serving as a simple data holder. It collaborates with other classes in the context of the Observer pattern, suggesting it may be observed for changes in flower type information. The class provides a constructor to initialize the name and a `toString()` method for string representation."
"JamesZBL","memento","Application.java","The `Application` class serves as the entry point for the JamesZBL_memento project, responsible for initiating the application's execution. It utilizes the `Logger` interface from the `LoggerFactory` for logging purposes, indicating its role in managing application startup and logging. No explicit design patterns are captured in the static analysis."
"JamesZBL","observer","Northern.java","The Northern class, implementing the TimeObserver interface, serves as an observer in the Observer pattern, reacting to time updates. It collaborates with a Logger for logging purposes and receives time updates through the update method, which it overrides from the TimeObserver interface."
"JamesZBL","observer","TimePoint.java","The `TimePoint` class encapsulates a time-related entity with a name, serving as a simple data holder. It collaborates with no other classes explicitly. The class overrides the `toString()` method to provide a string representation of the time point. No design patterns are evident in its structure."
"JamesZBL","observer","Time.java","The `Time` class, adhering to the Observer pattern, manages time-related events and notifies registered observers. It maintains a `TimePoint` to track the current time and a list of `TimeObserver` instances. The class allows adding or removing observers and notifies them when time passes, leveraging the `notifyObservers` method to update all registered observers."
"JamesZBL","observer","Southern.java","The `Southern` class, implementing the `TimeObserver` interface, acts as an observer in the Observer pattern, reacting to time updates. It utilizes a static `Logger` for logging purposes. Its sole responsibility is to respond to time changes via the `update` method, collaborating with the subject that triggers these updates."
"JamesZBL","observer","Application.java","The Application class serves as the entry point for the JamesZBL_observer project. It is a public class with a single main method, which is the starting point for the application's execution. The class does not exhibit any explicit design pattern roles or collaborators based on the provided structural facts. Its primary responsibility is to initiate the application process."
"JamesZBL","observer","TimeObserver.java","The `TimeObserver` interface defines a contract for observing time updates within the Observer pattern. It declares a single `update(TimePoint time)` method, indicating its responsibility to react to time changes. Collaborators must implement this interface to receive notifications, with the `TimePoint` class serving as the argument type for the update method."
"JamesZBL","singleton","ThreadSafeDoubleCheckLocking.java","The `ThreadSafeDoubleCheckLocking` class is a thread-safe implementation of the Singleton pattern, ensuring a single instance is created and shared across the application. It uses the `volatile` keyword for the `INSTANCE` field to ensure visibility of changes across threads. The class collaborates with the `getInstance()` method to provide access to the singleton instance. Additionally, the class exhibits characteristics of the Memento pattern, suggesting it may be involved in capturing and restoring internal states."
"JamesZBL","singleton","EnumDirector.java","The EnumDirector class is a public class with a single responsibility of providing a string representation of itself, as indicated by its overridden toString() method. It does not explicitly collaborate with other classes or implement any specific design patterns, as no design pattern insights were captured in static analysis."
"JamesZBL","singleton","LazyInitializationDirector.java","The `LazyInitializationDirector` class is a public final singleton that manages its own instance creation and access. It employs lazy initialization, creating its single instance upon first access via the `getInstance()` method. The class collaborates with itself, maintaining a private static final reference to its sole instance. It adheres to the Singleton pattern, ensuring only one instance exists, and is involved in the Memento pattern, though its specific role in that pattern is not detailed."
"JamesZBL","singleton","Director.java","The `Director` class is a public final class implementing the Singleton pattern, ensuring only one instance exists. It collaborates with the Memento pattern, suggesting it manages state restoration. The class provides a static `getInstance()` method to access its sole instance, created via a private constructor."
"JamesZBL","singleton","ThreadSafeLazyLoadDirector.java","The `ThreadSafeLazyLoadDirector` class is a public final singleton that ensures thread-safe lazy loading of its single instance. It collaborates with itself via a private static volatile instance field. The class employs the singleton pattern, as evidenced by its private constructor and synchronized static getInstance() method, ensuring only one instance exists. Additionally, static analysis suggests the presence of the memento pattern, though no explicit collaborators are visible."
"JamesZBL","singleton","Application.java","The `Application` class serves as the entry point for the JamesZBL_singleton project, with its primary responsibility being the execution of the main method. It collaborates with a `Logger` instance, obtained through the `LoggerFactory`, to facilitate logging operations. No explicit design patterns are captured in the static analysis of this class."
"JamesZBL","visitor","Boss.java","The Boss class, a public subclass of Unit, represents a unit with subordinate units in the JamesZBL_visitor project. It is initialized with an array of Unit objects, indicating its responsibility for managing a hierarchy of units. The class overrides the beVisited method, suggesting it participates in a visitor pattern, accepting a UnitVisitor to perform operations on it. It also overrides toString, likely for custom string representation."
"JamesZBL","visitor","Engineer.java","The Engineer class, a public subclass of Unit, represents an entity in the JamesZBL_visitor project. It is responsible for managing a collection of child units and providing a string representation of itself. The class collaborates with UnitVisitor through the beVisited method, allowing visitors to interact with it. It does not explicitly implement any design patterns."
"JamesZBL","visitor","ManagerVisitor.java","The ManagerVisitor class, implementing the UnitVisitor interface, is responsible for visiting and processing different unit types: Engineer, Boss, and Manager. It utilizes a static Logger for logging purposes. The class adheres to the Visitor design pattern, allowing it to perform operations on these units without changing their classes."
"JamesZBL","visitor","UnitVisitor.java","The `UnitVisitor` interface defines a visitor pattern for traversing a hierarchy of unit types, including `Engineer`, `Boss`, and `Manager`. It declares three visit methods, each corresponding to a specific unit type, enabling the implementation of operations that depend on the concrete unit classes."
"JamesZBL","visitor","BossVisitor.java","The BossVisitor class, implementing the UnitVisitor interface, is responsible for visiting and performing operations on different unit types: Engineer, Boss, and Manager. It utilizes a static Logger for logging purposes. The class adheres to the Visitor design pattern, allowing it to apply specific operations to each unit type without modifying their classes."
"JamesZBL","visitor","EngineerVisitor.java","The EngineerVisitor class, implementing the UnitVisitor interface, is responsible for visiting and performing operations on Engineer, Boss, and Manager units. It utilizes a static Logger for logging purposes. The class adheres to the Visitor design pattern, allowing it to apply specific operations to each unit type without modifying their classes."
"JamesZBL","visitor","Manager.java","The Manager class, a public subclass of Unit, is responsible for managing a collection of Unit objects, which are passed to its constructor. It overrides the beVisited method to facilitate visitor pattern interactions with UnitVisitor instances, allowing for external operations on the Manager and its children. The toString method is also overridden, presumably to provide a string representation of the Manager."
"JamesZBL","visitor","Unit.java","The `Unit` class is an abstract public class responsible for representing a unit within the `JamesZBL_visitor` project. It maintains a private collection of child `Unit` objects, which are initialized through its constructor. The class provides a method, `beVisited`, to facilitate visitation by a `UnitVisitor`, indicating a visitor design pattern role."
"JamesZBL","visitor","Application.java","The `Application` class serves as the entry point for the JamesZBL_visitor project, with a single public static `main` method that initiates the program execution. It does not collaborate with other classes or employ any discernible design patterns based on static analysis. Its primary responsibility is to start the application."
"spring-framework","AbstractFactory","ClientHttpRequestFactory.java","The `ClientHttpRequestFactory` interface defines a contract for creating `ClientHttpRequest` instances, with a single method `createRequest` that takes a URI and an HTTP method as parameters. It serves as a factory for HTTP requests, allowing for the creation of different types of requests based on the implementation. No explicit design patterns are captured in static analysis."
"spring-framework","AbstractFactory","AutowireCapableBeanFactory.java","The `AutowireCapableBeanFactory` interface, extending `BeanFactory`, defines responsibilities for creating and autowiring beans in the Spring framework. It collaborates with `Class` objects to instantiate beans and supports various autowiring modes. The interface provides methods for bean creation, configuration, and property autowiring, with options for dependency checks. No explicit design patterns are captured in static analysis."
"spring-framework","AbstractFactory","HierarchicalBeanFactory.java","The HierarchicalBeanFactory interface extends BeanFactory, indicating it manages bean factories in a hierarchical structure. It collaborates with a parent BeanFactory, accessed via getParentBeanFactory(), and checks for local beans using containsLocalBean(String name). No explicit design patterns are identified."
"spring-framework","AbstractFactory","ListableBeanFactory.java","The `ListableBeanFactory` interface extends `BeanFactory` and is responsible for providing methods to enumerate beans, check for bean definitions, and retrieve beans by type. It collaborates with `ObjectProvider` for lazy bean retrieval and `ResolvableType` for type resolution. No explicit design patterns are captured in static analysis."
