Project,Folder Name,File Name,Summary
"AbdurRKhalid","AbstractFactory","WindowsOSFactory.java","The `WindowsOSFactory` class, implementing the `GUIFactory` interface, is responsible for creating Windows-specific GUI components. It collaborates with the `Button` and `CheckBox` classes to instantiate these components. This class plays a role in both the Factory Method and Abstract Factory patterns, facilitating the creation of platform-specific objects. Additionally, it is involved in the Memento pattern, suggesting its role in capturing and restoring the state of GUI components."
"AbdurRKhalid","AbstractFactory","WindowsButton.java","The `WindowsButton` class, implementing the `Button` interface, is responsible for rendering a button with a Windows-specific look and feel. It collaborates with the abstract factory pattern to create platform-specific UI components, while also participating in the memento pattern for state management. Its sole method, `paint()`, overrides the interface's method to provide Windows-specific painting behavior."
"AbdurRKhalid","AbstractFactory","Button.java","The `Button` interface, part of the Abstract Factory pattern, defines a contract for painting buttons. It collaborates with factory classes to create platform-specific button instances. The presence of the Memento pattern suggests that `Button` may participate in state-saving and restoration processes, though specific collaborators are not explicitly stated."
"AbdurRKhalid","AbstractFactory","Test.java","The `Test` class serves as an entry point for the application, responsible for initiating the program execution. It collaborates with the `Application` class by invoking its `paint` method. No design patterns are explicitly identified in this class."
"AbdurRKhalid","AbstractFactory","CheckBox.java","The `CheckBox` interface defines a contract for painting a checkbox component. It participates in the Abstract Factory pattern, likely as a product interface, and is also involved in the Memento pattern, suggesting it maintains state that can be saved and restored. Its collaborators are implied by these patterns, with factories producing instances and mementos capturing state."
"AbdurRKhalid","AbstractFactory","MacOSFactory.java","The `MacOSFactory` class, implementing the `GUIFactory` interface, is responsible for creating macOS-specific GUI components, specifically `Button` and `CheckBox` instances. It collaborates with these concrete component classes to fulfill its role in the Abstract Factory pattern, providing a platform-specific factory for GUI elements. Additionally, static analysis suggests involvement in the Memento pattern, though this is not explicitly evident from the provided structural facts."
"AbdurRKhalid","AbstractFactory","MacOSButton.java","The `MacOSButton` class, implementing the `Button` interface, is responsible for rendering buttons specific to macOS. It collaborates with the abstract factory pattern to create platform-specific UI components, adhering to the `paint()` method to define its rendering behavior. Additionally, it participates in the memento pattern, enabling the saving and restoring of its internal state."
"AbdurRKhalid","AbstractFactory","WindowsCheckBox.java","The WindowsCheckBox class, implementing the CheckBox interface, is responsible for rendering a checkbox component specific to the Windows operating system. It collaborates with the Abstract Factory and Factory Method patterns to create platform-specific UI components, while the Memento pattern facilitates state management. Its sole method, paint(), overrides the interface's method to provide Windows-specific rendering."
"AbdurRKhalid","AbstractFactory","Application.java","The `Application` class is responsible for creating and painting GUI components. It collaborates with `Button` and `CheckBox` as private fields and uses `GUIFactory` to instantiate these components. The class is instantiated by `Test.main` and employs the Memento pattern, as indicated by static analysis, suggesting it manages internal state that can be saved and restored."
"AbdurRKhalid","AbstractFactory","MacOSCheckBox.java","The MacOSCheckBox class, implementing the CheckBox interface, is responsible for rendering checkboxes specific to macOS. It collaborates with the abstract factory and factory methods to create platform-specific UI components. Additionally, it participates in the memento pattern, likely for saving and restoring its state."
"AbdurRKhalid","AbstractFactory","GUIFactory.java","The `GUIFactory` interface defines a contract for creating GUI components, specifically `Button` and `CheckBox` objects, adhering to the Abstract Factory pattern. It collaborates with concrete factory implementations to produce these components. The interface also participates in the Factory Method pattern, delegating instantiation to subclasses. Additionally, it is involved in the Memento pattern context, suggesting its role in creating and restoring GUI component states."
"AbdurRKhalid","Adapter","RoundHole.java","The `RoundHole` class represents a round hole with a specified radius, encapsulating the `radius` field. It collaborates with the `RoundPeg` class to determine if a peg fits into the hole using the `fits` method. The class does not explicitly implement any design patterns."
"AbdurRKhalid","Adapter","RoundPeg.java","The `RoundPeg` class represents a round peg with a radius, serving as a concrete component in the Adapter pattern. It provides a constructor to initialize the radius and a method to retrieve it. The class does not collaborate with other classes explicitly but is part of the adapter pattern context, suggesting it may be adapted to fit into a different interface."
"AbdurRKhalid","Adapter","SquarePegAdapter.java","The SquarePegAdapter class acts as an adapter in the Adapter design pattern, converting the interface of a SquarePeg to be compatible with a RoundPeg. It encapsulates a SquarePeg instance and overrides the getRadius method to provide the necessary adaptation. The class extends RoundPeg and collaborates with SquarePeg to facilitate the adaptation process."
"AbdurRKhalid","Adapter","Test.java","The `Test` class serves as the entry point for the AbdurRKhalid_Adapter project, with a single public static `main` method that initiates the program execution. It does not explicitly collaborate with other classes or implement any design patterns, as no such relationships or patterns were captured in static analysis."
"AbdurRKhalid","Adapter","SquarePeg.java","The SquarePeg class represents a square object with a specified width. It provides methods to retrieve the width and calculate the area of the square. In the context of the Adapter pattern, SquarePeg serves as the adaptee, offering functionality that needs to be adapted for use with other components."
"AbdurRKhalid","Decorator","DataSourceDecorator.java","The `DataSourceDecorator` class implements the `DataSource` interface and serves as a base for decorators that modify or extend the behavior of data source objects. It maintains a reference to a `DataSource` object, referred to as the `wrapppee`, which it decorates. The class provides implementations for the `writeData` and `readData` methods, which are expected to be overridden by subclasses to introduce specific modifications. It is used by the `Test` class and follows the Decorator design pattern."
"AbdurRKhalid","Decorator","EncryptionDecorator.java","The `EncryptionDecorator` class extends `DataSourceDecorator` and implements the Decorator pattern to add encryption functionality to a `DataSource`. It collaborates with a `DataSource` instance, which is passed to its constructor. The class overrides `writeData` and `readData` methods to encode and decode data, respectively, utilizing private `encode` and `decode` methods."
"AbdurRKhalid","Decorator","Test.java","The `Test` class serves as the entry point for the application, initiating data operations. It collaborates with `DataSource` and `DataSourceDecorator` to read and write data, demonstrating a decorator pattern where `DataSourceDecorator` extends the functionality of `DataSource`. The class's primary responsibility is to orchestrate these operations through its `main` method."
"AbdurRKhalid","Decorator","CompressionDecorator.java","The CompressionDecorator class extends DataSourceDecorator and implements the Decorator pattern to add compression functionality to a DataSource. It maintains a private compression level field and collaborates with a DataSource instance. The class overrides writeData and readData methods to compress and decompress data, respectively, utilizing private compress and decompress methods."
"AbdurRKhalid","Decorator","FileDataSource.java","The `FileDataSource` class, implementing the `DataSource` interface, is responsible for reading and writing data, with a specific focus on file-based operations. It maintains a `name` field to identify the data source. The class collaborates with the `DataSource` interface, adhering to its contract by overriding the `writeData` and `readData` methods. No explicit design pattern roles are captured in static analysis."
"AbdurRKhalid","Decorator","DataSource.java","The `DataSource` interface defines a contract for data manipulation operations, specifically `writeData` and `readData` methods. It serves as a foundational abstraction for data handling, with its operations invoked by the `Test` class's `main` method. No explicit design patterns are identified in its structure."
"AbdurRKhalid","Facade","Codec.java","The `Codec` interface, part of the AbdurRKhalid_Facade project, defines a contract for encoding and decoding data. It collaborates with classes that implement this interface to provide specific encoding and decoding functionalities. The interface is involved in the Memento pattern, suggesting its role in capturing and restoring the state of an object."
"AbdurRKhalid","Facade","OggCompressionCodec.java","The OggCompressionCodec class implements the Codec interface, indicating its responsibility for encoding and decoding data in the Ogg format, as specified by its public type field. It collaborates with other classes through the Codec interface. Notably, static analysis suggests its involvement in the Memento pattern, implying it may participate in object state saving and restoration."
"AbdurRKhalid","Facade","Test.java","The `Test` class serves as the entry point for a video conversion application, housing the `main` method to initiate the process. It collaborates with the `VideoConversionFacade` class, delegating the video conversion task to it. No explicit design patterns are identified within this class."
"AbdurRKhalid","Facade","VideoConversionFacade.java","The `VideoConversionFacade` class serves as a public interface for video conversion operations, handling the conversion of a video file to a specified format. It collaborates with `CodecFactory` to extract necessary codecs, and with `BitrateReader` to read and convert bitrate information. Additionally, it interacts with `AudioMixer` to fix audio issues. The class does not explicitly implement any design patterns."
"AbdurRKhalid","Facade","VideoFile.java","The VideoFile class encapsulates video file information, storing the file name and codec type as private fields. It provides getter methods to access these fields. The class is instantiated by the CodecFactory class, which uses the VideoFile's getCodecType method to extract the codec type. No design patterns are explicitly implemented in this class."
"AbdurRKhalid","Facade","AudioMixer.java","The AudioMixer class is responsible for processing and fixing audio in a VideoFile. It is invoked by the VideoConversionFacade during video conversion. The class has a single public method, fix, which takes a VideoFile as input and returns a File. No explicit design patterns are identified in this class."
"AbdurRKhalid","Facade","CodecFactory.java","The `CodecFactory` class is responsible for extracting the appropriate codec from a video file. It collaborates with `VideoConversionFacade` and `VideoFile`, utilizing the latter to determine the codec type. This class employs the Memento pattern, facilitating the restoration of the codec state."
"AbdurRKhalid","Facade","MPEG4CompressionCodec.java","The MPEG4CompressionCodec class implements the Codec interface, indicating its responsibility for handling MPEG-4 compression. It collaborates with the Codec interface and utilizes the Memento pattern, suggesting it participates in object state management and restoration. The class has a single public field, type, initialized to ""mp4""."
"AbdurRKhalid","Facade","BitrateReader.java","The BitrateReader class is responsible for reading and converting video files using specified codecs. It provides two static methods: read and convert, which operate on VideoFile objects. This class collaborates with the VideoFile and Codec classes. It is invoked by the VideoConversionFacade for video conversion tasks. No explicit design patterns are identified in this class."
"AbdurRKhalid","FactoryMethod","WindowsButton.java","The WindowsButton class, implementing the Button interface, is responsible for rendering and handling click events specific to a Windows operating system environment. It collaborates with itself to perform these actions. This class is part of the Factory Method pattern, suggesting it is created by a factory method to produce platform-specific button instances. Additionally, it participates in the Memento pattern, indicating it may save and restore its internal state."
"AbdurRKhalid","FactoryMethod","Button.java","The `Button` interface defines a public contract for rendering and click handling, serving as an abstraction for button-like components. It collaborates with concrete implementations to fulfill its responsibilities. Notably, it is involved in the Memento pattern, suggesting its role in capturing and restoring internal states within the system."
"AbdurRKhalid","FactoryMethod","Test.java","The `Test` class serves as an entry point for the application, containing a static `main` method. It holds a private static reference to a `Dialog` object, indicating its responsibility for creating or managing dialog instances. No explicit design patterns are captured in the static analysis."
"AbdurRKhalid","FactoryMethod","Dialog.java","The `Dialog` class is an abstract class that serves as a creator in the Factory Method pattern, responsible for rendering a window and creating buttons. It collaborates with a concrete subclass to implement the abstract `createButton()` method. The `renderWindow()` method uses the Factory Method to create and render buttons. The class also participates in the Memento pattern, suggesting it maintains internal state that can be saved and restored."
"AbdurRKhalid","FactoryMethod","WindowsDialog.java","The WindowsDialog class, a public subclass of Dialog, is responsible for creating and managing Windows-specific dialog buttons. It collaborates with the Button class through the overridden createButton() method. Notably, this class operates within the context of the Memento design pattern, suggesting it participates in the saving and restoring of internal states."
"AbdurRKhalid","FactoryMethod","HtmlDialog.java","The `HtmlDialog` class, extending `Dialog`, is responsible for creating HTML-specific dialog components. It overrides the `createButton` method to produce HTML-compatible buttons, indicating its role in the Factory Method pattern. The class collaborates with the `Button` class for button creation. Notably, static analysis suggests the presence of the Memento pattern within the class's context."
"AbdurRKhalid","FactoryMethod","HtmlButton.java","The `HtmlButton` class, implementing the `Button` interface, is responsible for rendering HTML buttons and handling click events. It collaborates with itself to manage these actions. Within the Factory Method pattern, it serves as a concrete product, created by a creator class. Additionally, it participates in the Memento pattern, suggesting it maintains and restores internal states."
"AbdurRKhalid","Memento","TextEditor.java","The TextEditor class manages text editing operations, collaborating with a TextWindow to display and manipulate text and a savedTextWindowState to store previous states. It provides methods to save the current state and undo the last action, implementing the Memento design pattern for state management."
"AbdurRKhalid","Memento","TextWindow.java","The `TextWindow` class is responsible for managing and manipulating text content, storing it in a `StringBuilder` field. It collaborates with the `TextWindowState` class to save and restore its state, utilizing the Memento design pattern. The class provides methods to add text, save the current state, and restore a previously saved state."
"AbdurRKhalid","Memento","TextWindowState.java","The `TextWindowState` class encapsulates the state of a text window, storing the text content as a private field. It provides a constructor to initialize the text and a getter method to retrieve it. This class serves as a Memento, capturing and externalizing the state of a text window for later restoration, adhering to the Memento design pattern."
"AbdurRKhalid","Observer","EmailNotificationListener.java","The `EmailNotificationListener` class, implementing the `EventListener` interface, serves as an observer in the Observer design pattern. It is responsible for sending email notifications upon receiving updates. The class collaborates with a `File` object and utilizes an email address, provided during instantiation, to notify relevant parties about specific events."
"AbdurRKhalid","Observer","EventManager.java","The EventManager class, implementing the Observer pattern, manages event listeners for various operations. It maintains a map of event types to their respective listeners, utilizing the EventListener interface as a collaborator. The class provides methods to subscribe, unsubscribe, and notify listeners about events, facilitating decoupled communication between objects."
"AbdurRKhalid","Observer","EventListener.java","The `EventListener` interface defines a contract for observers in the Observer pattern, requiring implementing classes to provide an `update` method. This method accepts an event type and a file, enabling dynamic reactions to changes. The interface collaborates with subjects that notify observers of state changes, facilitating decoupled event handling."
"AbdurRKhalid","Observer","Editor.java","The Editor class is responsible for managing file operations, specifically opening and saving files. It collaborates with an EventManager to handle events and maintains a reference to a File object. The class does not explicitly implement any design patterns, but it suggests a potential Observer pattern due to the EventManager field."
"AbdurRKhalid","Observer","LogOpenListener.java","The `LogOpenListener` class, implementing the `EventListener` interface, acts as an observer in the Observer pattern, reacting to file-related events. It maintains a private `File` field to track the log file and collaborates with the `File` class. The class is initialized with a file name and updates its state in response to events, as indicated by the overridden `update` method."
"AbdurRKhalid","Singleton","Test.java","The `Test` class serves as an entry point for the application, containing a single public static `main` method. It is responsible for initiating the program execution, likely invoking other classes or methods within the project. No explicit design patterns are identified, and no collaborators are specified within the provided structural facts."
"AbdurRKhalid","Singleton","Singleton.java","The Singleton class is responsible for managing a single instance of itself, encapsulating a String value. It collaborates with its own instance through a public static field. The class employs a private constructor to prevent external instantiation, enforcing the Singleton design pattern. The static getInstance method provides controlled access to the instance, accepting a String value to initialize or update the instance's value."
"AbdurRKhalid","Visitor","ComputerPart.java","The `ComputerPart` interface defines the responsibility of accepting a `ComputerPartVisitor` through its `accept` method, facilitating the Visitor design pattern. It serves as a base for components in a computer system, allowing operations to be performed on these components without altering their classes. The interface is utilized by the `Test` class and the `Computer` class, demonstrating its role in enabling type-safe visit operations."
"AbdurRKhalid","Visitor","Monitor.java","The Monitor class, a public subclass of ComputerPart, implements the Visitor pattern by accepting a ComputerPartVisitor to handle operations. It overrides the accept method to facilitate visitor access, collaborating with ComputerPartVisitor through the visit method. This design enables dynamic operation execution on Monitor objects without modifying their class."
"AbdurRKhalid","Visitor","Mouse.java","The `Mouse` class, a public subclass of `ComputerPart`, implements the Visitor pattern by defining an `accept` method that takes a `ComputerPartVisitor` as an argument. Its primary responsibility is to facilitate the visitor's interaction by delegating to the `visit` method of the provided `ComputerPartVisitor`, enabling external operations on the `Mouse` object."
"AbdurRKhalid","Visitor","ComputerPartDisplayVisitor.java","The `ComputerPartDisplayVisitor` class, extending and implementing `ComputerPartVisitor`, is responsible for visiting and displaying various computer parts. It collaborates with `Computer`, `Mouse`, `Keyboard`, and `Monitor` classes, overriding their respective visit methods. This class plays the role of a concrete visitor in the Visitor design pattern, facilitating operations on elements without changing their classes."
"AbdurRKhalid","Visitor","Test.java","The `Test` class serves as the entry point for the AbdurRKhalid_Visitor project, with its sole responsibility being to initiate the program execution. It interacts with the `ComputerPart` class by invoking the `accept` method, suggesting a visitor pattern implementation, although no explicit design pattern roles are captured in static analysis."
"AbdurRKhalid","Visitor","Keyboard.java","The `Keyboard` class, a public subclass of `ComputerPart`, implements the Visitor design pattern. It primarily accepts visitors, delegating operations to them via the `accept` method, which calls `ComputerPartVisitor.visit`. This enables the visitor to perform operations on the `Keyboard` instance, adhering to the Visitor pattern's structure."
"AbdurRKhalid","Visitor","Computer.java","The `Computer` class, extending and implementing `ComputerPart`, represents a component in a hierarchical structure. It maintains a collection of `ComputerPart` objects and facilitates visitor operations through the `accept` method, adhering to the Visitor design pattern. The class collaborates with `ComputerPartVisitor` to enable operations on its parts, delegating visits to each component."
"AbdurRKhalid","Visitor","ComputerPartVisitor.java","The `ComputerPartVisitor` interface defines a visitor pattern, accepting visits from various computer parts. It declares methods to visit `Computer`, `Mouse`, `Keyboard`, and `Monitor` objects, facilitating operations on these elements without modifying their classes. Collaborators include `Mouse`, `Monitor`, `Computer`, and `Keyboard`, which call the visitor's methods via their `accept` methods."
"JamesZBL","abstract-factory","YoungSailor.java","The `YoungSailor` class, implementing the `Sailor` interface, represents a young sailor with a static description. It collaborates within a system utilizing the Factory Method, Abstract Factory, Observer, and Memento patterns, suggesting it is created and managed by factories, observed for state changes, and supports state saving/restoration."
"JamesZBL","abstract-factory","OldShip.java","The OldShip class, implementing the Ship interface, is responsible for providing a description of an old ship. It collaborates with the abstract factory, observer, and memento patterns, suggesting it is part of a system where ships are created and managed through these patterns. The class's sole method, getDescription(), returns a static final string, indicating its primary role in providing descriptive information."
"JamesZBL","abstract-factory","YoungTeamFactory.java","The YoungTeamFactory class, implementing the TeamFactory interface, is responsible for creating objects related to a young team, adhering to the Abstract Factory pattern. It collaborates with Ship, Captain, and Sailor classes to instantiate their respective objects, utilizing the Factory Method pattern for object creation. Additionally, it participates in the Memento pattern, suggesting it may save and restore internal states."
"JamesZBL","abstract-factory","YoungCaptain.java","The YoungCaptain class, implementing the Captain interface, is responsible for providing a description of a young captain. It collaborates within an abstract factory pattern context, suggesting it is created by a factory method. The class also participates in observer and memento patterns, indicating it may be observed for state changes and support state saving/restoration. Its sole field, DESCRIPTION, is a static final string."
"JamesZBL","abstract-factory","Captain.java","The `Captain` interface, extending `Member`, defines the role of a captain within the system. It participates in the abstract factory, observer, and memento patterns, suggesting it collaborates with factories for creation, observers for state changes, and mementos for state management. Its responsibilities likely include coordinating team activities and maintaining state consistency."
