Project,Folder Name,File Name,Summary
"AbdurRKhalid","AbstractFactory","WindowsOSFactory.java","The WindowsOSFactory class, implementing the GUIFactory interface, is responsible for creating Windows-specific GUI components. It collaborates with Button and CheckBox classes to instantiate platform-specific versions. This class plays the ConcreteFactory role in the Abstract Factory design pattern."
"AbdurRKhalid","AbstractFactory","WindowsButton.java","The `WindowsButton` class, implementing the `Button` interface, is responsible for rendering a button specific to the Windows operating system. It collaborates with the `Button` interface to override the `paint()` method. This class participates in the Abstract Factory pattern, providing Windows-specific UI components."
"AbdurRKhalid","AbstractFactory","Button.java","The `Button` interface defines a contract for painting a button, adhering to the Abstract Factory pattern. It serves as an abstract product, collaborating with concrete factory implementations to create platform-specific button instances, ensuring consistent button rendering across different operating systems."
"AbdurRKhalid","AbstractFactory","Test.java","The `Test` class serves as the entry point for the application, initiating the process by calling the `paint` method of the `Application` class. It acts as a simple test harness, with no explicit design pattern roles captured in static analysis. Its primary responsibility is to trigger the application's painting process."
"AbdurRKhalid","AbstractFactory","CheckBox.java","The `CheckBox` interface defines a contract for painting a checkbox component. It participates in the Abstract Factory pattern, suggesting it is one of the products created by concrete factories within the design pattern's structure. The interface's `paint()` method outlines the responsibility for rendering the checkbox."
"AbdurRKhalid","AbstractFactory","MacOSFactory.java","The `MacOSFactory` class, implementing the `GUIFactory` interface, is responsible for creating macOS-specific GUI components. It collaborates with the `Button` and `CheckBox` classes to instantiate macOS-style versions of these components. This class plays the role of a concrete factory in the Abstract Factory design pattern."
"AbdurRKhalid","AbstractFactory","MacOSButton.java","The `MacOSButton` class, implementing the `Button` interface, is responsible for rendering buttons specific to macOS. It collaborates with the abstract factory pattern, providing platform-specific button implementations. Its sole method, `paint()`, overrides the interface's method to ensure proper button rendering."
"AbdurRKhalid","AbstractFactory","WindowsCheckBox.java","The `WindowsCheckBox` class, implementing the `CheckBox` interface, is responsible for rendering a checkbox in a Windows-specific style. It collaborates with the abstract factory pattern, providing platform-specific implementations for UI components. Its sole method, `paint()`, overrides the interface's method to achieve this."
"AbdurRKhalid","AbstractFactory","Application.java","The `Application` class is responsible for creating and managing GUI components. It collaborates with `GUIFactory` to create instances of `Button` and `CheckBox`, which it stores as private fields. The class is instantiated and used by the `Test` class's `main` method. No explicit design pattern roles are captured in static analysis."
"AbdurRKhalid","AbstractFactory","MacOSCheckBox.java","The `MacOSCheckBox` class, implementing the `CheckBox` interface, is responsible for rendering checkboxes in a macOS-specific manner. It collaborates with the abstract factory pattern, providing platform-specific UI components, and overrides the `paint` method to ensure consistent visual representation."
"AbdurRKhalid","AbstractFactory","GUIFactory.java","The `GUIFactory` interface defines a contract for creating GUI components, specifically `Button` and `CheckBox` objects. It serves as an abstract factory in the Abstract Factory design pattern, delegating the instantiation of concrete GUI components to implementing classes. Collaborators include the `Button` and `CheckBox` interfaces."
"AbdurRKhalid","Adapter","RoundHole.java","The RoundHole class represents a hole with a specific radius, encapsulating the radius as a private field. It collaborates with the RoundPeg class to determine if a peg fits into the hole through the fits method. The class does not exhibit any explicit design pattern roles."
"AbdurRKhalid","Adapter","RoundPeg.java","The `RoundPeg` class represents a peg with a radius, encapsulating its size. It collaborates with the adapter pattern, providing a simple interface with a radius attribute and accessor method. Its primary responsibility is to model a round peg, facilitating adaptation to other shapes."
"AbdurRKhalid","Adapter","SquarePegAdapter.java","The SquarePegAdapter class adapts a SquarePeg to be used as a RoundPeg by implementing the Adapter pattern. It collaborates with SquarePeg and extends RoundPeg, providing a getRadius() method to translate the square peg's width into a compatible radius."
"AbdurRKhalid","Adapter","Test.java","The `Test` class serves as the entry point for the AbdurRKhalid_Adapter project, with a single public static `main` method. It lacks explicit collaborators and design pattern roles, focusing solely on initiating the program execution."
"AbdurRKhalid","Adapter","SquarePeg.java","The SquarePeg class represents a square object with a specified width. It provides methods to retrieve the width and calculate the area of the square. It collaborates with the Adapter pattern, suggesting it may need to interface with incompatible systems."
"AbdurRKhalid","Decorator","DataSourceDecorator.java","The `DataSourceDecorator` class implements the `DataSource` interface, serving as a decorator in the Decorator design pattern. It wraps a `DataSource` object, modifying or enhancing its behavior. The class overrides `writeData` and `readData` methods, delegating operations to the wrapped `DataSource`. It is instantiated and used within the `Test` class's `main` method."
"AbdurRKhalid","Decorator","EncryptionDecorator.java","The EncryptionDecorator class extends DataSourceDecorator and implements the Decorator pattern to add encryption functionality. It collaborates with a DataSource object, received in its constructor, and overrides writeData and readData methods to encode and decode data respectively, utilizing private encode and decode methods."
"AbdurRKhalid","Decorator","Test.java","The `Test` class serves as the entry point for the application, executing the main method to initiate data operations. It collaborates with `DataSource` and `DataSourceDecorator` to read and write data, demonstrating a decorator pattern for extending functionality. No explicit design-pattern roles are captured in static analysis."
"AbdurRKhalid","Decorator","CompressionDecorator.java","The CompressionDecorator class extends DataSourceDecorator and implements the Decorator pattern to add compression functionality to data sources. It collaborates with a DataSource object and manages a compression level field. It overrides writeData and readData methods, utilizing private compress and decompress methods for data manipulation."
"AbdurRKhalid","Decorator","FileDataSource.java","The `FileDataSource` class, implementing the `DataSource` interface, is responsible for reading and writing data to a file. It collaborates with a `String` field to store the file name. The class does not exhibit any explicit design pattern roles."
"AbdurRKhalid","Decorator","DataSource.java","The `DataSource` interface defines a contract for data operations, requiring implementations to provide methods for writing and reading data. It is utilized by the `Test` class's main method, serving as a foundational component for data handling without explicit design pattern roles."
"AbdurRKhalid","Facade","Codec.java","The `Codec` interface defines a public contract for encoding and decoding operations. It specifies methods for converting data into a specific format and vice versa. No explicit design patterns or collaborators are identified within the static analysis."
"AbdurRKhalid","Facade","OggCompressionCodec.java","The OggCompressionCodec class implements the Codec interface, providing Ogg compression functionality. It declares a public field, type, initialized to ""ogg"". The class does not exhibit any explicit design pattern roles. Its primary responsibility is to encode and decode data using the Ogg format."
"AbdurRKhalid","Facade","Test.java","The `Test` class serves as an entry point for the application, initiating video conversion processes. It collaborates with the `VideoConversionFacade` class, delegating the video conversion task to it. No explicit design patterns are identified in this class."
"AbdurRKhalid","Facade","VideoConversionFacade.java","The VideoConversionFacade class serves as a public interface for video conversion, handling the process through its convertVideo method. It collaborates with CodecFactory for extraction, BitrateReader for reading and conversion, and AudioMixer for audio fixing. No explicit design patterns are identified."
"AbdurRKhalid","Facade","VideoFile.java","The VideoFile class encapsulates video file information, storing the file name and codec type. It provides access to these attributes through getter methods. The class is utilized by the CodecFactory for extracting codec information, but no explicit design patterns are identified."
"AbdurRKhalid","Facade","AudioMixer.java","The AudioMixer class is responsible for processing and fixing audio in a VideoFile. It is invoked by the VideoConversionFacade during video conversion. No explicit design patterns are identified."
"AbdurRKhalid","Facade","CodecFactory.java","The `CodecFactory` class is responsible for extracting the appropriate codec from a given `VideoFile`. It collaborates with the `VideoFile` class to retrieve the codec type. The class is invoked by the `VideoConversionFacade` during video conversion processes. No explicit design pattern roles are identified."
"AbdurRKhalid","Facade","MPEG4CompressionCodec.java","The MPEG4CompressionCodec class implements the Codec interface, indicating its responsibility for handling MPEG-4 compression. It declares a public field, type, initialized to ""mp4"". No design patterns are explicitly identified. The class collaborates with any entity that interacts with it through the Codec interface."
"AbdurRKhalid","Facade","BitrateReader.java","The BitrateReader class is responsible for reading and converting video files using specified codecs. It collaborates with the VideoFile and Codec classes to perform these operations. The class is invoked by the VideoConversionFacade for video conversion tasks, with no explicit design pattern roles identified."
"AbdurRKhalid","FactoryMethod","WindowsButton.java","The `WindowsButton` class implements the `Button` interface, responsible for rendering and handling click events specific to Windows OS. It collaborates with itself for click handling. This class is part of the Factory Method pattern, suggesting it's created by a corresponding factory."
"AbdurRKhalid","FactoryMethod","Button.java","The `Button` interface defines a contract for button-like components, specifying responsibilities for rendering and handling click events. It does not collaborate with other classes or participate in explicit design patterns, serving as a basic abstraction for button functionality."
"AbdurRKhalid","FactoryMethod","Test.java","The `Test` class serves as an entry point for the application, containing a static `main` method. It utilizes a private static `Dialog` field, indicating its responsibility to create and manage a dialog instance. No explicit design pattern roles are captured in static analysis."
"AbdurRKhalid","FactoryMethod","Dialog.java","The `Dialog` class is an abstract class that serves as a creator in the Factory Method design pattern. It is responsible for rendering a window and delegating the creation of `Button` objects to its subclasses through the abstract `createButton()` method, demonstrating its role as a factory method."
"AbdurRKhalid","FactoryMethod","WindowsDialog.java","The `WindowsDialog` class, a public subclass of `Dialog`, is responsible for creating Windows-specific buttons. It collaborates with the `Button` class and implements the factory method pattern by overriding the `createButton()` method to produce platform-specific button instances."
"AbdurRKhalid","FactoryMethod","HtmlDialog.java","The `HtmlDialog` class, extending `Dialog`, is responsible for creating HTML-specific buttons. It collaborates with the `Button` class and implements the factory method pattern by overriding the `createButton()` method to produce HTML-compatible buttons."
"AbdurRKhalid","FactoryMethod","HtmlButton.java","The `HtmlButton` class, implementing the `Button` interface, is responsible for rendering and handling click events for HTML buttons. It collaborates with itself to manage these operations. This class is part of the Factory Method pattern, indicating its role in creating button instances."
"AbdurRKhalid","Memento","TextEditor.java","The TextEditor class manages text editing operations, collaborating with a TextWindow to display and manipulate text and a savedTextWindowState to store previous states. It provides methods to save and undo text changes, implementing a basic undo functionality without explicit design pattern roles."
"AbdurRKhalid","Memento","TextWindow.java","The `TextWindow` class manages a string of text, represented by a `StringBuilder` field. It provides methods to add text, save the current state as a `TextWindowState`, and restore a previously saved state. It collaborates with the `TextWindowState` class for state management, but no explicit design pattern is identified."
"AbdurRKhalid","Memento","TextWindowState.java","The `TextWindowState` class encapsulates the state of a text window, storing the text content as a private field. It provides a constructor to initialize the text and a getter method to retrieve it. This class serves as a Memento, capturing and externalizing the internal state of an originator."
"AbdurRKhalid","Observer","EmailNotificationListener.java","The `EmailNotificationListener` class, implementing `EventListener`, acts as an observer in the Observer pattern, receiving updates about file events. It maintains an email address for notifications and collaborates with a subject to receive updates, invoking the `update` method with event details."
"AbdurRKhalid","Observer","EventManager.java","The EventManager class, implementing the Observer pattern, manages event listeners for various operations. It maintains a map of event types to their respective listeners, allowing subscription and unsubscription of EventListener instances. Upon notification, it triggers the appropriate listeners for a given event type and file."
"AbdurRKhalid","Observer","EventListener.java","The `EventListener` interface defines a contract for observers in the Observer pattern, requiring implementing classes to handle updates via the `update` method. It collaborates with subjects that notify listeners of events involving a `String` event type and a `File`."
"AbdurRKhalid","Observer","Editor.java","The `Editor` class is responsible for managing file operations, specifically opening and saving files. It collaborates with an `EventManager` to handle events and maintains a reference to a `File`. No explicit design patterns are identified within this class."
"AbdurRKhalid","Observer","LogOpenListener.java","The `LogOpenListener` class, implementing the `EventListener` interface, acts as an observer in the Observer pattern. It is responsible for logging file events, utilizing a private `File` field to manage the log. The class collaborates with `File` objects, updating its state via the `update` method when notified of events."
"AbdurRKhalid","Singleton","Test.java","The `Test` class serves as an entry point for the application, containing a single `main` method. It lacks explicit collaborators and does not participate in any discernible design patterns, focusing solely on initiating the program execution."
"AbdurRKhalid","Singleton","Singleton.java","The Singleton class is responsible for managing a single instance of itself, with a configurable string value. It collaborates with its own static instance field. The class employs the Singleton design pattern, ensuring only one instance exists, accessed via the getInstance method."
"AbdurRKhalid","Visitor","ComputerPart.java","The `ComputerPart` interface defines an acceptance method for a visitor, adhering to the Visitor design pattern. It serves as a base for components in a computer system, allowing them to accept a `ComputerPartVisitor` for operation execution. Collaborators include the `Test` class and `Computer`, which invoke its `accept` method."
"AbdurRKhalid","Visitor","Monitor.java","The Monitor class, extending ComputerPart and implementing ComputerPart, accepts a ComputerPartVisitor via the accept method, facilitating the Visitor pattern. It collaborates with ComputerPartVisitor, specifically invoking its visit method, to enable operation acceptance and execution."
"AbdurRKhalid","Visitor","Mouse.java","The `Mouse` class, extending `ComputerPart`, implements the Visitor pattern by accepting a `ComputerPartVisitor` to perform operations. It collaborates with `ComputerPartVisitor` by delegating the visit operation, adhering to the Visitor pattern's structure for separating algorithms from object structures."
"AbdurRKhalid","Visitor","ComputerPartDisplayVisitor.java","The `ComputerPartDisplayVisitor` class, implementing the Visitor pattern, extends `ComputerPartVisitor` to display computer parts. It overrides methods to visit `Computer`, `Mouse`, `Keyboard`, and `Monitor` objects, indicating its responsibility for displaying these components."
"AbdurRKhalid","Visitor","Test.java","The `Test` class serves as the entry point for the application, initiating the visitor pattern implementation. It invokes the `accept` method on `ComputerPart`, facilitating the traversal and operation on computer part components, without explicitly implementing any design pattern roles."
"AbdurRKhalid","Visitor","Keyboard.java","The `Keyboard` class, extending `ComputerPart`, implements the Visitor Pattern by accepting a `ComputerPartVisitor` to perform operations. It collaborates with `ComputerPartVisitor` by calling its `visit` method, facilitating operation execution on the `Keyboard` instance."
"AbdurRKhalid","Visitor","Computer.java","The `Computer` class, extending and implementing `ComputerPart`, embodies the Visitor Pattern's Element role. It maintains a `ComputerPart` field and defines an `accept` method, facilitating visitor operations. Collaborating with `ComputerPartVisitor`, it enables external operations on its structure."
"AbdurRKhalid","Visitor","ComputerPartVisitor.java","The `ComputerPartVisitor` interface defines the Visitor pattern's visitor role, declaring methods to visit various computer parts. It collaborates with `Computer`, `Mouse`, `Keyboard`, and `Monitor` classes, which call its `visit` methods. This interface enables operations on computer parts without changing their classes."
"JamesZBL","abstract-factory","YoungSailor.java","The `YoungSailor` class, implementing the `Sailor` interface, represents a young sailor with a static description. It participates in the abstract factory and observer patterns, suggesting it is created by a factory and may notify or be notified by other objects."
"JamesZBL","abstract-factory","OldShip.java","The `OldShip` class, implementing the `Ship` interface, represents a ship with a specific description. It collaborates within an abstract factory pattern, producing ships, and may participate in an observer pattern, notifying or being notified of state changes. Its sole responsibility is to provide the description of an old ship."
"JamesZBL","abstract-factory","YoungTeamFactory.java","The `YoungTeamFactory` class, implementing the `TeamFactory` interface, is responsible for creating specific team components: `Ship`, `Captain`, and `Sailor`. It collaborates with these classes to instantiate concrete implementations, adhering to the Abstract Factory pattern for object creation."
"JamesZBL","abstract-factory","YoungCaptain.java","The `YoungCaptain` class, implementing the `Captain` interface, provides a specific captain type with a static description. It participates in the abstract factory pattern, likely creating related objects, and the observer pattern, suggesting it may notify or be notified of events."
"JamesZBL","abstract-factory","Captain.java","The `Captain` interface, extending `Member`, defines the role of a captain within the system. It participates in the abstract factory pattern, suggesting it is created by a factory, and the observer pattern, indicating it may be observed or observable. Collaborators are implied by these patterns."
"JamesZBL","abstract-factory","OldSailor.java","The OldSailor class, implementing the Sailor interface, represents an old sailor with a static description. It collaborates within an abstract factory and observer pattern context, providing a description via the getDescription() method. Its primary responsibility is to encapsulate and provide the specific description of an old sailor."
"JamesZBL","abstract-factory","NewShip.java","The `NewShip` class, implementing the `Ship` interface, represents a new ship with a static description. It collaborates within an abstract factory pattern, producing new ships, and may participate in an observer pattern, notifying observers of state changes."
"JamesZBL","abstract-factory","PermanentTeamFactory.java","The `PermanentTeamFactory` class, implementing the `TeamFactory` interface, is responsible for creating permanent team members, including ships, captains, and sailors. It collaborates with these three types to instantiate concrete implementations. This class plays the role of a concrete factory in the abstract factory design pattern."
"JamesZBL","abstract-factory","OldCaptain.java","The OldCaptain class, implementing the Captain interface, represents an old captain with a static description. It collaborates within an abstract factory and observer pattern context, providing a getDescription method to retrieve its static description string."
"JamesZBL","abstract-factory","Ship.java","The `Ship` interface, extending `Member`, serves as an abstract blueprint for ship entities within the system. It participates in the abstract factory pattern, enabling the creation of various ship types. Additionally, it engages in the observer pattern, suggesting it maintains state that other objects may monitor."
"JamesZBL","abstract-factory","TeamFactory.java","The `TeamFactory` interface defines a contract for creating teams of ships, captains, and sailors, adhering to the Abstract Factory design pattern. It declares methods for creating each team member, collaborating with the `Ship`, `Captain`, and `Sailor` classes. This interface enables the creation of family of related objects without specifying their concrete classes."
"JamesZBL","abstract-factory","Application.java","The `Application` class is responsible for managing a team comprising a ship, captain, and sailor. It collaborates with `TeamFactory` to create the team and maintains references to `Ship`, `Captain`, and `Sailor` objects. The class exhibits the Observer pattern, suggesting it monitors or reacts to changes in its collaborators."
"JamesZBL","abstract-factory","Member.java","The `Member` interface defines a contract for objects that can provide a description through the `getDescription()` method. It serves as an abstract blueprint for member entities, with no explicit collaborators or design pattern roles captured in static analysis."
"JamesZBL","abstract-factory","Sailor.java","The `Sailor` interface, extending `Member`, defines the abstract structure for sailor entities within the abstract factory and observer patterns. It collaborates with factory classes to create instances and notifies observers of state changes, adhering to the abstract factory and observer design patterns."
"JamesZBL","adapter","Bus.java","The Bus class, part of the JamesZBL_adapter project, is responsible for executing a run operation. It utilizes a private static final Logger instance for logging purposes, collaborating with the LoggerFactory to obtain this logger. No explicit design pattern roles are identified for this class."
"JamesZBL","adapter","Car.java","The `Car` interface defines a contract for driving functionality. It serves as a component in the Decorator pattern, allowing for the dynamic addition of responsibilities to objects implementing this interface. Collaborators include concrete car implementations and potential decorators that extend or alter driving behavior."
"JamesZBL","adapter","Driver.java","The `Driver` class, implementing the `Car` interface, is responsible for driving a car. It collaborates with a `Car` instance, which is set via its constructor. The class participates in the Decorator pattern, allowing for dynamic addition of responsibilities to the `Car` interface."
"JamesZBL","adapter","Application.java","The `Application` class serves as the entry point for the JamesZBL_adapter project, with the sole responsibility of initiating the program execution. It contains a public static `main` method, which is the starting point for the Java application, but does not explicitly collaborate with other classes or employ any discernible design patterns."
