Project,Folder Name,File Name,Summary
"JamesZBL","adapter","BusAdapter.java","The BusAdapter class implements the Car interface and acts as a decorator, adapting a Bus instance to conform to the Car interface. It encapsulates a Bus object and overrides the drive method to provide bus-specific driving behavior."
"JamesZBL","decorator","HammerSmithOperation.java","The `HammerSmithOperation` class, implementing the `Operation` interface, acts as a decorator in the Decorator pattern, enhancing the behavior of other `Operation` objects. It collaborates with a `previousOperation` to extend its functionality, utilizing a static `Logger` for logging purposes."
"JamesZBL","decorator","Operation.java","The `Operation` interface defines a contract for operations with pre- and post-check methods, `checkBefore` and `checkAfter`, and a `join` method. It serves as a component in the Decorator pattern, allowing dynamic behavior augmentation through decorators that implement this interface."
"JamesZBL","decorator","Application.java","The `Application` class serves as the entry point for the JamesZBL_decorator project, responsible for initiating the program execution. It utilizes the `Logger` interface from the `LoggerFactory` for logging purposes, indicating its role in managing application-level logging. No explicit design patterns are identified within this class."
"JamesZBL","decorator","CarpenterOperation.java","The `CarpenterOperation` class, implementing the `Operation` interface, serves as a concrete component in the decorator pattern, providing core functionality for carpentry operations. It collaborates with a static `Logger` for logging purposes and overrides methods to define pre- and post-operation checks and the main operation itself."
"JamesZBL","facade","CourseFacade.java","The `CourseFacade` class serves as an intermediary for managing course participants, encapsulating interactions with a list of `CourseParticipator` objects. It provides methods to prepare, proceed, and stop course-related activities, acting as a simplified interface for course management. No explicit design patterns are identified."
"JamesZBL","facade","CourseParticipator.java","The `CourseParticipator` class is an abstract public class responsible for managing course-related actions such as preparing, proceeding, and stopping a course, as well as handling school and home commutes. It collaborates with itself for various actions and uses a static `Logger` for logging. No explicit design patterns are identified."
"JamesZBL","facade","CourseStudent.java","The `CourseStudent` class, a public subclass of `CourseParticipator`, is responsible for representing a student in a course. It overrides the `name()` method to provide student-specific naming functionality. It collaborates with its parent class to inherit and extend course participant behavior. No design patterns are explicitly captured in static analysis."
"JamesZBL","facade","Application.java","The `Application` class serves as the entry point for the JamesZBL_facade project, with its sole responsibility being to initiate the program execution. It contains a single public static `main` method, which accepts a string array of command-line arguments. No design patterns or collaborators are explicitly identified within this class."
"JamesZBL","facade","CourseTeacher.java","The CourseTeacher class, a public subclass of CourseParticipator, is responsible for providing the name of a course teacher. It overrides the name() method from its superclass. No design patterns or additional collaborators are explicitly identified."
"JamesZBL","factory-method","ChineseCook.java","The `ChineseCook` class, implementing the `Cook` interface, is responsible for creating specific types of food. It collaborates with the `Food` class and utilizes the factory method pattern to produce food based on the given `FoodType`. Additionally, it participates in the abstract factory pattern for broader food creation contexts."
"JamesZBL","factory-method","FoodType.java","The `FoodType` class encapsulates a food type's name, serving as a simple data holder. It has a single private field, `name`, and provides a constructor and getter method for accessing this value. The class has no explicit collaborators or design pattern roles."
"JamesZBL","factory-method","WesternFood.java","The WesternFood class, implementing the Food interface, represents a type of Western cuisine. It collaborates with the FoodType class to define its specific food type. It participates in both the Factory Method and Abstract Factory patterns, suggesting it is created by a factory method and can be part of a family of related products."
"JamesZBL","factory-method","Cook.java","The `Cook` interface defines a contract for cooking food, with the `cookFood` method taking a `FoodType` parameter. It participates in both the Factory Method and Abstract Factory patterns, suggesting it collaborates with concrete implementations to create and return specific `Food` objects."
"JamesZBL","factory-method","ChineseFood.java","The `ChineseFood` class implements the `Food` interface, representing Chinese cuisine with a specific `FoodType`. It collaborates with `FoodType` to define the type of food. This class participates in both the Factory Method and Abstract Factory patterns, facilitating the creation of Chinese food objects."
"JamesZBL","factory-method","Application.java","The `Application` class is responsible for initiating the food-making process. It collaborates with a `Cook` instance to perform this task and uses a `Logger` for logging purposes. The class does not explicitly implement any design patterns, and its main method serves as the entry point for the application."
"JamesZBL","factory-method","WesternCook.java","The WesternCook class, implementing the Cook interface, is responsible for creating and returning food based on the specified FoodType. It collaborates with the Food class and participates in the factory method and abstract factory patterns, suggesting its role in creating objects without specifying the exact class."
"JamesZBL","factory-method","Food.java","The `Food` interface defines a contract for objects representing food items, with a single method `getFoodType()` to retrieve the food type. It serves as an abstract product in the Abstract Factory pattern, collaborating with factory classes to create and provide specific food instances."
"JamesZBL","memento","Flower.java","The Flower class, extending Plant, represents a flower with attributes like type, name, height, and weight. It collaborates with FlowerMemento for state management and adheres to the Observer pattern, suggesting it notifies observers of state changes. It also participates in the Abstract Factory pattern, indicating it's created by a factory method."
"JamesZBL","memento","Plant.java","The `Plant` interface defines a contract for plant objects, specifying methods to retrieve weight, height, and type. It serves as an abstract factory pattern participant, likely collaborating with concrete plant implementations to create and manage plant instances."
"JamesZBL","memento","FlowerType.java","The `FlowerType` class encapsulates the name of a flower type. It collaborates with the observer pattern, suggesting it may be observed for changes in its state. The class provides a constructor to initialize the name and overrides `toString()` for string representation."
"JamesZBL","memento","Application.java","The `Application` class serves as the entry point for the JamesZBL_memento project, housing the `main` method to initiate the program. It utilizes the `Logger` interface from the `LoggerFactory` for logging purposes, indicating its role in managing application startup and logging. No explicit design patterns are identified."
"JamesZBL","observer","Northern.java","The Northern class, implementing the TimeObserver interface, acts as an observer in the Observer pattern. It utilizes a static Logger for logging and updates its state based on time changes received via the update method, collaborating with a TimePoint object."
"JamesZBL","observer","TimePoint.java","The `TimePoint` class encapsulates a time-related entity with a name, serving as a simple data holder. It collaborates with no other classes explicitly. The class overrides the `toString()` method for string representation. No design pattern roles are captured in static analysis."
"JamesZBL","observer","Time.java","The `Time` class, adhering to the Observer pattern, maintains a `TimePoint` and a list of `TimeObserver` objects. It manages the addition and removal of observers, notifying them upon time passage. The class collaborates with `TimeObserver` and utilizes a `Logger` for logging."
"JamesZBL","observer","Southern.java","The `Southern` class, implementing the `TimeObserver` interface, acts as an observer in the Observer pattern, reacting to time updates. It collaborates with a `Logger` for logging purposes and overrides the `update` method to process `TimePoint` updates, reflecting its role as a time-dependent observer."
"JamesZBL","observer","Application.java","The Application class serves as the entry point for the JamesZBL_observer project. It is responsible for initiating the program execution through its main method. This class does not exhibit any explicit design pattern roles or collaborate with other classes based on the provided structural facts."
"JamesZBL","observer","TimeObserver.java","The `TimeObserver` interface defines a contract for observing time updates, implementing the Observer pattern. It declares a single `update(TimePoint time)` method, indicating its responsibility to react to time changes. Collaborators must implement this interface to observe `TimePoint` objects."
"JamesZBL","singleton","ThreadSafeDoubleCheckLocking.java","The `ThreadSafeDoubleCheckLocking` class implements the Singleton pattern, ensuring a single instance is created and shared. It uses a private constructor and a static volatile field `INSTANCE` to maintain the single instance, accessed via the `getInstance()` method."
"JamesZBL","singleton","EnumDirector.java","The `EnumDirector` class is a public class with a single overridden method, `toString()`. It appears to be responsible for providing a string representation of an enum. No explicit design patterns or collaborators are identified in the static analysis."
"JamesZBL","singleton","LazyInitializationDirector.java","The `LazyInitializationDirector` class is a public final singleton that manages its sole instance through lazy initialization. It collaborates with itself via a private static final field and provides global access to its instance through a static `getInstance()` method. The class adheres to the singleton pattern."
"JamesZBL","singleton","Director.java","The `Director` class is a public final class that implements the Singleton design pattern, ensuring only one instance exists. It has a private static final field `INSTANCE` initialized with a new `Director` instance. The private constructor prevents external instantiation, and the public static `getInstance()` method provides global access to the single instance."
"JamesZBL","singleton","ThreadSafeLazyLoadDirector.java","The `ThreadSafeLazyLoadDirector` class implements the Singleton pattern, ensuring only one instance exists throughout the application's lifecycle. It uses lazy initialization with thread safety, employing a private constructor and a synchronized static method `getInstance()` to control instance access. The class collaborates with itself via a static volatile field `INSTANCE`."
"JamesZBL","singleton","Application.java","The `Application` class serves as the entry point for the JamesZBL_singleton project, housing the main method to initiate program execution. It collaborates with a `Logger` instance for logging purposes, obtained through the `LoggerFactory`. No design patterns are explicitly identified within this class."
"JamesZBL","visitor","Boss.java","The Boss class, a public subclass of Unit, represents a unit that can manage other units. It initializes with a variable number of child units and provides methods for visitation and string representation. It collaborates with UnitVisitor for visitation and overrides methods from its parent class."
"JamesZBL","visitor","Engineer.java","The Engineer class, a public subclass of Unit, is responsible for managing a collection of Unit objects, accepting visitors, and providing string representation. It collaborates with Unit and UnitVisitor, implementing the Visitor pattern to allow operations on Unit objects."
"JamesZBL","visitor","ManagerVisitor.java","The `ManagerVisitor` class, implementing the `UnitVisitor` interface, is responsible for visiting and performing operations on `Engineer`, `Boss`, and `Manager` objects. It utilizes a static `Logger` for logging purposes. This class adheres to the Visitor design pattern, allowing it to apply operations to elements in an object structure."
"JamesZBL","visitor","UnitVisitor.java","The UnitVisitor interface defines a visitor pattern for traversing a hierarchy of unit types, including Engineer, Boss, and Manager. It declares visit methods for each unit type, enabling operations to be performed on these units without modifying their classes."
"JamesZBL","visitor","BossVisitor.java","The BossVisitor class, implementing the UnitVisitor interface, is responsible for visiting and performing operations on Engineer, Boss, and Manager units. It utilizes a static Logger for logging purposes and overrides three visit methods to handle each unit type. No explicit design patterns are identified."
"JamesZBL","visitor","EngineerVisitor.java","The EngineerVisitor class, implementing the UnitVisitor interface, is responsible for visiting and processing Engineer, Boss, and Manager units. It utilizes a static Logger for logging purposes. The class adheres to the Visitor design pattern, enabling it to perform operations on these units."
"JamesZBL","visitor","Manager.java","The Manager class, a public subclass of Unit, is responsible for managing a collection of Unit objects, which are passed to its constructor. It overrides methods to support visitor pattern interactions, allowing UnitVisitor instances to visit and process the Manager."
"JamesZBL","visitor","Unit.java","The `Unit` class is an abstract class responsible for representing a unit in a hierarchical structure, maintaining a collection of child units. It collaborates with the `UnitVisitor` class through the `beVisited` method, allowing visitors to traverse and operate on the unit hierarchy. No explicit design patterns are identified."
"JamesZBL","visitor","Application.java","The Application class serves as the entry point for the JamesZBL_visitor project, with a single public static main method that initiates the program execution. It has no explicit collaborators or design pattern roles captured in static analysis."
"spring-framework","AbstractFactory","ClientHttpRequestFactory.java","The `ClientHttpRequestFactory` interface defines a contract for creating `ClientHttpRequest` objects, facilitating the generation of HTTP requests. It collaborates with `URI` and `HttpMethod` to specify request details. No explicit design pattern roles are captured in static analysis."
"spring-framework","AbstractFactory","AutowireCapableBeanFactory.java","The `AutowireCapableBeanFactory` interface extends `BeanFactory` and defines methods for creating and autowiring beans. It specifies constants for different autowire modes and a suffix for original instances. It collaborates with `Class` objects and bean instances, managing their creation and configuration. No explicit design patterns are identified."
"spring-framework","AbstractFactory","HierarchicalBeanFactory.java","The HierarchicalBeanFactory interface extends BeanFactory, indicating its responsibility in managing beans within a hierarchical structure. It collaborates with another BeanFactory instance as its parent, facilitating bean inheritance. The interface provides methods to access the parent factory and check for local bean existence, without explicit design pattern roles."
"spring-framework","AbstractFactory","ListableBeanFactory.java","The `ListableBeanFactory` interface extends `BeanFactory` and is responsible for providing methods to inspect and query the bean definitions within a Spring IoC container. It collaborates with `ObjectProvider` and `ResolvableType` to facilitate type-based bean retrieval and inspection. No explicit design patterns are captured in static analysis."
"spring-framework","Adapter","IsolationLevelDataSourceAdapter.java","The `IsolationLevelDataSourceAdapter` class extends `UserCredentialsDataSourceAdapter` to adapt a `DataSource` to support transaction isolation levels. It maintains an isolation level and provides methods to set and retrieve it. The class uses a static map for isolation level constants and collaborates with `TransactionDefinition` for isolation level values."
"spring-framework","Adapter","HttpRequestHandlerAdapter.java","The `HttpRequestHandlerAdapter` class implements the `HandlerAdapter` interface, indicating its role in adapting HTTP request handling. It collaborates with `HttpServletRequest` and `HttpServletResponse` to process requests and generate `ModelAndView` responses, supporting specific handler types. No explicit design patterns are identified."
"spring-framework","Adapter","SimpleControllerHandlerAdapter.java","The `SimpleControllerHandlerAdapter` class implements the `HandlerAdapter` interface, indicating its role in adapting handlers within the Spring framework. It is responsible for checking if it supports a given handler and processing requests by invoking the appropriate handler methods."
"spring-framework","Adapter","MethodBeforeAdviceAdapter.java","The MethodBeforeAdviceAdapter class implements the AdvisorAdapter and Serializable interfaces, facilitating the adaptation of MethodBeforeAdvice into a MethodInterceptor. It collaborates with Advice and Advisor, determining support for advice and providing an interceptor, without explicit design pattern roles."
"spring-framework","Decorator","BufferingClientHttpResponseWrapper.java","The `BufferingClientHttpResponseWrapper` class, implementing `ClientHttpResponse`, wraps a `ClientHttpResponse` to buffer the response body. It delegates status code, status text, headers, and body retrieval to the wrapped response, storing the body in a volatile byte field. It overrides the `close` method. No design patterns are explicitly captured."
"spring-framework","Decorator","ContentCachingRequestWrapper.java","The `ContentCachingRequestWrapper` class extends `HttpServletRequestWrapper` to cache the content of an HTTP request. It collaborates with `FastByteArrayOutputStream` to store the cached content and manages `ServletInputStream` and `BufferedReader` for reading the request data. It overrides methods to provide cached content. No explicit design pattern is identified."
"spring-framework","Decorator","ScopedProxyBeanDefinitionDecorator.java","The ScopedProxyBeanDefinitionDecorator class implements the BeanDefinitionDecorator interface, responsible for decorating bean definitions within the Spring framework. It utilizes a static constant for proxy target class identification and overrides the decorate method to modify bean definitions."
"spring-framework","Decorator","WebSocketHandlerDecorator.java","The `WebSocketHandlerDecorator` class implements the `WebSocketHandler` interface, acting as a decorator to add responsibilities to a `WebSocketHandler` instance. It collaborates with a single `WebSocketHandler` delegate, which it wraps and delegates operations to. The class provides methods to access the delegate and unwrap handlers."
"spring-framework","Facade","RestTemplate.java","The `RestTemplate` class is a public client-side HTTP access template that implements the `RestOperations` interface and extends `InterceptingHttpAccessor`. It is responsible for executing HTTP requests and handling responses, utilizing message converters for data conversion and an error handler for response errors. It collaborates with `HttpMessageConverter`, `ResponseErrorHandler`, and `UriTemplateHandler` to facilitate these operations. No explicit design patterns are captured in static analysis."
"spring-framework","Facade","TransactionTemplate.java","The TransactionTemplate class, implementing TransactionOperations and InitializingBean, serves as a template for transactional operations. It collaborates with PlatformTransactionManager to manage transactions and DefaultTransactionDefinition for transaction definitions. It provides methods to execute transactions and handle exceptions, with no explicit design pattern roles identified."
"spring-framework","Facade","JmsTemplate.java","The `JmsTemplate` class, extending `JmsDestinationAccessor` and implementing `JmsOperations`, serves as a high-level abstraction for JMS operations. It manages default destinations, message conversion, and JMS resource access. Key collaborators include `ConnectionFactory`, `MessageConverter`, and `JmsTemplateResourceFactory`. No explicit design patterns are identified."
"spring-framework","Facade","JdbcTemplate.java","The `JdbcTemplate` class, extending `JdbcAccessor` and implementing `JdbcOperations`, serves as a core data accessor in Spring's JDBC framework, facilitating database operations. It collaborates with `DataSource` and internal methods for statement handling and result mapping, managing settings like fetch size and timeout. No explicit design patterns are captured."
"spring-framework","FactoryMethod","CronTriggerFactoryBean.java","The `CronTriggerFactoryBean` class is responsible for creating and configuring `CronTrigger` instances in the Spring Framework. It implements the `FactoryBean` pattern, providing control over the creation of `CronTrigger` objects. Key collaborators include `JobDetail`, `JobDataMap`, and `Date`, facilitating the setup of job details, data, and scheduling. It adheres to the `BeanNameAware` and `InitializingBean` interfaces for bean lifecycle management."
"spring-framework","FactoryMethod","SchedulerFactoryBean.java","The SchedulerFactoryBean class is responsible for creating and managing a Quartz Scheduler instance, implementing the FactoryBean pattern. It collaborates with SchedulerFactory and various data sources, task executors, and resource loaders. It adheres to several Spring interfaces for lifecycle management and context awareness."
"spring-framework","FactoryMethod","AdaptableJobFactory.java","The `AdaptableJobFactory` class, implementing the `JobFactory` interface, is responsible for creating and adapting job instances. It collaborates with `TriggerFiredBundle` and `Scheduler` to produce jobs, utilizing methods like `newJob`, `createJobInstance`, and `adaptJob`. No explicit design patterns are identified."
"spring-framework","FactoryMethod","JobDetailFactoryBean.java","The `JobDetailFactoryBean` class is responsible for creating and configuring `JobDetail` instances in the Spring Framework, adhering to the Factory Method pattern. It implements several Spring interfaces, including `FactoryBean`, `BeanNameAware`, `ApplicationContextAware`, and `InitializingBean`, indicating its integration with the Spring IoC container. It collaborates with `JobDataMap` to manage job-specific data."
"spring-framework","FactoryMethod","MethodInvokingJobDetailFactoryBean.java","The `MethodInvokingJobDetailFactoryBean` class is responsible for creating `JobDetail` instances for use with a scheduler, extending `ArgumentConvertingMethodInvoker` and implementing several `Aware` and `Bean` interfaces. It collaborates with a target bean, whose method will be invoked when the job is executed. The class sets up job details like name, group, and concurrency, but no explicit design patterns are captured in static analysis."
"spring-framework","Memento","SimpleApplicationEventMulticaster.java","The `SimpleApplicationEventMulticaster` class extends `AbstractApplicationEventMulticaster` and is responsible for multicasting application events. It collaborates with `Executor` for task execution and `ErrorHandler` for error management. The class does not explicitly implement any design patterns."
"spring-framework","Memento","SavepointManager.java","The `SavepointManager` interface defines a contract for managing savepoints in a system, allowing creation, rollback, and release of savepoints. It collaborates with an unspecified object type for savepoints, with no explicit design pattern roles captured in static analysis."
"spring-framework","Memento","AbstractTransactionStatus.java","The `AbstractTransactionStatus` class, implementing `TransactionStatus`, manages transaction state, including rollback and completion status. It collaborates with `SavepointManager` to handle savepoints. The class provides methods to set and check rollback and completion states, and to manage savepoints. No explicit design patterns are identified."
"spring-framework","Observer","ApplicationEventPublisher.java","The `ApplicationEventPublisher` interface defines a contract for publishing events within the Spring Framework. It declares two methods: one for publishing `ApplicationEvent` objects and another for publishing arbitrary objects as events. This interface serves as a central point for event dissemination, collaborating with event listeners. No explicit design patterns are captured in static analysis."
"spring-framework","Observer","ApplicationListener.java","The `ApplicationListener` interface, extending `EventListener`, defines a contract for listening to application events. It declares methods to handle events and check for asynchronous execution support. It collaborates with event objects and consumers, enabling event-driven programming without explicit design patterns."
