Project,Folder Name,File Name,Summary
"spring-framework","Observer","AbstractApplicationEventMulticaster.java","The `AbstractApplicationEventMulticaster` class serves as an abstract base for event multicasters, managing the registration and removal of application listeners. It collaborates with `DefaultListenerRetriever` for listener retrieval and implements `ApplicationEventMulticaster`, `BeanClassLoaderAware`, and `BeanFactoryAware` interfaces, indicating its role in event propagation and bean context awareness."
"spring-framework","Singleton","SmartInitializingSingleton.java","The `SmartInitializingSingleton` interface defines a contract for objects that require notification after all singleton beans have been instantiated in the Spring framework. It declares a single method, `afterSingletonsInstantiated()`, for this purpose, without specifying collaborators or design patterns."
"spring-framework","Singleton","DefaultSingletonBeanRegistry.java","The `DefaultSingletonBeanRegistry` class, implementing `SingletonBeanRegistry`, manages singleton beans within the Spring framework. It utilizes several concurrent maps to store and retrieve singleton objects, factories, callbacks, and early singletons. The class collaborates with `SimpleAliasRegistry` and employs a `ReentrantLock` for thread-safe operations. It does not explicitly follow a design pattern."
"spring-framework","Singleton","SingletonSupplier.java","The SingletonSupplier class is responsible for providing a singleton instance of type T, implementing the Supplier interface. It collaborates with various Supplier instances to obtain and manage the singleton instance, using a ReentrantLock for thread-safe initialization. It does not explicitly follow a design pattern."
"spring-framework","Singleton","SingletonBeanRegistry.java","The SingletonBeanRegistry interface defines a registry for managing singleton objects, allowing registration, retrieval, and enumeration of singletons. It collaborates with String for bean names and Object for singleton instances, utilizing Consumer for callback operations. No explicit design patterns are captured in static analysis."
"spring-framework","Visitor","BeanDefinitionVisitor.java","The `BeanDefinitionVisitor` class is responsible for visiting and processing various attributes of a `BeanDefinition`, utilizing a `StringValueResolver` to resolve string values. It collaborates with itself to handle different data structures like maps, sets, lists, and arrays, and resolves values. No explicit design patterns are identified."
"spring-framework","Visitor","BeanFactory.java","The `BeanFactory` interface defines a registry for containing and managing beans, providing methods to retrieve beans by name or type. It collaborates with `ObjectProvider` for bean provision. No explicit design patterns are captured in static analysis."
